[
    {
        "message": "Gemeinsam Tanzen \n\nAm Samstag 29.4\nIn Littenweiler \nSaal der Dreifaltigkeit \nHansjakobstr88 \n\nAb 19.00 Einführung \n20.30 Milonga mit Abendkasse :8.-/10.-\n\n\nWie komme ich in Kontakt und wie geht gemeinsam tanzen :\n\nEs gibt Workshops zum Thema :\nTango \nSa und So mit Anmeldung:\nTango Emotion 11.00-12.30\nTango Argentino 15.00-18.30\n\nInfos und Anmeldung über die Webseite:\n\nwww.contact-yourself.com",
        "topic_suggestions": {
            "spacy_NER": [
                "Littenweiler Saal",
                "Dreifaltigkeit",
                "Hansjakobstr88",
                "Tango Sa",
                "Tango Emotion",
                "Tango Argentino"
            ],
            "rake_keywords": [
                "Tango Emotion 11",
                "Tango Sa",
                "Gemeinsam Tanzen",
                "30 Milonga",
                "30 Infos",
                "Samstag 29",
                "Littenweiler Saal",
                "yourself",
                "Webseite",
                "Thema",
                "Kontakt",
                "komme",
                "contact",
                "com",
                "Anmeldung",
                "Abendkasse"
            ],
            "tf_IDF": [
                "Tango",
                "Tanzen",
                "Gemeinsam",
                "Dreifaltigkeit",
                "komme"
            ],
            "LDA": [
                "Tanz",
                "Infos"
            ],
            "NMF": [
                "Abend",
                "Tango",
                "Tanzen",
                "ber",
                "Tanz",
                "com",
                "Workshop",
                "Infos",
                "Anmeldung",
                "Gemeinsam"
            ],
            "common_topics": [
                "Dreifaltigkeit",
                "Littenweiler Saal",
                "Gemeinsam Tanzen",
                "Tango Sa",
                "Hansjakobstr88",
                "30 Milonga",
                "Abendkasse",
                "Workshop",
                "Samstag 29",
                "Tango Emotion",
                "Tango Argentino",
                "ber",
                "com",
                "Webseite",
                "yourself",
                "contact",
                "Anmeldung",
                "Kontakt",
                "komme",
                "Thema",
                "30 Infos"
            ],
            "chosen_topics": [
                "Gemeinsam Tanzen",
                "Tango Argentino",
                "Tango Emotion",
                "Tango",
                "Milonga",
                "Workshops"
            ]
        },
        "timestamps": [
            {
                "date1": "2023-04-29",
                "clock1": "11:00",
                "date2": null,
                "clock2": "12:30"
            },
            {
                "date1": "2023-03-11",
                "clock1": "11:00",
                "date2": "2023-03-12",
                "clock2": "12:30"
            },
            {
                "date1": "2023-03-15",
                "clock1": "11:00",
                "date2": "2023-03-18",
                "clock2": "12:30"
            }
        ]
    },
    {
        "message": "360° LERNEN BEGLEITER - Fortbildung 2023 - D\n\n⚪️ Lernen     ⚪️⚪️ Fortbildung     ⚪️⚪️⚪️ Begleitung\n\n\n1. WE - Sa/So 11./12. März 2023\n🟡 Die 8 Formen des Lernens\n\n2. WE - Sa/So 20./21. Mai 2023\n🟡 Gruppen Anleiten Lernen\n\n3. WE - Fr/Sa/So 21./22./23.\n4. WE - Fr/Sa/So 28./29./30. April 2023\n🟢 Natürlich Lernen\n\n5. WE - Sa/So 20./21. Mai 2023\n🟢 Natürlich Entscheiden\n\n6. WE - Fr/Sa/So 16./17./18.\n7. WE - Fr/Sa/So 23./24./25. Juni 2023\n🟢 Natürliche Sozialität\n\n8. WE - Sa/So/Mo 29./30. April/1. Mai 2023\n🔵 Lern- u. Merktechniken\n🔵 Lernleiter, 123-Gelernt!\n\n9. WE - Sa/So 20./21. Mai 2023\n🔴 Nativ Lernen\n\n10. WE - Sa/So 17./18. Juni 2023\n🟣 Schaubildarbeit\n\n11. WE - Sa/So 15./16. Juli 2023\n🟠 Leichter Lernen\n\n12. WE - Sa/So 19./20. August 2023\n🟠 Anleiter Mentoring\n\n13. WE - Sa/So 16./17. September 2023\n🟤 360° Mathematik\n\n14. WE - Sa/So 14./15. Oktober 2023\n🟤 360° Englisch\n\n15. WE - Sa/So 18./19. Nov. 2023\n⚫️ Gründung LernOrt/ Schule\n\n\n⚪️ Infos unter @MargaritaCabodevila\n\n⚪️ 360° LERNEN\n⚪️ www.360°-Lernen.com",
        "topic_suggestions": {
            "spacy_NER": [
                "BEGLEITER",
                "Lernen 5 WE - Sa"
            ],
            "rake_keywords": [
                "Lernens 2 WE",
                "360 LERNEN BEGLEITER",
                "8 Formen"
            ],
            "tf_IDF": [
                "Fr/Sa/So",
                "LERNEN",
                "Sa/So",
                "Mai",
                "Fortbildung"
            ],
            "LDA": [
                "Lernen"
            ],
            "NMF": [
                "Gruppen",
                "Gruppe",
                "LERNEN",
                "Mai",
                "Natürliche",
                "leitung",
                "BEGLEITE"
            ],
            "common_topics": [
                "Fortbildung",
                "Fr/Sa/So",
                "BEGLEITER",
                "LERNEN",
                "leitung",
                "8 Formen",
                "Gruppen",
                "Mai",
                "Natürliche"
            ],
            "chosen_topics": [
                "360 LERNEN BEGLEITER",
                "Fortbildung"
            ]
        },
        "timestamps": [
            {
                "date1": "2023-03-11",
                "clock1": null,
                "date2": "2023-03-12",
                "clock2": null
            },
            {
                "date1": "2023-05-20",
                "clock1": null,
                "date2": "2023-05-21",
                "clock2": null
            },
            {
                "date1": "2023-04-23",
                "clock1": null,
                "date2": null,
                "clock2": null
            },
            {
                "date1": "2023-04-29",
                "clock1": null,
                "date2": "2023-04-30",
                "clock2": null
            },
            {
                "date1": "2023-07-18",
                "clock1": null,
                "date2": null,
                "clock2": null
            },
            {
                "date1": "2024-06-23",
                "clock1": null,
                "date2": "2023-06-25",
                "clock2": null
            },
            {
                "date1": "2023-05-01",
                "clock1": null,
                "date2": null,
                "clock2": null
            },
            {
                "date1": "2023-06-17",
                "clock1": null,
                "date2": "2023-06-18",
                "clock2": null
            },
            {
                "date1": "2023-07-15",
                "clock1": null,
                "date2": "2023-07-16",
                "clock2": null
            },
            {
                "date1": "2023-08-19",
                "clock1": null,
                "date2": "2023-08-20",
                "clock2": null
            },
            {
                "date1": "2023-09-16",
                "clock1": null,
                "date2": "2023-09-17",
                "clock2": null
            },
            {
                "date1": "2023-10-14",
                "clock1": null,
                "date2": "2023-10-15",
                "clock2": null
            },
            {
                "date1": "2023-11-18",
                "clock1": null,
                "date2": "2023-11-19",
                "clock2": null
            }
        ]
    },
    {
        "message": "🌹Sensual Medicine Retreat 🌹\n14.—16-April in den Vogesen\n\n🤎 Medizin & Schwitzhütte\n💚 Natur Begegnung & Gemeinschaft\n🧡 Forschungsfeld der Polaritäten\n💙 Berührung & Feiern\n💛 Singen & Tanzen\n❤️ Reinigung & Heilung\n\nWir laden dich zu einem erneuernden Frühlings Retreat in die Vogesen ein.\n\nUnser Ruf ist es, mit heilender Absicht\n in die Ebene von Berührung & Berührbarkeit einzutauchen.\n\nEingebettet in einen Rahmen von Kreiskultur und Zeremonien erforschen wir uns in unserem Mann-Sein & Frau-Sein. Wir leben unsere Magnetismen, die Anziehungen und die Abstoßungen und erkunden was wir tun können um uns tief zu berühren & berühren zu lassen.\n\nWir navigieren die Balance aus Freude und Schmerz, Gewohnheit und der Präsenz im gegenwärtigen Moment, unserem göttlichen Wesen und unserem traumatisierten Ich.\n\nMit einem wachen & offenen Geist, mit einem fühlendem Herz und mit spürenden Körpersinnen loten wir dieses Feld in uns und im Kreis aus.\n\nHINTERGRUND:\nWir bedienen uns dabei an Praktiken aus der schamanischen & tantrischen & bewussten Arbeit und verwandeln diese in Formate, die unserem Anliegen dienen. Alles darf sein und nichts muss.\n\nFÜR WEN?\nWir wünschen uns für diesen Raum Menschen, die Freude haben am Experimentieren, die offen sind für Berührung im consent & bereit sind, ihre Gefühle und Grenzen auszudrücken. Du bist willkommen mit allem was du bist.\n\nWO?\n\"Maison de la Lune\" Les Grimels, Ban-Sur-Meurthe-Clefcy.\n( Auto-Fahrt von Basel/Freiburg ca 1,5 h. )\nWir verbringen die Tage in einem wunderschönen, hoch und alleine gelegenen Haus in den Vogesen, in dem wir mit ca 20 Menschen für diese Arbeit ideal untergebracht sind. Es gibt mehrere Schlafzimmer für 2-3 Personen, 2 Bäder, Seminarraum, Land außen rum ect.\n13 Bettplätze. Zelten oder Isomatte möglich.\n\nWIR:\nLuzia und Hermann halten seit vielen Jahren schamanische und transformierende Räume & haben beide viel Freude am Experiment.\n\nDEIN INVEST:\n- Für Verdienende in der Schweiz 470 CHF / Early Bird 420 CHF\n- Für Verdienende in Deutschland 370 Euro / Early Bird 320 Euro\n(incl ca 150.- Kost& Logis&Holz&Bett/Wir kochen gemeinsam. )\n40.- Reduktion bei Zelt /Isomatte.\nDie Early Bird Tickets werden bis zum 15. März bei vollständiger Buchung und Bezahlung vergeben.\n\nANMELDEN:\nAnmeldung. PN an Hermann. @herman_p\nh.posch@t-online.de\n\nCONNECT:\nLink zu Hermanns Gruppe\nhttps://t.me/+69Pi2FzFQuJkYmU6\nwww.hermannposch.de\n\nWebsite Luzia:\nwww.luziaschucan.com\n\nVoller Vorfreude\nLuzia und Hermann",
        "topic_suggestions": {
            "spacy_NER": [
                "Vogesen",
                "Sensual Medicine Retreat"
            ],
            "rake_keywords": [
                "erneuernden Frühlings Retreat",
                "Zeremonien erforschen",
                "Vogesen",
                "heilender Absicht",
                "Ruf",
                "Rahmen",
                "Mann",
                "laden",
                "Kreiskultur",
                "Frau",
                "Ebene",
                "April"
            ],
            "tf_IDF": [
                "Retreat",
                "Berührung",
                "Vogesen",
                "erneuernden",
                "Polaritäten",
                "Schwitzhütte",
                "Kreiskultur",
                "Mann-Sein"
            ],
            "LDA": [
                "Frühling",
                "Retreat",
                "Vogesen"
            ],
            "NMF": [
                "Vogesen",
                "Retreat",
                "Berührung",
                "Reinigung",
                "Mann",
                "Natur"
            ],
            "common_topics": [
                "Vogesen",
                "Retreat",
                "Berührung",
                "Schwitzhütte",
                "Polaritäten",
                "Reinigung",
                "Kreiskultur",
                "Frühling",
                "heilender Absicht",
                "Zeremonien erforschen",
                "Mann-Sein",
                "Natur",
                "April",
                "erneuernden",
                "laden",
                "Ruf",
                "Ebene",
                "Rahmen",
                "Frau"
            ],
            "chosen_topics": [
                "Sensual Medicine Retreat",
                "Frühlings Retreat",
                "Retreat",
                "Kreiskultur",
                "Medizin",
                "Schwitzhütte"
            ]
        },
        "timestamps": [
            {
                "date1": "2023-04-14",
                "clock1": null,
                "date2": "2023-04-16",
                "clock2": null
            },
            {
                "date1": "2023-03-15",
                "clock1": null,
                "date2": null,
                "clock2": null
            }
        ]
    },
    {
        "message": "Ihr Lieben,\nAm Freitag spielen wir ein Konzert in der Tanzhalle Freiburg. Wir haben einen ganz besonderen Voract: Unser Freund Freddy von Eucalypdos tritt zum ersten Mal mit seinem neuen Soloprojekt „Yunis“ auf und stimmt den Abend ein. Er spielt mit Handpan, Gesang, Rap und Gitarre Musik vom Feinsten. Für uns wird es ein besonderes Konzert, weil es der erste Tag für uns wird, an dem wir wieder im Van leben. Quasi unser offizieller Tourstart 😊\nWir treten mit Loopstation, Gitarre, E-Gitarre, Bass, Saxophon, Klarinette, Indianischer Flöte und elektronischen Beats auf. \n\n✨24. März 2023 ✨\nKonzert Tanzhalle Freiburg\n\nInfos und Anmeldung: https://www.ahawamusic.de/tanzhalle_24-3/\n\n19 Uhr Einlass \n19:30 Uhr Vorband Yunis\n20 Uhr AHAWA Konzert\n\nAbendkasse: 12-22 Euro (du entscheidest was du geben möchtest)\n\nHier gehts zu unserem Album: https://open.spotify.com/album/3p5kXOFh88UxwMMFPAjEMY?si=cP0m6qHbTbKdKgvMVS_7Lw",
        "topic_suggestions": {
            "spacy_NER": [
                "Tanzhalle Freiburg",
                "Yunis",
                "Quasi"
            ],
            "rake_keywords": [
                "Van leben Quasi",
                "Tanzhalle Freiburg",
                "offizieller Tourstart",
                "Freund Freddy",
                "Freitag spielen",
                "Eucalypdos tritt",
                "besonderes Konzert",
                "Gitarre Musik",
                "Konzert",
                "Gitarre",
                "treten",
                "stimmt",
                "spielt",
                "Rap",
                "Loopstation",
                "Lieben",
                "Handpan",
                "Gesang",
                "Feinsten",
                "Bass",
                "Abend"
            ],
            "tf_IDF": [
                "Konzert",
                "tritt",
                "Soloprojekt",
                "spielt",
                "offizieller",
                "Handpan,",
                "Quasi"
            ],
            "LDA": [],
            "NMF": [
                "besonderen",
                "Gesang",
                "Musik",
                "spielen",
                "Gitarre",
                "Konzert",
                "spielt"
            ],
            "common_topics": [
                "Tanzhalle Freiburg",
                "besonderes Konzert",
                "Gitarre Musik",
                "Soloprojekt",
                "Freund Freddy",
                "Eucalypdos tritt",
                "Quasi",
                "Handpan,",
                "Yunis",
                "Freitag spielen",
                "Rap",
                "offizieller Tourstart",
                "Gesang",
                "Loopstation",
                "besonderen",
                "Lieben",
                "Bass",
                "Feinsten",
                "treten",
                "stimmt",
                "Abend",
                "spielt"
            ],
            "chosen_topics": [
                "Ahawa Konzert",
                "Konzert",
                "AHAWA",
                "Gitarre Musik"
            ]
        },
        "timestamps": [
            {
                "date1": "2023-03-24",
                "clock1": "19:00",
                "date2": null,
                "clock2": null
            }
        ]
    },
    {
        "message": "Ich freue mich morgen Katinka als Mitmusikerin bei der ALIVE Jam zu begrüßen. Mit Flöte und Saxofon wird sie ihre Klänge in unser Feld hineinweben 🌞😊🙏 \n\nALIVE Contact Jam w/ Live Music\nFreitag, 24. März 19 Uhr im MOVE \nmit Klaus Donarski & Special Guest Katinka (Flöte, Sax)\n\nDie Alive Jam öffnet den Raum für ein achtsames hinein Lauschen, dieses feine Spüren und der Spur deiner Impulse Folgen. Mit Musik und Tanz, die aus einem Raum der Stille entstehen, laden wir das Leben ein durch uns zu fließen.\n\nORT MOVE – Fabrik, Habsburgerstr. 9, 79104 Freiburg (Zugang von hinten über Aussentreppe in den 1. Stock)\nMEHR INFOS www.embodylove.de/alive-contact-jam\nTelegram Gruppe: https://t.me/embodylove",
        "topic_suggestions": {
            "spacy_NER": [
                "ALIVE Jam",
                "MOVE",
                "ALIVE Contact Jam"
            ],
            "rake_keywords": [
                "Alive Jam öffnet",
                "Live Music Freitag",
                "achtsames hinein Lauschen",
                "ALIVE Jam",
                "Stille entstehen",
                "Impulse Folgen",
                "feine Spüren",
                "Flöte",
                "Tanz",
                "Spur",
                "Saxofon",
                "Sax",
                "Raum",
                "musik",
                "MOVE",
                "Mitmusikerin",
                "Leben",
                "laden",
                "Klänge",
                "freue",
                "fließ",
                "begrüßen"
            ],
            "tf_IDF": [
                "ALIVE",
                "Jam",
                "Katinka",
                "Raum",
                "feine",
                "hineinweben",
                "Special",
                "Lauschen,",
                "Flöte",
                "Mitmusikerin"
            ],
            "LDA": [],
            "NMF": [
                "LIVE",
                "Don",
                "ALIVE",
                "Jam",
                "Flöte",
                "Katinka",
                "Raum"
            ],
            "common_topics": [
                "Flöte",
                "Katinka",
                "ALIVE Jam",
                "Jam",
                "Mitmusikerin",
                "MOVE",
                "hineinweben",
                "Saxofon",
                "Special",
                "Don",
                "Klänge",
                "Lauschen,",
                "Impulse Folgen",
                "begrüßen",
                "feine Spüren",
                "fließ",
                "freue",
                "Tanz",
                "Stille entstehen",
                "Spur",
                "laden",
                "Leben",
                "Raum"
            ],
            "chosen_topics": [
                "ALIVE Contact Jam",
                "ALIVE Jam",
                "Jam"
            ]
        },
        "timestamps": [
            {
                "date1": "2023-03-24",
                "clock1": "19:00",
                "date2": null,
                "clock2": null
            }
        ]
    },
    {
        "message": "Am Samstag, 25.3.23 können bis zu 3 Interessierte Menschen mit mir mitfahren zu diesem Informationsabend über Effektive Mikroorganismen. Sehr interessant für alle, die mit diesen intelligenten Mikroorganismen putzen, gärtnern und Wohlbefinden verbessern möchten. Schreibe mir, wenn Du gerne dabei sein möchtest.\nLos geht es um 16 Uhr in Freiburg, Rückfahrt gegen 21 Uhr. 🍀",
        "topic_suggestions": {
            "spacy_NER": [
                "Freiburg"
            ],
            "rake_keywords": [
                "möchtest Los geht",
                "intelligenten Mikroorganismen putzen",
                "3 Interessierte Menschen",
                "Effektive Mikroorganismen",
                "gerne dabei",
                "21 Uhr",
                "16 Uhr",
                "Samstag",
                "Rückfahrt",
                "mitfahren",
                "interessant",
                "Informationsabend",
                "gärtnern",
                "Freiburg"
            ],
            "tf_IDF": [
                "Mikroorganismen",
                "Wohlbefinden",
                "Rückfahrt",
                "Effektive",
                "verbessern",
                "putzen,",
                "intelligenten",
                "Informationsabend"
            ],
            "LDA": [],
            "NMF": [
                "gerne",
                "Mikroorganismen",
                "Effektive",
                "Rückfahrt",
                "interessant"
            ],
            "common_topics": [
                "Effektive Mikroorganismen",
                "Mikroorganismen",
                "Informationsabend",
                "mitfahren",
                "Rückfahrt",
                "intelligenten",
                "putzen,",
                "Wohlbefinden",
                "Freiburg",
                "Samstag",
                "verbessern",
                "interessant",
                "gerne dabei",
                "gärtnern",
                "16 Uhr",
                "21 Uhr"
            ],
            "chosen_topics": [
                "Effektive Mikroorganismen",
                "Mikroorganismen",
                "Informationsabend"
            ]
        },
        "timestamps": [
            {
                "date1": "2023-03-25",
                "clock1": "16:00",
                "date2": null,
                "clock2": "21:00"
            }
        ]
    },
    {
        "message": "Contango Tanz in das Sommerhalbjahr :\n\nDanke an ALLE! Schön ihr euch für Sa.25.3 angemeldet habt so beginnen wir diese Woche !!\n\nAktuelles :\n\nSamstags Contact Tango Kurs 17.00-19.00 regelmäßig mit Tanzkarte Vergünstigung möglich \n\nTango mit Caroline und Stefan 29./30.5\n\nContango Reise 27.5-3.6 mit Ezequiel und Lo nach Italien \n\nContango im Brunnen wird noch bekannt gegeben !!!\nTango mit Rafael 7-9.7\n\nPreworkshop mit Gabi Contango 12-14.7\n\nFestival 14.-16.7\n\nLeilani und Miguel WE 15.-17.9\n\nAnmeldungen\nwww.contact-yourself.com",
        "topic_suggestions": {
            "spacy_NER": [
                "Italien Contango",
                "Preworkshop",
                "Contango Tanz",
                "Danke an",
                "Contact Tango Kurs"
            ],
            "rake_keywords": [
                "Gabi Contango 12",
                "3 angemeldet habt",
                "Rafael 7",
                "Italien Contango",
                "Contango Tanz",
                "7 Preworkshop",
                "7 Leilani",
                "Woche Aktuelles",
                "9 Anmeld",
                "00 regelmäßig",
                "Sommerhalbjahr",
                "Schön",
                "Ezequiel",
                "Danke",
                "Caroline",
                "Brunnen",
                "beginnen"
            ],
            "tf_IDF": [
                "Contango",
                "tango",
                "Rafael",
                "Aktuelles",
                "beginnen",
                "Ezequiel",
                "gegeben"
            ],
            "LDA": [
                "Kurs"
            ],
            "NMF": [
                "Kurs",
                "Contango",
                "geben",
                "Festival"
            ],
            "common_topics": [
                "Contango Tanz",
                "Ezequiel",
                "Italien Contango",
                "Sommerhalbjahr",
                "Kurs",
                "00 regelmäßig",
                "Caroline",
                "Rafael 7",
                "7 Preworkshop",
                "Festival",
                "Brunnen",
                "7 Leilani",
                "9 Anmeld",
                "Danke an",
                "Woche Aktuelles",
                "Schön",
                "beginnen",
                "gegeben"
            ],
            "chosen_topics": [
                "Contango Tanz",
                "Contact Tango Kurs",
                "Contango",
                "Tanz"
            ]
        },
        "timestamps": [
            {
                "date1": "2023-03-25",
                "clock1": "17:00",
                "date2": null,
                "clock2": "19:00"
            },
            {
                "date1": "2023-05-29",
                "clock1": "17:00",
                "date2": "2023-05-30",
                "clock2": "19:00"
            },
            {
                "date1": "2023-05-27",
                "clock1": "17:00",
                "date2": "2023-06-03",
                "clock2": "19:00"
            },
            {
                "date1": "2023-07-07",
                "clock1": "17:00",
                "date2": "2023-07-09",
                "clock2": "19:00"
            },
            {
                "date1": "2023-07-12",
                "clock1": "17:00",
                "date2": "2023-07-14",
                "clock2": "19:00"
            },
            {
                "date1": "2023-07-14",
                "clock1": "17:00",
                "date2": "2023-07-16",
                "clock2": "19:00"
            },
            {
                "date1": "2023-09-15",
                "clock1": "17:00",
                "date2": "2023-09-17",
                "clock2": "19:00"
            }
        ]
    },
    {
        "message": "✨Herzliche Einladung zum 2. Venustempel-Abend✨ \n\nNach dem schönen Auftakt im Februar findet morgen, am 25. März der nächste Venustempel-Abend für Frauen statt. Es gibt noch ein paar freie Plätze! \n\n💋 Hast du dir schon öfters mal vorgestellt oder sehnst dich danach, eine Frau sinnlich zu berühren, ihre zärtlichen Berührungen zu empfangen oder sie zu küssen?\n\n💋 Und dich gefragt, wie und wo du gleichgesinnte Frauen kennenlernen könntest? \n\n💋 Und vielleicht spürst du dabei auch eine leichte Nervosität?\n\nDer Venustempel ist ein sicher gehaltener Raum, wo du gleichgesinnten Frauen begegnen und im achtsamen Konsens Sinnlichkeit miteinander erkunden kannst. Hier bist du willkommen mit deiner Neugierde und deiner Lust - genauso wie mit all deinen Unsicherheiten, Fragezeichen und deinen Grenzen!\n\nIm ersten Teil des Abends begegnest du anderen Frauen im Sharing und kommst ihnen in verschiedenen Wertschätzungsritualen und Konsens-Übungen näher. Dabei übst du, deine Wünsche nach Kontakt klar zu kommunizieren und bewusst „ja“ oder „nein“ zu sagen. \n\nAnschließend geht es nach und nach in einen freien Flow miteinander über. In diesem zweiten Teil des Abends gibt es verschiedene Bereiche: für Massagen, fürs Kuscheln und für sinnlich-erotische Begegnungen. Du entscheidest jederzeit selbst was für dich stimmig ist und welche Schritte du gehen möchtest. Der Raum wird dabei die ganze Zeit energetisch gehalten. Und du kannst dich jederzeit in einen Auszeit-Bereich zurückziehen, wenn du Raum für dich brauchst. \n\n✨„Es waren so tolle Frauen da, die Stimmung war sehr schön und du hast den Raum wunderbar gestaltet. Es war super, dass du immer wieder daran erinnert hast, bei mir selbst zu bleiben und immer wieder zu schauen, was ich möchte. Ich fand den Raum sehr sicher und habe mich sehr wohl gefühlt. Ich habe genau das mitgenommen, was ich in dem Moment brauchte. Dank eures liebevollen und achtsamen Raumhaltens.“ ✨\n(Judith nach dem 1. Venustempel-Abend)\n\nHast du Lust auf solch eine Erfahrung?\n\nDann bist du herzlich willkommen:\n\n✨Termin✨ \nSamstag, 25. März 2023, 19:00-23:30 Uhr\n\n✨Ort✨ \nIn einem wunderschönen Raum im Herzen Freiburgs. Den genauen Ort erfährst du nach Anmeldung.\n\n✨Dein Beitrag✨\n45€ ermäßigt, 50-55€ regulär, 60€ Supporter (falls das für dich nicht finanzierbar ist, finden wir einen Weg)\n\n✨Leitung✨\nJulia Venus\nCoaching und Prozessbegleitung | Schwesternkreise | Sinnliche Begegnungsräume für Frauen\n\n✨Anmeldung und Kontakt für Fragen✨\ninfo@julia-venus.de |\n0163 6838994\n\nVon Herzen und in Vorfreude❣️\nJulia",
        "topic_suggestions": {
            "spacy_NER": [],
            "rake_keywords": [
                "Februar findet morgen",
                "Frauen statt",
                "zärtlichen Berührungen",
                "schönen Auftakt",
                "nächste Venustempel",
                "leichte Nervosit",
                "Herzliche Einladung",
                "Frau sinnlich",
                "25 März",
                "2 Venustempel",
                "sehnst",
                "küssen",
                "gefragt",
                "empfangen",
                "berühren",
                "Abend"
            ],
            "tf_IDF": [
                "Venustempel-Abend",
                "Frauen",
                "sinnlich",
                "Februar",
                "Auftakt",
                "könntest"
            ],
            "LDA": [],
            "NMF": [
                "Herz",
                "Frauen",
                "kennenlernen",
                "Venustempel",
                "stell",
                "berühren"
            ],
            "common_topics": [
                "Venustempel-Abend",
                "schönen Auftakt",
                "Herzliche Einladung",
                "berühren",
                "2 Venustempel",
                "nächste Venustempel",
                "Frau sinnlich",
                "Februar",
                "zärtlichen Berührungen",
                "kennenlernen",
                "küssen",
                "leichte Nervosit",
                "Frauen statt",
                "25 März",
                "empfangen",
                "stell",
                "sehnst",
                "könntest",
                "gefragt"
            ],
            "chosen_topics": [
                "Venustempel-Abend",
                "Venustempel",
                "Frauen"
            ]
        },
        "timestamps": [
            {
                "date1": "2023-03-25",
                "clock1": "19:00",
                "date2": null,
                "clock2": "23:30"
            }
        ]
    },
    {
        "message": "Mantrasingen am Samstag, 25.3.23 um 20.00 Uhr in der Yogaakademie, Brombergstr.17c in Freiburg-Wiehre.  Wir singen an diesem Abend zu jedem Chakra ein passendes Mantra/Lied, ein kraftvolles Singritual mit anschließenderStille. Alle sind herzlich willkommen. Infos auch unter www.mantra-yoga-fr.de. Herzliche Grüße Walter",
        "topic_suggestions": {
            "spacy_NER": [
                "anschließenderStille",
                "Freiburg-Wiehre"
            ],
            "rake_keywords": [
                "herzlich willkommen Infos",
                "kraftvolles Singritual",
                "00 Uhr",
                "passendes Mantra",
                "Mantra",
                "Yogaakademie",
                "Yoga",
                "Wiehre",
                "singen",
                "Samstag",
                "Mantrasingen",
                "Lied",
                "Freiburg",
                "Chakra",
                "Brombergstr",
                "anschließenderStille",
                "Abend",
                "17c"
            ],
            "tf_IDF": [
                "Yogaakademie,",
                "Freiburg-Wiehre",
                "anschließenderStille",
                "Mantrasingen",
                "Mantra/Lied,",
                "Walter",
                "passendes",
                "Chakra",
                "kraftvolles"
            ],
            "LDA": [
                "Yoga"
            ],
            "NMF": [
                "Yoga",
                "Mantra",
                "passendes",
                "17c",
                "Wiehre",
                "ritual",
                "kraft"
            ],
            "common_topics": [
                "Yogaakademie,",
                "Mantrasingen",
                "Freiburg-Wiehre",
                "17c",
                "anschließenderStille",
                "Chakra",
                "00 Uhr",
                "Brombergstr",
                "Mantra/Lied,",
                "passendes Mantra",
                "kraftvolles Singritual",
                "Walter",
                "Samstag",
                "Abend"
            ],
            "chosen_topics": [
                "Mantrasingen",
                "kraftvolles Singritual",
                "Singritual"
            ]
        },
        "timestamps": [
            {
                "date1": "2023-03-25",
                "clock1": "20:00",
                "date2": null,
                "clock2": "20:00"
            }
        ]
    },
    {
        "message": "EARTH HOUR 2023 - Am Sa., 25.3.2023 um 20:30 Uhr (CEST) ein Stunde das Licht ausschalten als Zeichen für Klimaschutz - Bist du auch dabei? 🌏💙",
        "topic_suggestions": {
            "spacy_NER": [
                "EARTH",
                "HOUR"
            ],
            "rake_keywords": [
                "30 Uhr CEST",
                "Licht ausschalten",
                "Zeichen",
                "Stunde",
                "Klimaschutz"
            ],
            "tf_IDF": [
                "Klimaschutz",
                "HOUR",
                "Stunde",
                "CEST",
                "Zeichen",
                "Sa.,",
                "ausschalten"
            ],
            "LDA": [],
            "NMF": [
                "EARTH",
                "Zeichen",
                "Stunde",
                "HOUR",
                "ausschalten"
            ],
            "common_topics": [
                "HOUR",
                "EARTH",
                "Licht ausschalten",
                "Sa.,",
                "Klimaschutz",
                "CEST",
                "Stunde",
                "Zeichen"
            ],
            "chosen_topics": [
                "EARTH HOUR 2023",
                "EARTH HOUR",
                "EARTH",
                "HOUR",
                "Klimaschutz"
            ]
        },
        "timestamps": [
            {
                "date1": "2023-03-25",
                "clock1": "20:30",
                "date2": null,
                "clock2": "20:30"
            }
        ]
    },
    {
        "message": "Liebe Consious Gemeinschaft,\n\nda ich so viel schönes aus dieser Gruppe ziehe 🥭🐛🦋 möchte ich allen die Lust auf Paartanz, Begegnung, spüren & erleben haben, meinen absoluten Lieblingstanz wärmstens empfehlen mal live an diesem oder anderst wann  kennen zu lernen!\n\ndarum weitergeleitet von Zoukarium: \nProbier was Neues aus - Brazilian Zouk! Unser Schnupper-Tag ist für Tänzer:innen, die noch keine Zouk-Erfahrungen haben. In drei Stunden zeigen wir euch die Grundlagen, die ihr anschließend gleich im „Social“ üben & ausprobieren könnt.\n\nTermin: Sonntag, 26. März\nBootcamp: 13:00 - 16:00 Uhr\nZouk Social: 16:00 - 18:00 Uhr\nOrt: Schwimmbadstr. 23, \nFreiburg\nPreis: 15€ / 20€ \n\nWir freuen uns auf euch beim Zouk Schnupper-Tag!\nwww.zoukarium.com/events\"\n\nund hier noch 2 Videos, die die besondere Connection dieses vielfältigen Tanzes & der Freiburger Community für mich gut wiederspiegeln:\n\nhttps://m.youtube.com/watch?v=tG7MnEFujnc\nhttps://m.youtube.com/watch?v=-D6OnZ03b_4\n\nlasst euch verzaubern & genießt die Magie selbst ✨",
        "topic_suggestions": {
            "spacy_NER": [
                "Liebe Consious Gemeinschaft"
            ],
            "rake_keywords": [
                "Liebe Consious Gemeinschaft",
                "lernen darum weitergeleitet",
                "Gruppe ziehe möchte",
                "anderst wann kennen",
                "spüren erleben",
                "anschließend gleich",
                "Brazilian Zouk",
                "Zouk",
                "Zoukarium",
                "Tänzer",
                "schönes",
                "Schnupper",
                "Probier",
                "Paartanz",
                "Neues",
                "Lust",
                "innen",
                "Grundlagen",
                "Erfahrungen",
                "Begegnung"
            ],
            "tf_IDF": [
                "zeigen",
                "wärmstens",
                "Zouk",
                "Zouk-Erfahrungen",
                "Zoukarium:",
                "schönes",
                "Begegnung,"
            ],
            "LDA": [
                "wärmstens"
            ],
            "NMF": [
                "Zouk",
                "Zoukarium"
            ],
            "common_topics": [
                "Zoukarium:",
                "Begegnung,",
                "Paartanz",
                "Zouk-Erfahrungen",
                "Brazilian Zouk",
                "Schnupper",
                "Lust",
                "schönes",
                "Probier",
                "spüren erleben",
                "Tänzer",
                "wärmstens",
                "innen",
                "Grundlagen",
                "zeigen",
                "Neues",
                "anschließend gleich"
            ],
            "chosen_topics": [
                "Brazilian Zouk",
                "Zouk",
                "Zoukarium",
                "Paartanz",
                "Begegnung"
            ]
        },
        "timestamps": [
            {
                "date1": "2023-03-26",
                "clock1": "13:00",
                "date2": null,
                "clock2": "16:00"
            }
        ]
    },
    {
        "message": "Liebe Frauen🌹\n\nIch lade euch zu diesem nährenden und verbindenden Frauenkraftkreis am 26.03.23, 19.30 - 21.00 via Zoom ein. \n\nDiesen Monat geht es vor allem darum, wie wir unsere Gebärmutter, unser heiliges Kraftzentrum, nähren und stärken können.\nIch zeige dir eine wundervolle Gebärmuttermassage, durch die wir tief in Verbindung mit unserem Schoßraum kommen,  unsere Weiblichkeit stärken und Altes loslassen.\nDie Massage kann vor allem bei Periodenschmerzen und weiteren Zyklusbeschwerden unterstützend wirken.\n\nAnmeldung hier über Telegram oder per Mail  thewombofcreation@posteo.de.\nEnergieausgleich für diesen Workshop sind 11€-22€.✨\nDie Teilnehmerzahl ist auf 13 begrenzt.🩸\n\nDieser Workshop ist Teil der Frauenkraftkreise,die ich 1x monatl. mit unterschdl. Themen rund um Weiblichkeit, Heilung, Zyklusbewusstsein und Sinnlichkeit halte. \n\nMein Name ist Alisa -  Zykluscoach, Mizan Therapeutin und Doula und freue mich von Herzen, wenn du dabei bist!\n\nKomme gerne in unseren Kreis\nhttps://t.m/+ki56bLE8Pws1MjIy\n\nAlisa🙏",
        "topic_suggestions": {
            "spacy_NER": [],
            "rake_keywords": [
                "00 via Zoom",
                "wundervolle Gebärmuttermassage",
                "verbindenden Frauenkraftkreis",
                "Schoßraum kommen",
                "Monat geht",
                "Liebe Frauen",
                "heiliges Kraftzentrum",
                "Altes loslassen",
                "Weiblichkeit stärken",
                "stärken",
                "zeige",
                "Verbindung",
                "tief",
                "Periodenschmerzen",
                "nährenden",
                "nähren",
                "massage",
                "lade",
                "Gebärmutter"
            ],
            "tf_IDF": [
                "stärken",
                "nähren",
                "Altes",
                "unterstü",
                "Schoßraum"
            ],
            "LDA": [],
            "NMF": [
                "sag",
                "stärken",
                "Weiblichkeit",
                "schmerzen",
                "Verbindung"
            ],
            "common_topics": [
                "nährenden",
                "verbindenden Frauenkraftkreis",
                "heiliges Kraftzentrum",
                "wundervolle Gebärmuttermassage",
                "Schoßraum kommen",
                "Weiblichkeit stärken",
                "Altes loslassen",
                "unterstü",
                "Periodenschmerzen",
                "Liebe Frauen",
                "lade",
                "Monat geht",
                "zeige",
                "tief",
                "Verbindung"
            ],
            "chosen_topics": [
                "Frauenkraftkreis",
                "verbindenden Frauenkraftkreis"
            ]
        },
        "timestamps": [
            {
                "date1": "2023-03-26",
                "clock1": "19:30",
                "date2": null,
                "clock2": "21:00"
            }
        ]
    },
    {
        "message": "🌺 Spontan Helfer gesucht für Yoga Festival in Überlingen.\n\n29.3.-31.3.\n\nFalls ihr lust habt an dem Yoga Festival teilzunehmen und im Gegenzug etwas mithelfen könnt, meldet euch gerne bei mir. \nÜbernachten in der Yoga Shala möglich, mit den anderen HelferInnen. \n\nhttps://yogafestival-bodensee.de",
        "topic_suggestions": {
            "spacy_NER": [
                "Überlingen"
            ],
            "rake_keywords": [
                "Spontan Helfer gesucht",
                "Yoga Shala möglich",
                "Yoga Festival teilzunehmen",
                "Yoga Festival",
                "3 Falls",
                "Überlingen 29",
                "mithelfen könnt",
                "lust habt",
                "Übernachten",
                "meldet",
                "gerne",
                "Gegenzug",
                "bodensee"
            ],
            "tf_IDF": [
                "Yoga",
                "Festival",
                "Shala",
                "Helfer",
                "teilzunehmen",
                "Gegenzug"
            ],
            "LDA": [],
            "NMF": [
                "teilzunehmen",
                "Gegenzug",
                "bodensee"
            ],
            "common_topics": [
                "Gegenzug",
                "teilzunehmen",
                "Yoga Festival",
                "Festival",
                "Überlingen 29",
                "mithelfen könnt",
                "Shala",
                "Übernachten",
                "bodensee",
                "lust habt",
                "Helfer",
                "3 Falls",
                "meldet",
                "gerne"
            ],
            "chosen_topics": [
                "Spontan Helfer gesucht",
                "Helfer gesucht",
                "Yoga Festival",
                "Festival"
            ]
        },
        "timestamps": [
            {
                "date1": "2023-03-29",
                "clock1": null,
                "date2": "2023-03-31",
                "clock2": null
            }
        ]
    },
    {
        "message": "Liebe Yogis, Yoginis und die, die es werden möchten: \n\nEs gibt noch freie Plätze!!! \n\nMittwoch 29.3 18.00 Uhr und\nFreitag 31.3 18.30 Uhr \nbei Li On Yoga! \n\nin Littenweiler! \n\n🧘‍♀️Wir bereiten Körper und Geist meditativ vor und nach \n🧘‍♀️bewegen uns im Flow mit tänzerisch- kreativen Aufwärmelementen  \n🧘‍♀️stärken die Muskeln mit statischen Asanas. \n🧘‍♀️ du lernst deinen Atemtechniken, die dir in herausfordernden Zeiten zu mehr Gelassenheit verhelfen können.\n\nProbestunde: 10€/8€\nEinzelkurs: 14€/12€\n10er Karte: 120€/100€\n5er Karte: 65€/55€\n\nAnmeldung über p.N.! 🌸 \n\nLet’s Li On! 🌸",
        "topic_suggestions": {
            "spacy_NER": [
                "Littenweiler",
                "Einzelkurs",
                "Liebe Yogis",
                "Li On Yoga"
            ],
            "rake_keywords": [
                "Li On Yoga",
                "kreativen Aufwärmelementen stärken",
                "statischen Asanas",
                "Liebe Yogis",
                "herausfordernden Zeiten",
                "Geist meditativ",
                "Freitag 31",
                "bereiten Körper",
                "8 Einzelkurs",
                "30 Uhr",
                "00 Uhr",
                "Yoginis",
                "tänzerisch",
                "Probestunde",
                "möchten",
                "Muskeln",
                "Littenweiler",
                "lernst",
                "Flow",
                "bewegen",
                "Atemtechniken"
            ],
            "tf_IDF": [
                "meditativ",
                "statischen",
                "bereiten",
                "Gelassenheit",
                "Geist",
                "möchten:",
                "kreativen"
            ],
            "LDA": [],
            "NMF": [
                "Atem",
                "Flow",
                "Körper",
                "verhelfen",
                "Zeiten",
                "Einzelkurs"
            ],
            "common_topics": [
                "Liebe Yogis",
                "Littenweiler",
                "Flow",
                "möchten:",
                "Yoginis",
                "Geist meditativ",
                "00 Uhr",
                "kreativen",
                "statischen Asanas",
                "tänzerisch",
                "Atemtechniken",
                "8 Einzelkurs",
                "Gelassenheit",
                "Freitag 31",
                "Muskeln",
                "herausfordernden Zeiten",
                "verhelfen",
                "Probestunde",
                "bereiten Körper",
                "Körper",
                "30 Uhr",
                "bewegen",
                "lernst"
            ],
            "chosen_topics": [
                "Yoginis",
                "Geist meditativ"
            ]
        },
        "timestamps": [
            {
                "date1": "2023-03-29",
                "clock1": "18:00",
                "date2": null,
                "clock2": null
            },
            {
                "date1": "2023-03-31",
                "clock1": "18:30",
                "date2": null,
                "clock2": null
            }
        ]
    },
    {
        "message": "Traditioneller Tantra Yoga Kurs \n\nProbestunde jeden Donnerstag von 19-21:30h noch bis 13. April\n\nIm Ananda Yogazentrum, Freiburg Vauban\n\nAnmeldung über freiburg@traditionelles-yoga.de\nimmer bis Donnerstag Mittag um 14h um alle Infos zu erhalten \n\nLass dich jede Woche neu in die faszinierende Welt der uralten Tantra & Yogaweisheit begleiten\n\nErlebe im Kurs:\n\n💛Was ist Yoga und was ist Tantra und wie verbindet sich beides zu einem kraftvollen spirituellen Weg?\n\n💛 Wie die bewusste und entspannte Wahrnehmung der Lebensereignisse deine Psyche und dein Wohlbefinden beeinflusst\n\n💛 Wie Du dein ganzes Leben zu einem spirituellen Erlebnisraum kreativ entfaltest\n\n💛 Yogapraxis zur Erweckung und Dynamisierung und Harmonisierung der Chakra's und der subtilen Energiebahnen (Nadi's)\n\n💛 Lerne deine physische und subtile Struktur detailliert kennen um sie zu nutzen für den spirituellen Weg\n\n💛 Lerne deine Lehrer Karl und Irma persönlich kennen und kläre offene Fragen zum Kurs nach der Stunde\n\nBei Teilnahme an einer Probestunde bis 31.3.23 erhältst du den Gutschein \"3für2\": \n\n3 Monate Kurs besuchen und nur 2 Monate bezahlen! Also 1 Monat gratis!\n\nWeitere Informationen zum Kurs:\nhttp://traditionelles-yoga.de/traditioneller-tantra-kurs-freiburg/\n\nIn großer Vorfreude\nKarl & Irma\n\nUnsere Infogruppe:\nhttps://t.me/anandayogafreiburg",
        "topic_suggestions": {
            "spacy_NER": [
                "Freiburg Vauban",
                "freiburg",
                "Ananda Yogazentrum",
                "Tantra Yogaweisheit"
            ],
            "rake_keywords": [
                "Freiburg Vauban Anmeldung",
                "freiburg traditionelles",
                "Woche neu",
                "kraftvollen spirituellen",
                "faszinierende Welt",
                "erhalten Lass",
                "entspannte Wah",
                "de immer",
                "Ananda Yogazentrum",
                "13 April",
                "Tantra",
                "Donnerstag Mittag",
                "Kurs",
                "Yoga",
                "Donnerstag",
                "verbindet",
                "Infos",
                "bewusste",
                "beides",
                "30h",
                "14h"
            ],
            "tf_IDF": [
                "Tantra",
                "Donnerstag",
                "Yoga",
                "beides",
                "14h",
                "Vauban",
                "verbindet",
                "traditionelles-yoga.de"
            ],
            "LDA": [],
            "NMF": [
                "kraftvollen",
                "30h",
                "Tantra",
                "Donnerstag"
            ],
            "common_topics": [
                "Tantra Yogaweisheit",
                "Ananda Yogazentrum",
                "30h",
                "Donnerstag Mittag",
                "14h",
                "Freiburg Vauban",
                "traditionelles-yoga.de",
                "freiburg traditionelles",
                "faszinierende Welt",
                "Kurs",
                "kraftvollen spirituellen",
                "entspannte Wah",
                "13 April",
                "de immer",
                "verbindet",
                "erhalten Lass",
                "Woche neu",
                "bewusste",
                "Infos",
                "beides"
            ],
            "chosen_topics": [
                "Traditioneller Tantra Yoga Kurs",
                "Tantra Yogaweisheit",
                "Tantra",
                "traditionelles-yoga.de"
            ]
        },
        "timestamps": [
            {
                "date1": "2023-04-13",
                "clock1": "21:30",
                "date2": null,
                "clock2": "21:30"
            },
            {
                "date1": "2023-03-31",
                "clock1": "21:30",
                "date2": null,
                "clock2": "21:30"
            }
        ]
    },
    {
        "message": "🌹Sensual Medicine Circle 🌹\n \n31. März, 19 -22.30 Uhr in Basel \n\n🤎 Cacao & Ritual \n💙 Reinigung & Berührung\n❤️ Friedensarbeit & Celebration \n\nWir laden regelmäßig zu einer sinnlichen Medizin Arbeit mit Cacao und (wer will) Rapé ein. \n\nUnser Ruf ist es, mit heilender Absicht in die Ebene von Berührung & Berührbarkeit einzutauchen. Eingebettet in einem zeremoniellen Rahmen erforschen wir, was uns als Mann & Frau im Zusammensein anzieht oder dazwischen steht, uns tief zu berühren & berühren zu lassen. \n\nMit dem Bewusstsein einer Friedensarbeit laden wir Augenblicke von Authentizität ein und loten unsere Möglichkeiten aus, uns tief zu begegnen. \n\nWir bedienen uns dabei an Praktiken aus der schamanischen & tantrischen Arbeit, spüren die Felder von Freude und Schmerz, Gewohnheit und der Präsenz im gegenwärtigen Moment.\n\nDu bist willkommen mit allem was du bist. \n\nWir wünschen uns für diesen Raum Menschen, die Freude haben am Experimentieren, die offen sind für Berührung im consent & bereit sind, ihre Gefühle und Grenzen auszudrücken.\n\nFür Schweizer: 70 CHF\nFür Deutsche: 50 Euro\n\nAnmeldung. PN an Hermann. @herman_p\nh.posch@t-online.de\n\n\nLink zu Hermanns Gruppe \nhttps://t.me/+69Pi2FzFQuJkYmU6\nwww.hermannposch.de\n\nWebsite Luzia:\nwww.luziaschucan.com",
        "topic_suggestions": {
            "spacy_NER": [
                "Basel",
                "Sensual Medicine Circle"
            ],
            "rake_keywords": [
                "zeremoniellen Rahmen erforschen",
                "sinnlichen Medizin Arbeit",
                "Zusammensein anzieht",
                "Mann Frau",
                "laden regelmäßig",
                "heilender Absicht",
                "Cacao",
                "berühren berühren",
                "30 Uhr",
                "tief",
                "Ruf",
                "Rap",
                "lassen",
                "Ebene"
            ],
            "tf_IDF": [
                "berühren",
                "Berührung",
                "Cacao",
                "arbeit",
                "Zusammensein",
                "zeremoniellen",
                "anzieht",
                "Mann"
            ],
            "LDA": [],
            "NMF": [
                "steht",
                "Basel",
                "Cacao",
                "zeremoniellen"
            ],
            "common_topics": [
                "Cacao",
                "Basel",
                "zeremoniellen",
                "Berührung",
                "heilender Absicht",
                "Rap",
                "Zusammensein anzieht",
                "anzieht",
                "berühren berühren",
                "arbeit",
                "30 Uhr",
                "laden regelmäßig",
                "Ruf",
                "Ebene",
                "Mann Frau",
                "steht",
                "tief",
                "lassen"
            ],
            "chosen_topics": [
                "Sensual Medicine Circle",
                "Cacao Ritual",
                "Cacao & Ritual",
                "Reinigung & Berührung",
                "Reinigung Berührung",
                "zeremoniellen Rahmen erforschen",
                "sinnlichen Medizin Arbeit",
                "Reinigung",
                "Berührung"
            ]
        },
        "timestamps": [
            {
                "date1": "2023-03-31",
                "clock1": "19:00",
                "date2": null,
                "clock2": "22:30"
            }
        ]
    },
    {
        "message": "HEUTE: Contact Tango Kurs 17.00-19.00\n15.- und anschließend noch Contango tanzen plus 5.- \nFreu mich auf dich in Zarten ,Bundesstraße 16.\n\nIm Mai gibt es ConTango im NEUEN RAUM!!!\nLittenweiler 🍀\nWir starten mit Caroline u Stefan Workshop 29./30.5\nMit anschließender Milonga Jam Sa.29.5 19.30\nEinführung / Einstimmung 30 Min Lo und \nDJ Jascha !! \n\nFestival HelfertreamTreffen am 29.5\n18.30 wir verteilen die Aufgabenbereiche \nDJ Besprechung für das Festival 14.-16.Juli \n\nFrühbucherpreis noch bis zum 31.März 🙋🏻‍♀️🍀",
        "topic_suggestions": {
            "spacy_NER": [
                "Zarten",
                "Bundesstraße 16",
                "Contact Tango Kurs",
                "ConTango",
                "HelfertreamTreffen"
            ],
            "rake_keywords": [
                "Aufgabenbereiche DJ Besprechung",
                "30 Einführung",
                "Bundesstraße 16",
                "Mai gibt",
                "Juli Frühbucherpreis",
                "Contango",
                "Zarten",
                "verteilen",
                "starten",
                "anschließend"
            ],
            "tf_IDF": [
                "Contango",
                "Festival",
                "Einstimmung",
                "starten",
                "15.-",
                "Zarten"
            ],
            "LDA": [],
            "NMF": [],
            "common_topics": [
                "Zarten",
                "Contango",
                "Bundesstraße 16",
                "15.-",
                "Einstimmung",
                "Festival",
                "HelfertreamTreffen",
                "Juli Frühbucherpreis",
                "30 Einführung",
                "anschließend",
                "Mai gibt",
                "verteilen",
                "starten"
            ],
            "chosen_topics": [
                "Contact Tango Kurs",
                "Contango tanzen",
                "Contango",
                "Festival"
            ]
        },
        "timestamps": [
            {
                "date1": "2023-05-29",
                "clock1": "17:00",
                "date2": "2023-05-30",
                "clock2": "19:00"
            },
            {
                "date1": "2023-07-14",
                "clock1": "17:00",
                "date2": "2023-07-16",
                "clock2": "19:00"
            },
            {
                "date1": "2023-03-31",
                "clock1": "17:00",
                "date2": null,
                "clock2": "19:00"
            }
        ]
    },
    {
        "message": "Und neben dem Abend am 31.3. in Basel gehen wir mit dem Medizinfeld unserer Berührbarkeit für drei Tage in die Vogesen. Das Wochenende findet sicher statt und hat noch ein paar Plätze frei.",
        "topic_suggestions": {
            "spacy_NER": [
                "Basel",
                "Medizinfeld",
                "Vogesen"
            ],
            "rake_keywords": [
                "paar Plätze frei",
                "Medizinfeld unserer Berührbarkeit",
                "Basel gehen",
                "Vogesen",
                "Abend"
            ],
            "tf_IDF": [
                "sicher",
                "Medizinfeld",
                "Berührbarkeit",
                "Basel",
                "Wochenende",
                "Vogesen"
            ],
            "LDA": [],
            "NMF": [
                "sicher",
                "Medizinfeld"
            ],
            "common_topics": [
                "Medizinfeld",
                "Basel gehen",
                "Vogesen",
                "Berührbarkeit",
                "Abend",
                "Wochenende",
                "sicher"
            ],
            "chosen_topics": [
                "Medizinfeld unserer Berührbarkeit",
                "Medizinfeld",
                "Berührbarkeit",
                "Wochenende"
            ]
        },
        "timestamps": [
            {
                "date1": "2023-03-31",
                "clock1": null,
                "date2": null,
                "clock2": null
            }
        ]
    },
    {
        "message": "https://www.youtube.com/watch?v=Mg05Uyqr4rc    In diesem Video erfährst Du, was  Heilsames Besingen ist.                                                  Herzliche Einladung zum kommenden Healing Voice Ritual bei Freiburg am So 2. April  10:30h - 18:30h .  Es sind noch ein paar Plätze frei.  Infos:  https://www.bodyvoicehealing.com/event-details/healing-voice-ritual-in-freiburg-leutersberg",
        "topic_suggestions": {
            "spacy_NER": [
                "Freiburg",
                "Healing Voice Ritual"
            ],
            "rake_keywords": [
                "Video erfährst",
                "Herzliche Einladung",
                "Heilsames Besingen",
                "Voice",
                "Ritual",
                "Healing",
                "youtube",
                "leutersberg",
                "Freiburg",
                "event",
                "details",
                "com",
                "bodyvoicehealing",
                "30h"
            ],
            "tf_IDF": [
                "Video",
                "Voice",
                "Besingen",
                "Heilsames",
                "Healing",
                "erfährst"
            ],
            "LDA": [],
            "NMF": [
                "Voice",
                "Healing"
            ],
            "common_topics": [
                "Voice",
                "Healing",
                "Freiburg",
                "youtube",
                "Heilsames Besingen",
                "Besingen",
                "com",
                "Herzliche Einladung",
                "Ritual",
                "30h",
                "bodyvoicehealing",
                "event",
                "Video erfährst",
                "leutersberg",
                "erfährst",
                "details"
            ],
            "chosen_topics": [
                "Healing Voice Ritual",
                "Heilsames Besingen",
                "bodyvoicehealing"
            ]
        },
        "timestamps": [
            {
                "date1": "2023-04-02",
                "clock1": "10:30",
                "date2": null,
                "clock2": "18:30"
            }
        ]
    },
    {
        "message": "Wilde Kräuterküche am 2. April\n\nWir laden dich ein zu einer Entdeckungsreise in die heimische grüne Welt - essbaren Wildpflanzen, Bäume und Sträucher kennenlernen und verschiedene Möglichkeiten der Zubereitung kennenlernen. Gemeinsam werden wir verschiedene Gerichte am offenen Feuer zubereiten.\n\nMehr Infos hier:\nhttps://wildnisschule-schwarzwald.de/wildpflanzenkunde/wilde-kraeuterkueche-nahrung-aus-der-natur-und-kochen-am-feuer/",
        "topic_suggestions": {
            "spacy_NER": [
                "Wilde Kräuterküche"
            ],
            "rake_keywords": [
                "heimische grüne Welt",
                "Zubereitung kennenlernen Gemeinsam",
                "Sträucher kennenlernen",
                "verschiedene Möglichkeiten",
                "verschiedene Gerichte",
                "essbaren Wildpflanzen",
                "2 April",
                "Wilde Kräuterküche",
                "Feuer",
                "Wilde",
                "wildpflanzenkunde",
                "schwarzwald",
                "natur",
                "nahrung",
                "laden",
                "kraeuterkueche",
                "kochen",
                "Entdeckungsreise",
                "Bäume"
            ],
            "tf_IDF": [
                "kennenlernen",
                "verschiedene",
                "Wildpflanzen,",
                "Sträucher",
                "Zubereitung",
                "zubereiten",
                "Bäume",
                "essbaren",
                "Gerichte"
            ],
            "LDA": [],
            "NMF": [
                "Feuer",
                "Wilde",
                "verschiedene",
                "Möglichkeiten",
                "wildpflanzenkunde",
                "wald",
                "Möglichkeit",
                "schule"
            ],
            "common_topics": [
                "Wilde Kräuterküche",
                "Feuer",
                "Wildpflanzen,",
                "essbaren Wildpflanzen",
                "Sträucher kennenlernen",
                "Sträucher",
                "Entdeckungsreise",
                "Zubereitung",
                "verschiedene Möglichkeiten",
                "wildpflanzenkunde",
                "Bäume",
                "zubereiten",
                "schwarzwald",
                "kraeuterkueche",
                "nahrung",
                "2 April",
                "laden",
                "verschiedene Gerichte",
                "kochen",
                "schule",
                "natur"
            ],
            "chosen_topics": [
                "Wilde Kräuterküche",
                "essbaren Wildpflanzen"
            ]
        },
        "timestamps": [
            {
                "date1": "2023-04-02",
                "clock1": null,
                "date2": null,
                "clock2": null
            }
        ]
    },
    {
        "message": "OSTERN🔸VOLLMOND🔸MUSIZIEREN🔸GESÄNGE🔸AUFERSTEHUNG\n\n🔹 Jera  ᛃ transformation 🔹\n\nWir laden ein zu einer ganz besonderen Zeremonie mit viel Musik, Gesang, Tanz und Freude! Ein heiliger Raum für gemeinsames Musizieren, Singen und Bewegen in der Kraft der Amazonasmutter 🎶💃🏻🕺🏼💃🏻🪕🪘🥁🎶\n\nPflanzenzeremonie\nDo-Sa 6.- 8. April\nNordschwarzwald  (Bad Herrenalb)\nZwei Nächte tiefer Selbstbegegnung 💫 und Tage voller Gemeinschaft ☀️\n\n🌿😍🌿\n\nRuft dich die Kraft der Pflanzen?\nBist du bereit dich zu heilen?\n\n🌱🌿🌵🍀🌲 🌿🐍🍃\n\nTransformation. Verbindung. Neugeburt. Musik. Freude. Selbstheilung. Selbstliebe. Reinigung. Begegnung. Multidimensionalität. Licht & Schatten. Erinnern. Entfaltung. Liebe. Freiheit.\n\n🌲🌲🦨🦇🦉🌲🌲\n\nRäucherreinigungen, Rapé, Energiearbeit, Massagen, Düfte, traditionelle Bemalung, Medizinmusik und liebevolle Präsenz.\n\n🌕🔥✨🎶\n\nMehr Infos, Rapé Ausbildung & AMAZONASKULTUR @jeratransformation\nAnmeldung & Fragen @felidaya\n\nViva as medicinas 💗\nViva os povos da floresta 🌱\nHaux Haux 🙏🏻",
        "topic_suggestions": {
            "spacy_NER": [
                "Nordschwarzwald Bad Herrenalb",
                "OSTERN VOLLMOND"
            ],
            "rake_keywords": [
                "Amazonasmutter Pflanzenzeremonie Do",
                "gemeinsames Musizieren",
                "heiliger Raum",
                "heilen T",
                "Tanz",
                "Singen",
                "Pflanzen",
                "Musik",
                "laden",
                "Kraft",
                "Gesang",
                "Freude",
                "Bewegen",
                "bereit"
            ],
            "tf_IDF": [
                "Kraft",
                "Pflanzen",
                "Jera",
                "Zeremonie",
                "Nordschwarzwald",
                "Musizieren,",
                "heiliger",
                "Ruft",
                "Bad",
                "6.-"
            ],
            "LDA": [],
            "NMF": [
                "VOLLMOND",
                "MUSIZIEREN",
                "voller",
                "Nächte",
                "Ruft"
            ],
            "common_topics": [
                "OSTERN VOLLMOND",
                "Jera",
                "MUSIZIEREN",
                "Zeremonie",
                "Musizieren,",
                "gemeinsames Musizieren",
                "Nordschwarzwald",
                "6.-",
                "heiliger Raum",
                "Pflanzen",
                "Tanz",
                "Gesang",
                "Freude",
                "Singen",
                "heilen T",
                "laden",
                "Musik",
                "Bewegen",
                "Bad",
                "Nächte",
                "Kraft",
                "voller",
                "bereit",
                "Ruft"
            ],
            "chosen_topics": [
                "OSTERN VOLLMOND MUSIZIEREN GESÄNGE AUFERSTEHUNG",
                "OSTERN VOLLMOND",
                "Zeremonie",
                "Amazonasmutter Pflanzenzeremonie"
            ]
        },
        "timestamps": [
            {
                "date1": "2023-04-06",
                "clock1": null,
                "date2": "2023-04-08",
                "clock2": null
            }
        ]
    },
    {
        "message": "Drachenherz: Achtsamer Flirt- Workshop \n*offen für alle Geschlechter*\n​\nSpeeddating mit ehrlichem Feedback\n​\nLachen nicht vergessen - bei unserem grandios-humorvollen Speeddating am Karfreitag wird jede Menge positive Energie kreiert. (Roarr.) Denn das Angebot ist ein genereller Mutmach-Crashkurs für jede*n in Sozialkompetenz. Wenn du Lust hast, deine Komfortzone zu verlassen und etwas zu tun, was du noch nie getan hat - fremden Menschen Komplimente zu geben - bist du hier richtig. Wir trainieren in interaktiven Übungen ehrliche Ablehnung, ehrliche Befürwortung und all das Augenzwinkern dazwischen. Also, nimm dir ein (Drachen-)Herz und komm vorbei!\n​❤️🦖\n\nDer Flirt-Workshop basiert auf dem achtsam-feministischen \"Consent-Prinzip\" - (Ja heißt Ja!), und dem \"Prinzip der radikalen Ehrlichkeit\" (Radical Honesty nach Brad Blanton), sowie Elementen des Improvisationstheaters.\n​\nMit Moderatorin ist Valerie Schult, deren rhetorischer Hüftschwung stimmungsvoll die Flirtsaison einläuten wird.\n\n7.4., 18.30 - 20.30 Uhr, Raum der Stille, Alfred-Döblin-Platz 1, Vauban\nEintritt: 10 € \n\nhttps://www.valerieschult.de/flirtenworkshopfreiburgimbreisgau",
        "topic_suggestions": {
            "spacy_NER": [
                "Drachenherz",
                "grandios-humorvollen Speeddating",
                "Achtsamer Flirt- Workshop",
                "Karfreitag"
            ],
            "rake_keywords": [
                "fremden Menschen Komplimente",
                "ehrlichem Feedback Lachen",
                "Workshop offen",
                "Lust hast",
                "humorvollen Speeddating",
                "Geschlechter Speeddating",
                "genereller Mutmach",
                "Achtsamer Flirt",
                "verlassen",
                "vergessen",
                "trainiere",
                "Sozialkompetenz",
                "Komfortzone",
                "Karfreitag",
                "grandios",
                "geben",
                "Drachenherz",
                "Crashkurs",
                "Angebot"
            ],
            "tf_IDF": [
                "Speeddating",
                "Komfortzone",
                "Komplimente",
                "kreiert",
                "Lachen",
                "grandios-humorvollen"
            ],
            "LDA": [],
            "NMF": [
                "Speeddating",
                "Komfortzone"
            ],
            "common_topics": [
                "Geschlechter Speeddating",
                "Drachenherz",
                "Komfortzone",
                "Karfreitag",
                "Workshop offen",
                "Achtsamer Flirt",
                "grandios-humorvollen Speeddating",
                "kreiert",
                "genereller Mutmach",
                "Sozialkompetenz",
                "Komplimente",
                "Crashkurs",
                "trainiere",
                "Lachen",
                "Lust hast",
                "Angebot",
                "vergessen",
                "verlassen",
                "geben"
            ],
            "chosen_topics": [
                "Achtsamer Flirt- Workshop",
                "Geschlechter Speeddating",
                "Drachenherz",
                "Achtsamer Flirt",
                "grandios-humorvollen Speeddating",
                "Mutmach-Crashkurs",
                "Mutmach Crashkurs"
            ]
        },
        "timestamps": [
            {
                "date1": "2023-04-07",
                "clock1": "18:30",
                "date2": null,
                "clock2": "20:30"
            }
        ]
    },
    {
        "message": "(Aus E-Mail folgende Gemeinschaft heraus kopiert, für euch zur Info)\n\n\nSemilla Monte Alegre \nC/ Caserío el Cardal 14, 29716 Canillas de Aceituno \n+34 659 10 98 09\n\nDEUTSCH\nKonzentration auf die Verwirklichung unserer großen VISION und deren Weiterentwicklung\nWissen Sie, warum in der russischen Schule KIN von Tekos (Anastasia) die Kinder den MATERA-Lehrplan (Mathematik) der gesamten Pflichtschule in einem Schuljahr lernen und einige von ihnen im Alter von 17 Jahren bereits einen Universitätsabschluss haben?\nSind Sie daran interessiert, einen anderen Ansatz für die Bildung oder Begleitung von Kindern, Jugendlichen und Erwachsenen kennenzulernen/zuerleben? \n \n...pädagogische Innovation, eine Arbeit, die die zwischenmenschlichen Beziehungen als Lebensgrundlage und die Vermittlung von Wissen und Know-how in den Mittelpunkt stellt, die Entwicklung von Kreativität und individuellen Begabungen und Talenten, usw. und das alles mit der nötigen Struktur und viel Disziplin! \n\nSind Sie bereit für diese Herausforderung?\nDann sind Sie herzlich eingeladen, an einem der ersten eintägigen Einführungsseminare in Spanien (Málaga) teilzunehmen, die zwischen April und Juni in unserem Ökodorf stattfinden, um die Schetinin-Pädagogik kennenzulernen, die seit drei Generationen in der Schule der Genies in Tekos, Russland, angewendet wird. Seminare, die von Josef in deutscher Sprache gefördert werden (der einzige, der von Schetinin zertifiziert wurde, bevor er uns verließ, um diese Pädagogik außerhalb der Schule von Tekos weiterzugeben) und seinem Verein ISKA seit 3 Jahren.\n \nSehen Sie sich dieses Video für weitere Informationen an😉\nEinweihung in Spanien 🦚 von praktischen Einführungsseminaren (zertifiziert von ISKA) in 3 Sprachen (Spanisch, Englisch und Deutsch) über die  die Schetinin Pädagogik die in der KIN-Schule der Genies in Tekos (Russland) entwickelt hat.\n🌿Wenn Sie dieses Osterfest nutzen wollen, um unser Ökodorf IKI-GAIA in Malaga kennenzulernen und sich am 8. oder 9. April in diese bisher so geheimnisvolle und \"unzugängliche\" Pädagogik zu vertiefen, schreiben Sie uns so bald wie möglich per E-Mail an semilla@semillamontealegre.org oder per Telegramm an @ecoada. Letzte Plätze verfügbar!\nWeitere Informationen über die 3-Millennium-Schule finden Sie im folgenden Beitrag, falls Sie sie noch nicht kennen oder noch nicht von der ANASTASIA-Buch-Saga gehört haben 😉.\nEinzelheiten zu den eintägigen Einführungsseminaren (8. und 9. April)",
        "topic_suggestions": {
            "spacy_NER": [
                "Monte Alegre C",
                "Gemeinschaft",
                "DEUTSCH",
                "VISION",
                "russischen",
                "MATERA-Lehrplan"
            ],
            "rake_keywords": [
                "russischen Schule KIN",
                "17 Jahren bereits",
                "Tekos Anastasia",
                "Schuljahr lernen",
                "Lehrplan Mathematik",
                "gesamten Pflichtschule",
                "Universitätsabsch",
                "MATERA",
                "Kinder",
                "Alter"
            ],
            "tf_IDF": [
                "Weiterentwicklung",
                "14,",
                "659",
                "Canillas",
                "Schule",
                "Schuljahr"
            ],
            "LDA": [],
            "NMF": [
                "Kinder",
                "Schuljahr",
                "Anastasia"
            ],
            "common_topics": [
                "Gemeinschaft",
                "14,",
                "Canillas",
                "659",
                "Schuljahr lernen",
                "Weiterentwicklung",
                "VISION",
                "Tekos Anastasia",
                "russischen",
                "Lehrplan Mathematik",
                "MATERA-Lehrplan",
                "gesamten Pflichtschule",
                "Universitätsabsch",
                "DEUTSCH",
                "Schule",
                "Alter",
                "Kinder"
            ],
            "chosen_topics": [
                "Gemeinschaft",
                "Semilla Monte Alegre",
                "Monte Alegre",
                "VISION"
            ]
        },
        "timestamps": [
            {
                "date1": "2023-04-09",
                "clock1": null,
                "date2": null,
                "clock2": null
            }
        ]
    },
    {
        "message": "🎬 Willkommen im Forschungsraum: Wie ich werde, wie ich bin - Entdecke Dein Wow!\n\nStell dir vor, dein Leben ist ein Film: Welche Rolle willst du einnehmen?\n\nWir eröffnen einen gemeinsamen Forschungsraum, in dem du deine Idee und deine Vision von dir oder einem Projekt weiterentwickeln kannst - sei es eine kreative oder eine persönliche Herausforderung. Probiere dich in neuen Rollen aus, um ungewohnte Aspekte von dir zu entdecken. \n\nFilmemacher Sebastian Heinzel und Prozessbegleiterin Antonia Ehrhart bringen Elemente aus der Film-, Theater- und Prozessarbeit ein, um mehr Spielraum in den eigenen Ausdrucksmöglichkeiten zu schaffen. Die Arbeit mit dem Medium Film verstärkt deine Präsenz: Du wirst sichtbarer! \n\nTermin: Freitag, 21. April, 17 Uhr bis Sonntag, 23. April, 16 Uhr\n\nKosten: 220 bis 280 € nach Selbsteinschätzung. Wir vergeben 2 Stipendienplätze. \n\nOrt: Kulturzentrum 3Klang, Sulzburg/Laufen (bei Freiburg)\n\nMehr Info: https://www.heinzelfilm.de/forschungsraum",
        "topic_suggestions": {
            "spacy_NER": [
                "Entdecke Dein Wow Stell dir"
            ],
            "rake_keywords": [
                "Prozessbegleiterin Antonia Ehrh",
                "Projekt weiterentwickeln kannst",
                "persönliche Herausforderung Probiere",
                "Wow Stell",
                "ungewohnte Aspekte",
                "Rolle willst",
                "gemeinsamen Forschungsraum",
                "Forschungsraum",
                "Willkommen",
                "Vision",
                "Leben",
                "kreative",
                "Idee",
                "Film",
                "eröffnen",
                "Entdecke",
                "einnehmen"
            ],
            "tf_IDF": [
                "Filmemacher",
                "Sebastian",
                "Forschungsraum:",
                "Forschungsraum,",
                "Idee"
            ],
            "LDA": [],
            "NMF": [
                "Forschungsraum",
                "entwickeln"
            ],
            "common_topics": [
                "Forschungsraum:",
                "Wow Stell",
                "Forschungsraum,",
                "gemeinsamen Forschungsraum",
                "einnehmen",
                "Vision",
                "Willkommen",
                "Filmemacher",
                "kreative",
                "Sebastian",
                "ungewohnte Aspekte",
                "eröffnen",
                "Rolle willst",
                "Entdecke",
                "Leben",
                "entwickeln",
                "Idee"
            ],
            "chosen_topics": [
                "gemeinsamen Forschungsraum",
                "Forschungsraum",
                "Forschungsraum,",
                "Forschungsraum:"
            ]
        },
        "timestamps": [
            {
                "date1": "2023-04-21",
                "clock1": "17:00",
                "date2": null,
                "clock2": null
            },
            {
                "date1": "2023-04-23",
                "clock1": "16:00",
                "date2": null,
                "clock2": null
            }
        ]
    },
    {
        "message": "Fortbildung zum 360°-LERNEN - Begleiter\n\n⚪️ Natürlich Lernen - erleben\n\n🟢 3. WE - Fr/Sa/So 21./22./23. April 2023\n🟢 4. WE - Fr/Sa/So 28./29./30. April 2023\n🟢 Fr 18 Uhr bis 21 Uhr - Sa/So 10 Uhr bis 13 Uhr\n🟢 … mit Simone\n\nAn den beiden Wochenenden geht es darum, selbst zu erleben, wie das natürliche Lernen abläuft.\nDu wirst in diesem Seminar zum angstfreien Ausprobieren angeleitet. Dadurch wird die natürliche Begeisterung in uns wieder freigelegt und du er-innerst dich, wie natürliches Lernen auch (uns als) Kinder begeistert (hat).\n\n🟢 3. u. 4. WE (von 13) der Fortbildung zum 360°-LERNEN-Begleiter\n\n⚪️ Gesundheitszentrum in 79215 Elzach\n⚪️ Kosten 250 €\n⚪️ Anmeldung: @mone_madison\n\n🔝… Übersicht aller 360°-LERNEN-Begleiter Fortbildungs - WE\n\n⚪️ 360°-LERNEN                      \n⚪️ www.360°-Lernen.com",
        "topic_suggestions": {
            "spacy_NER": [],
            "rake_keywords": [
                "erleben 3 WE",
                "21 Uhr",
                "natürliches Lernen auc",
                "Begleiter Natürlich Lernen",
                "natürliche Lernen abläuft",
                "13 Uhr",
                "10 Uhr",
                "natürliche Begeisterung",
                "LERNEN",
                "erleben",
                "Simone",
                "Seminar",
                "innerst",
                "freigelegt",
                "Fortbildung",
                "360"
            ],
            "tf_IDF": [
                "LERNEN",
                "Fr/Sa/So",
                "natürliche",
                "April"
            ],
            "LDA": [],
            "NMF": [],
            "common_topics": [
                "Fr/Sa/So",
                "Fortbildung",
                "360",
                "Simone",
                "LERNEN",
                "natürliche Begeisterung",
                "freigelegt",
                "April",
                "erleben",
                "Seminar",
                "21 Uhr",
                "10 Uhr",
                "13 Uhr",
                "innerst"
            ],
            "chosen_topics": [
                "Fortbildung zum 360 LERNEN",
                "Fortbildung zum 360-LERNEN",
                "Fortbildung 360 LERNEN",
                "Fortbildung",
                "360",
                "LERNEN"
            ]
        },
        "timestamps": [
            {
                "date1": "2023-04-22",
                "clock1": "10:00",
                "date2": "2023-04-23",
                "clock2": "21:00"
            },
            {
                "date1": "2023-04-29",
                "clock1": "10:00",
                "date2": "2023-04-30",
                "clock2": "21:00"
            }
        ]
    },
    {
        "message": "Lieber Mensch,\nich gebe am 22.4.2023 um 15:30 Uhr, in Freiburg Unterwiehre, einen Improtheater Workshop. Der Workshop ist für Menschen, die gerne durch spielen in Kontakt kommen oder sich auf etwas neues einlassen wollen. Wir werden an diesen Nachmittag zusammen einen geschützten Raum kreieren in dem wir uns kreativ entfalten können. Ich leite einige Übungen an, mit denen wir ganz leicht ins spielen kommen und zusammen improvisieren.\nWenn du mehr dazu erfahren willst, schicke mir gerne eine Nachricht.\n \nHerzliche Grüße\nChristian\nP.S.: Dieser Workshop ist für Menschen die schnuppern wollen kostenlos. Eine Spende ist willkommen.",
        "topic_suggestions": {
            "spacy_NER": [
                "Freiburg Unterwiehre"
            ],
            "rake_keywords": [
                "geschützten Raum kreieren",
                "neues einlassen",
                "Nachmittag zusammen",
                "kreativ entfalten",
                "Kontakt kommen",
                "Freiburg Unterwiehre",
                "erfahren willst",
                "30 Uhr",
                "spielen kommen",
                "Improtheater Workshop",
                "Workshop",
                "spielen",
                "Übungen",
                "schicke",
                "Menschen",
                "leite",
                "gerne",
                "gebe"
            ],
            "tf_IDF": [
                "spielen",
                "gerne",
                "Workshop",
                "Menschen,",
                "einlassen"
            ],
            "LDA": [],
            "NMF": [
                "erfahre"
            ],
            "common_topics": [
                "Freiburg Unterwiehre",
                "Improtheater Workshop",
                "Menschen,",
                "neues einlassen",
                "kreativ entfalten",
                "Übungen",
                "Nachmittag zusammen",
                "30 Uhr",
                "gebe",
                "spielen kommen",
                "leite",
                "Kontakt kommen",
                "gerne",
                "erfahren willst",
                "schicke"
            ],
            "chosen_topics": [
                "Improtheater Workshop",
                "Improtheater",
                "Workshop"
            ]
        },
        "timestamps": [
            {
                "date1": "2023-04-22",
                "clock1": "15:30",
                "date2": null,
                "clock2": "15:30"
            }
        ]
    },
    {
        "message": "Das experimentelle Setting mit unterschiedlichen Zonen, eine Mischung aus Seminar und freiem Tanzabend, mit Leichtigkeit und Tiefgang.\n“Es geht um die Verbindung zwischen uns, die nur aus der gemeinsamen Freiheit entstehen kann.”\n \nVerbindung - Dich spüren. Mit dir selbst in Kontakt kommen. Deinen Körper bewusst wahrnehmen. Liebe tanzen lädt dich ein, in die Verbindung zu gehen. Dich mit dir, den dich umgebenden Lebewesen und der Erde neu zu connecten.\n \nBewegung - Unsere Bewegungen müssen nicht ästhetisch oder im Rhythmus sein. Die Musik trägt dich. Wir folgen unseren Impulsen, gehen aufeinander zu und zeigen unsere Grenzen und Bedürfnisse. Spielerisch, kämpferisch, fantasievoll.\n \nEros - Sichere Freiheit. Sinnliches Miteinander. Tanzen, bewegen, begegnen. Beim Liebe tanzen darf alles passieren, was allen Beteiligten gefällt. Es gibt verschiedene Zonen, in denen du für dich sein oder in Kontakt gehen kannst.\n\nSamstag, 22. April 2023\nUhrzeit: 18:00 Uhr offene Türen fürs Umziehen, Einstimmen, Socializen, 18:30 Uhr gemeinsamer Beginn (Achtung: Kein Nacheinlass!), gegen 22:30 Uhr gemeinsames Abschlusssharing, Ende um 23 Uhr.\nDie eher verfrorenen unter euch: bringt euch gern noch eine kuschelige Decke mit, manchmal ist der Raum etwas fußkalt.\nOhne Anmeldung, komm einfach vorbei.\nOrt: Saal des Tangoclubs El Corazon, Hinterkirchstr. 21, 79108 Freiburg\nPreis: 20-30 Euro (ermäßigt 15)\n \nweitere Infos auf meiner Webseite: liebe-und-freiheit.de/seminare-und-workshops/liebe-tanzen",
        "topic_suggestions": {
            "spacy_NER": [
                "Erde",
                "connecten Bewegung"
            ],
            "rake_keywords": [
                "gemeinsamen Freiheit entstehen",
                "unterschiedlichen Zonen",
                "umgebenden Lebewesen",
                "Kontakt kommen",
                "freiem Tanzabend",
                "experimentelle Setting",
                "Erde neu",
                "connecten Bewegung",
                "Bewegungen müssen",
                "Verbindung",
                "Tiefgang",
                "spüren",
                "Seminar",
                "Mischung",
                "Leichtigkeit"
            ],
            "tf_IDF": [
                "Verbindung",
                "wahrnehmen",
                "Setting",
                "Mischung",
                "Tanzabend,",
                "Lebewesen",
                "connecten"
            ],
            "LDA": [],
            "NMF": [],
            "common_topics": [
                "Mischung",
                "experimentelle Setting",
                "unterschiedlichen Zonen",
                "Tanzabend,",
                "freiem Tanzabend",
                "Tiefgang",
                "Leichtigkeit",
                "wahrnehmen",
                "connecten Bewegung",
                "umgebenden Lebewesen",
                "Seminar",
                "Verbindung",
                "Bewegungen müssen",
                "Kontakt kommen",
                "spüren",
                "Erde neu"
            ],
            "chosen_topics": [
                "Tanzabend",
                "freiem Tanzabend",
                "Tanzabend,",
                "Liebe tanzen",
                "tanzen"
            ]
        },
        "timestamps": [
            {
                "date1": "2023-04-22",
                "clock1": "18:00",
                "date2": null,
                "clock2": "23:00"
            }
        ]
    },
    {
        "message": "Erinnerung: Heute abend tanzen wir!\n\nLiebe wunderbare Menschenwesen, Lichtsucher* und Liebesforscher*innen.\n \nherzliche Einladung zum Liebe tanzen in Freiburg, am Samstag, den 22.4., Einlass 18 Uhr, Start 18:30 Uhr.\nUnd Juchhuu: diesmal sind Maria Canto, Katinka Flautista und Francesco Ritmico mit ihrer Live-Musik dabei und bereichern den Abend!\n \nIch freue mich auf euch alle, auf Tanzen, Spaß, Berührtheit, Ehrlichkeit und Verbindung, Lebendigkeit, Nein-Sagen-Üben, Ja-Sagen-Üben, Üben-in-mir-drin-meine-ureigene-Liebe-spüren, Forschergeist und Freiheitsfreude,...\n \nLove,\nUrsula\n\n-----",
        "topic_suggestions": {
            "spacy_NER": [
                "Freiburg",
                "Nein-Sagen-Üben",
                "Üben-in-mir-dri",
                "Liebe wunderbare Menschenwesen"
            ],
            "rake_keywords": [
                "Liebe wunderbare Menschenwesen",
                "Start 18",
                "30 Uhr",
                "Liebe tanzen",
                "Musik dabei",
                "Maria Canto",
                "Katinka Flautista",
                "Francesco Ritmico",
                "tanzen",
                "abend",
                "Üben",
                "Verbindung",
                "Spaß",
                "Samstag",
                "Sagen",
                "Live",
                "Lichtsucher",
                "Lebendigkeit",
                "Juchhuu",
                "freue",
                "Freiburg",
                "Erinnerung",
                "Ehrlichkeit",
                "dri",
                "diesmal",
                "Berührtheit",
                "bereichern"
            ],
            "tf_IDF": [
                "tanzen",
                "abend",
                "Liebe",
                "Verbindung,",
                "Liebesforscher",
                "Erinnerung:",
                "Ritmico",
                "Juchhuu:"
            ],
            "LDA": [],
            "NMF": [
                "Üben",
                "Sagen"
            ],
            "common_topics": [
                "Freiburg",
                "Liebe tanzen",
                "Erinnerung:",
                "Liebesforscher",
                "Lichtsucher",
                "Juchhuu:",
                "Francesco Ritmico",
                "Maria Canto",
                "Katinka Flautista",
                "Nein-Sagen-Üben",
                "Verbindung,",
                "abend",
                "Üben-in-mir-dri",
                "Lebendigkeit",
                "Ehrlichkeit",
                "Berührtheit",
                "diesmal",
                "Live",
                "Start 18",
                "30 Uhr",
                "Samstag",
                "Musik dabei",
                "Spaß",
                "freue",
                "bereichern"
            ],
            "chosen_topics": [
                "Liebe tanzen",
                "tanzen"
            ]
        },
        "timestamps": [
            {
                "date1": "2023-04-22",
                "clock1": "18:00",
                "date2": null,
                "clock2": "18:30"
            }
        ]
    },
    {
        "message": "###Heute!!!!###\nShaitsu-Aktionstag\n\nWOHLERGEHEN FÜR DICH UND ANDERE\n\nAm Sonntag, den 23. April 2023 öffnen wir die Türen unserer Shiatsu-Praxis und laden dich ein uns und Shiatsu durch eine Schnupperbehandlung kennen zu lernen. Die Einnahmen dieses Aktionstages gehen an das MediNetz Freiburg - eine Initiative, die eine Vermittlung an Ärztinnen, Hebammen, Physiotherapeut:innen etc. für geflüchtete Menschen anbietet, die sonst keinen Zugang zu medizinischer Versorgung hätten.\n\nSei dabei! Lerne Shiatsu kennen und trage dazu bei, dass Menschen unterstützt werden, die keinen Zugang zu medizinischer Versorgung haben!\n\nZwischen folgenden Terminen kannst du wählen:\n\n11:00 Uhr\n\n11: 40 Uhr\n\n12: 20 Uhr\n\n13:00 Uhr\n\n13:40 Uhr\n\n14:20 Uhr\n\n15:00 Uhr\n\n15:40 Uhr\n\n16:20 Uhr\n\n17:00 Uhr\n\n17:40\n\nDauer: 30 min\n\nKosten: 30€\n\nWir freuen uns auf dich!\n\nIhr könnt morgen auch spontan kommen, schreibt mir gern, wenn ihr vorhabt zu kommen, dann kann ich euch sagen, wann noch was frei ist. Bis morgen! :-)",
        "topic_suggestions": {
            "spacy_NER": [
                "Freiburg",
                "Shaitsu-Aktionstag",
                "Shiatsu-Praxis",
                "Aktionstages",
                "MediNetz"
            ],
            "rake_keywords": [
                "geflüchtete Menschen anbietet",
                "Türen unserer Shiatsu",
                "Schnupperbehandlung kennen",
                "MediNetz Freiburg",
                "innen etc",
                "Aktionstages gehen",
                "Aktionstag WOHLERGEHEN",
                "Shiatsu",
                "Ärztinnen",
                "Zugang",
                "Vermittlung",
                "Sonntag",
                "Praxis",
                "Physiotherapeut",
                "lernen",
                "laden",
                "Initiative",
                "Hebammen",
                "Einnahmen"
            ],
            "tf_IDF": [
                "Shi",
                "Schnupperbehandlung",
                "etc",
                "medizinischer",
                "MediNetz"
            ],
            "LDA": [],
            "NMF": [
                "Shiatsu",
                "Hebammen",
                "Initiative",
                "biete",
                "behandlung"
            ],
            "common_topics": [
                "Shiatsu-Praxis",
                "MediNetz Freiburg",
                "Shaitsu-Aktionstag",
                "Aktionstag WOHLERGEHEN",
                "Schnupperbehandlung kennen",
                "Hebammen",
                "Aktionstages gehen",
                "Einnahmen",
                "Vermittlung",
                "Ärztinnen",
                "Physiotherapeut",
                "Initiative",
                "Sonntag",
                "innen etc",
                "medizinischer",
                "laden",
                "Zugang",
                "lernen",
                "biete"
            ],
            "chosen_topics": [
                "Shaitsu-Aktionstag",
                "Shiatsu",
                "Shiatsu-Praxis",
                "Aktionstag WOHLERGEHEN"
            ]
        },
        "timestamps": [
            {
                "date1": "2023-04-23",
                "clock1": "12:00",
                "date2": null,
                "clock2": "20:00"
            }
        ]
    },
    {
        "message": "###es gitb noch ein paar freie Plätze!!!###\nShaitsu-Aktionstag\n\nWOHLERGEHEN FÜR DICH UND ANDERE\n\nAm Sonntag, den 23. April 2023 öffnen wir die Türen unserer Shiatsu-Praxis und laden dich ein uns und Shiatsu durch eine Schnupperbehandlung kennen zu lernen. Die Einnahmen dieses Aktionstages gehen an das MediNetz Freiburg - eine Initiative, die eine Vermittlung an Ärztinnen, Hebammen, Physiotherapeut:innen etc. für geflüchtete Menschen anbietet, die sonst keinen Zugang zu medizinischer Versorgung hätten.\n\nSei dabei! Lerne Shiatsu kennen und trage dazu bei, dass Menschen unterstützt werden, die keinen Zugang zu medizinischer Versorgung haben!\n\nZwischen folgenden Terminen kannst du wählen:\n\n11:00 Uhr\n\n11: 40 Uhr\n\n12: 20 Uhr\n\n13:00 Uhr\n\n13:40 Uhr\n\n14:20 Uhr\n\n15:00 Uhr\n\n15:40 Uhr\n\n16:20 Uhr\n\n17:00 Uhr\n\n17:40\n\nDauer: 30 min\n\nKosten: 30€\n\nWir freuen uns auf dich!\n\nIhr könnt morgen auch spontan kommen, schreibt mir gern, wenn ihr vorhabt zu kommen, dann kann ich euch sagen, wann noch was frei ist. Bis morgen! :-)",
        "topic_suggestions": {
            "spacy_NER": [
                "Freiburg",
                "Shaitsu-Aktionstag",
                "Shiatsu-Praxis",
                "Aktionstages",
                "MediNetz"
            ],
            "rake_keywords": [
                "medizinischer Versorgung h",
                "geflüchtete Menschen anbietet",
                "Türen unserer Shiatsu",
                "Schnupperbehandlung kennen",
                "MediNetz Freiburg",
                "innen etc",
                "Aktionstages gehen",
                "Aktionstag WOHLERGEHEN",
                "Shiatsu",
                "Ärztinnen",
                "Zugang",
                "Vermittlung",
                "Sonntag",
                "Praxis",
                "Physiotherapeut",
                "lernen",
                "laden",
                "Initiative",
                "Hebammen",
                "gitb",
                "Einnahmen"
            ],
            "tf_IDF": [
                "gitb",
                "Shaitsu-Aktionstag",
                "MediNetz",
                "Shiatsu-Praxis",
                "medizinischer",
                "etc"
            ],
            "LDA": [],
            "NMF": [],
            "common_topics": [
                "Shaitsu-Aktionstag",
                "gitb",
                "Shiatsu-Praxis",
                "MediNetz Freiburg",
                "Aktionstag WOHLERGEHEN",
                "Schnupperbehandlung kennen",
                "Aktionstages gehen",
                "Freiburg",
                "Einnahmen",
                "Vermittlung",
                "Ärztinnen",
                "Physiotherapeut",
                "Hebammen",
                "Sonntag",
                "medizinischer",
                "innen etc",
                "Initiative",
                "laden",
                "Zugang",
                "lernen"
            ],
            "chosen_topics": [
                "Shaitsu-Aktionstag",
                "Shiatsu",
                "Shiatsu-Praxis",
                "Aktionstag WOHLERGEHEN"
            ]
        },
        "timestamps": [
            {
                "date1": "2023-04-23",
                "clock1": "12:00",
                "date2": null,
                "clock2": "20:00"
            }
        ]
    },
    {
        "message": "Live Ecstatic Dance und Sacred Singing Cirle \nmit Engelbert \n \nSonntag, den 23. April  \n \nim Lichthaus Bollschweil\n\nEngelbert teilt in seinem Live Extatic Dance und Sacred Singing Circle seine Leidenschaft für heilige Klänge und Gesänge. Er kombiniert dabei verschiedene Instrumente mit seiner selbstgeschriebenen, aus dem Herzen kommenden Musik, die die Intention hat, Mensch mit Gesang und Tanz zu verbinden. \n \nEngelbert spielte bereits mit vielen Künstlern wie Laeela, Joachim Böttcher, Johannes Vogt, Omkara, Ana Pomar und Sam Garrett. \n \nProgramm 23. April 2023: \n14:00 Ankommen \n14:30-16:30 • Mystic Tribal Dance \nPotluck (Essen zum Teilen mitbringen) \n18:30-21:00 • Heiliger Singkreis \n \nEnergieausgleich: \nTanzen oder Singen: 15-30 € \nTanz und Gesang: 25-50 € \n \nMehr Infos zu Engelberts Musik und dem Programm findest du hier.",
        "topic_suggestions": {
            "spacy_NER": [
                "Live Ecstatic Dance",
                "Sacred Singing Cirle",
                "Sacred Singing Circle"
            ],
            "rake_keywords": [
                "Sacred Singing Cirle",
                "Sacred Singing Circle",
                "Live Extatic Dance",
                "Live Ecstatic Dance",
                "Herzen kommenden Musik",
                "Engelbert Sonntag",
                "Joachim Böttcher",
                "heilige Klänge",
                "23 April",
                "Tanz",
                "selbstgeschriebenen",
                "Mensch",
                "Leidenschaft",
                "Laeela",
                "Johannes",
                "Intention",
                "Gesänge",
                "Gesang"
            ],
            "tf_IDF": [
                "Engelbert",
                "Sacred",
                "Singing",
                "Dance",
                "Live",
                "Künstlern",
                "Cirle",
                "spielte",
                "Laeela,"
            ],
            "LDA": [],
            "NMF": [
                "Engelbert",
                "Singing",
                "Sacred",
                "Dance",
                "Ecstatic"
            ],
            "common_topics": [
                "Dance",
                "Sacred",
                "Singing",
                "Engelbert Sonntag",
                "Ecstatic",
                "Cirle",
                "Live",
                "heilige Klänge",
                "Leidenschaft",
                "selbstgeschriebenen",
                "23 April",
                "Laeela,",
                "Intention",
                "Joachim Böttcher",
                "Gesänge",
                "Künstlern",
                "Tanz",
                "Gesang",
                "Johannes",
                "spielte",
                "Mensch"
            ],
            "chosen_topics": [
                "Live Ecstatic Dance",
                "Sacred Singing Cirle",
                "Ecstatic Dance",
                "Sacred Singing",
                "Ecstatic",
                "Dance"
            ]
        },
        "timestamps": [
            {
                "date1": "2023-04-23",
                "clock1": "14:30",
                "date2": null,
                "clock2": "16:30"
            }
        ]
    },
    {
        "message": "✨Dance the Drum - \nTrommeltanzkonzert🪘 \n\nSo.,23.04. von 16:30 - 18:00\n\nTanze (dich) frei, singe mit bei den African Songs oder komm einfach um die Musik erleben!\n\nKinder sind ❤️-lich willkommen.\n  \nOrt: Im Lokschuppen, Zechenweg 1a, Freiburg-St.Georgen\nBeitrag: Spende ab 15€ oder nach Möglichkeit. Anmeldung nicht erforderlich.\n\n\nSei gerne 5 min. früher da.\n\nGanz herzlich \nAddis\n\nwww.addisbuchanan.de",
        "topic_suggestions": {
            "spacy_NER": [
                "Zechenweg",
                "Freiburg-St",
                "Dance the Drum",
                "African Songs"
            ],
            "rake_keywords": [
                "Spende ab 15",
                "Musik erleben Kinder",
                "lich willkommen Ort",
                "Dance the Drum",
                "Zechenweg 1a",
                "Möglichkeit Anmeldung",
                "komm einfach",
                "Georgen Beitrag",
                "African Songs",
                "00 Tanze",
                "Trommeltanzkonzert",
                "singe",
                "Lokschuppen",
                "Freiburg",
                "frei",
                "addisbuchanan"
            ],
            "tf_IDF": [
                "Drum",
                "1a,",
                "singe",
                "Songs",
                "erforderlich"
            ],
            "LDA": [],
            "NMF": [
                "Addis",
                "addisbuchanan"
            ],
            "common_topics": [
                "African Songs",
                "Drum",
                "Trommeltanzkonzert",
                "singe",
                "00 Tanze",
                "1a,",
                "Zechenweg 1a",
                "Freiburg-St",
                "Lokschuppen",
                "Georgen Beitrag",
                "Möglichkeit Anmeldung",
                "addisbuchanan",
                "Addis",
                "erforderlich",
                "frei",
                "komm einfach"
            ],
            "chosen_topics": [
                "Dance the Drum",
                "Trommeltanzkonzert",
                "African Songs",
                "Dance"
            ]
        },
        "timestamps": [
            {
                "date1": "2023-04-23",
                "clock1": "16:30",
                "date2": null,
                "clock2": "23:04"
            }
        ]
    },
    {
        "message": "Tantra für Paare Impuls \nheute Abend, Mo, 24.4.23 von 21-22h\n\nThema heute: \nDen Anfangsmoment wachrufen                                                                          Im HIER & JETZT sein\n                                                  \n✨Lernt gemeinsam, jeden Moment zu einem magischen Neuanfang zu transformieren.\n\n✨Das Geheimnis der dauerhaft lebendigen Liebesbeziehung.\nAnmeldung bis heute Abend um 20h per email.\n\nBezahlung per paypal an info@sundari-tempel.de bis 20h.\n\nPreis: 10€ pro Person \n\nLink wird gesendet nach Zahlungseingang\n\nAlle Infos zum Event: https://sundari-tempel.de/2022/11/17/tantra-fuer-paare-online-impulse",
        "topic_suggestions": {
            "spacy_NER": [
                "Tantra für Paare Impuls heute Abend"
            ],
            "rake_keywords": [
                "22h Thema heute",
                "20h Preis",
                "magischen Neuanfang",
                "Lernt gemeinsam",
                "info sundari",
                "Anfangsmoment wachrufen",
                "10 p",
                "transformieren",
                "tempel",
                "Tantra",
                "moment",
                "Geheimnis"
            ],
            "tf_IDF": [
                "20h",
                "per",
                "sundari-tempel.de",
                "dauerhaft",
                "Bezahlung",
                "Paare",
                "Lernt",
                "Anfangsmoment"
            ],
            "LDA": [],
            "NMF": [
                "20h",
                "lebendigen"
            ],
            "common_topics": [
                "Tantra",
                "20h Preis",
                "Anfangsmoment wachrufen",
                "magischen Neuanfang",
                "dauerhaft",
                "lebendigen",
                "transformieren",
                "Geheimnis",
                "Bezahlung",
                "sundari-tempel.de",
                "info sundari",
                "Paare",
                "Lernt gemeinsam",
                "per",
                "10 p"
            ],
            "chosen_topics": [
                "Tantra",
                "HIER & JETZT",
                "HIER JETZT"
            ]
        },
        "timestamps": [
            {
                "date1": "2023-04-24",
                "clock1": null,
                "date2": null,
                "clock2": null
            }
        ]
    },
    {
        "message": "‼️Morgen Abend, 19 Uhr in der Egonstr. 5‼️\n \nDas Gestalt Kollektiv Freiburg lädt zum Offenen Gestalt Abend ein! \n\nLerne in Gruppenübungen, Sharing-Runden und Einzelarbeiten die Gestalt-Arbeit kennen oder vertiefe deine bisherigen Erfahrungen. \n\nGestalt bedeutet, mit dem zu sein, was ist. Die Aufmerksamkeit richtet sich auf das Erleben im Moment. Wir sind in Präsenz und Mitgefühl mit dem, was darin auftaucht. In diesem gemeinsamen Da-Sein wird die Begegnung mit dir selbst und anderen ehrlicher und einfacher. \n\nAm Montag, 24. April 19-21:30 Uhr im Sonnenraum, Egonstr. 5, Stühlinger in Freiburg \n\n12-20€ Ausgleich\nAnmeldung unter chflatten@gmail.com\nAuch spontan seid ihr herzlich Willkommen!\n\nWir freuen uns auf euch!\nChristine und Mala vom Gestalt Kollektiv Freiburg",
        "topic_suggestions": {
            "spacy_NER": [
                "Egonstr",
                "Freiburg",
                "Sharing-Runden"
            ],
            "rake_keywords": [
                "Offenen Gestalt Abend",
                "ehrlicher un",
                "Egonstr 5",
                "Aufmerksamkeit richtet",
                "Arbeit kennen",
                "19 Uhr",
                "Gestalt",
                "vertiefe",
                "Sharing",
                "Runden",
                "Präsenz",
                "Moment",
                "Mitgefühl",
                "Lerne",
                "Gruppenübungen",
                "gemeinsamen",
                "Erleben",
                "Einzelarbeiten",
                "Begegnung"
            ],
            "tf_IDF": [
                "Gestalt",
                "Egonstr",
                "Mitgefühl",
                "ehrlicher",
                "Kollektiv",
                "Einzelarbeiten"
            ],
            "LDA": [],
            "NMF": [
                "Gestalt",
                "Egonstr",
                "arbeiten"
            ],
            "common_topics": [
                "Egonstr 5",
                "Einzelarbeiten",
                "Kollektiv",
                "Freiburg",
                "Mitgefühl",
                "Sharing-Runden",
                "Gruppenübungen",
                "vertiefe",
                "Aufmerksamkeit richtet",
                "Gestalt",
                "Präsenz",
                "ehrlicher un",
                "19 Uhr",
                "Begegnung",
                "Lerne",
                "Arbeit kennen",
                "Moment",
                "Erleben",
                "gemeinsamen"
            ],
            "chosen_topics": [
                "Offenen Gestalt Abend",
                "Gestalt-Arbeit",
                "Gestalt",
                "Gestalt Kollektiv Freiburg",
                "Sharing-Runden"
            ]
        },
        "timestamps": [
            {
                "date1": "2023-04-24",
                "clock1": "19:00",
                "date2": null,
                "clock2": "21:30"
            }
        ]
    },
    {
        "message": "🦒 Selbsteinfühlung & Empathie: erfahren & begleiten lernen 💌 24.4 & 8.5.\n\n24.4 18.30-20 Uhr\n\n💬 Was bewegt dich gerade? Ich begleite 2-3 Anliegen, für die wir als Gruppe Raum halten.\n💫 Erfahre Momente, in denen es \"innerlich Klick macht\", Etwas leichter, frischer, klarer wird.\n🤹 Zum Abschluss reflektieren wir gemeinsam. Was nimmst du Neues mit? \n\n8.5. 18.30-20 Uhr\n\n🤝 Begleite ein Gegenüber im Selbsteinfühlungstanz\n❔ Probiere aus, welche Interventionen dein Gegenüber unterstützen, gut mit sich in Kontakt zu sein\n🏅 Erforsche und stärke deinen ganz individuellen Begleitungsstil. \n\nBeide Termine sind Teil der Offenen Wahrnehmungsabende. Infos & Kontakt: Telegramkanal, Signalgruppe oder Website",
        "topic_suggestions": {
            "spacy_NER": [],
            "rake_keywords": [
                "innerlich Klick macht",
                "20 Uhr Begleite",
                "20 Uhr",
                "begleite 2",
                "Selbsteinfühlungstanz Probiere",
                "Selbsteinfühlung Empathie",
                "Abschluss reflektieren",
                "3 Anliegen",
                "nimmst",
                "Neues",
                "leichter",
                "klarer",
                "Interventionen",
                "gemeinsam",
                "frischer",
                "bewegt"
            ],
            "tf_IDF": [
                "begleite",
                "Momente,",
                "unterstützen,",
                "nimmst",
                "Anliegen,",
                "Klick"
            ],
            "LDA": [],
            "NMF": [],
            "common_topics": [
                "Selbsteinfühlung Empathie",
                "Anliegen,",
                "Momente,",
                "3 Anliegen",
                "begleite 2",
                "Abschluss reflektieren",
                "unterstützen,",
                "Selbsteinfühlungstanz Probiere",
                "Interventionen",
                "20 Uhr",
                "frischer",
                "Klick",
                "bewegt",
                "leichter",
                "klarer",
                "Neues",
                "gemeinsam",
                "nimmst"
            ],
            "chosen_topics": [
                "Selbsteinfühlung & Empathie",
                "Selbsteinfühlung Empathie",
                "Selbsteinfühlungstanz"
            ]
        },
        "timestamps": [
            {
                "date1": "2023-04-24",
                "clock1": "18:30",
                "date2": null,
                "clock2": "20:00"
            },
            {
                "date1": "2024-05-08",
                "clock1": "18:30",
                "date2": null,
                "clock2": "20:00"
            },
            {
                "date1": "2023-05-08",
                "clock1": "18:30",
                "date2": null,
                "clock2": "20:00"
            }
        ]
    },
    {
        "message": "Das Gestalt Kollektiv Freiburg lädt zum Offenen Gestalt Abend ein! \n\nLerne in Gruppenübungen, Sharing-Runden und Einzelarbeiten die Gestalt-Arbeit kennen oder vertiefe deine bisherigen Erfahrungen. \n\nGestalt bedeutet, mit dem zu sein, was ist. Die Aufmerksamkeit richtet sich auf das Erleben im Moment. Wir sind in Präsenz und Mitgefühl mit dem, was darin auftaucht. In diesem gemeinsamen Da-Sein wird die Begegnung mit dir selbst und anderen ehrlicher und einfacher. \n\nAm Montag, 24. April 19-21:30 Uhr im Sonnenraum, Egonstr. 5, Stühlinger in Freiburg \n\n12-20€ Ausgleich\nAnmeldung unter chflatten@gmail.com\nAuch spontan seid ihr herzlich Willkommen!\n\nWir freuen uns auf euch!\nChristine und Mala vom Gestalt Kollektiv Freiburg",
        "topic_suggestions": {
            "spacy_NER": [
                "Freiburg",
                "Sharing-Runden"
            ],
            "rake_keywords": [
                "Offenen Gestalt Abend",
                "Aufmerksamkeit richtet",
                "Arbeit kennen",
                "Gestalt",
                "vertiefe",
                "Sharing",
                "Runden",
                "Präsenz",
                "Montag",
                "Moment",
                "Mitgefühl",
                "Lerne",
                "Gruppenübungen",
                "gemeinsamen",
                "Erleben",
                "Einzelarbeiten",
                "einfacher",
                "ehrlicher",
                "Begegnung"
            ],
            "tf_IDF": [
                "Gestalt",
                "einfacher",
                "Montag,",
                "Da-Sein",
                "bisherigen",
                "Gruppenübungen,"
            ],
            "LDA": [],
            "NMF": [
                "Montag",
                "einfacher"
            ],
            "common_topics": [
                "Freiburg",
                "Gruppenübungen,",
                "Sharing-Runden",
                "vertiefe",
                "Einzelarbeiten",
                "Aufmerksamkeit richtet",
                "Gestalt",
                "Da-Sein",
                "Präsenz",
                "bisherigen",
                "Mitgefühl",
                "Montag,",
                "Begegnung",
                "Lerne",
                "Arbeit kennen",
                "ehrlicher",
                "Moment",
                "Erleben",
                "gemeinsamen",
                "einfacher"
            ],
            "chosen_topics": [
                "Offenen Gestalt Abend",
                "Gestalt"
            ]
        },
        "timestamps": [
            {
                "date1": "2023-04-24",
                "clock1": "19:00",
                "date2": null,
                "clock2": "21:30"
            }
        ]
    },
    {
        "message": "Liebe Homöopathie Interessierte🌈,\nam Dienstag, 25. April 2023 werde ich um 19.30h einen Einführungskurs in die neue Methode nach dem holländischen Homöopathen Jan Scholten geben.\nEr hat die Elemententheorie nach dem Periodensystem entdeckt☀️ und als wertvolles Werkzeug für die Homöopathie entwickelt.🤩\nHier möchte ich einen kleinen Einblick in diese neue Welt der Homöopathieerkentnisse geben.\nLetztes Jahr konnte ich selber beim Springseminar in Utrecht in Holland Jan Scholten persönlich erleben und kennenlernen, nachdem ich nun seit 4 Jahren seine Methode versuche zu lernen😉.\n\nWer neugierig ist, ob Homöopath/in oder nicht , ist herzlich willkommen.🌈🍀💛\n\nBozener Straße 10 in Freiburg St. Georgen\n\nEnergieausgleich 45-65 Euro pro Person \nDauer ca. 2,5 Stunden\nBeginn 19.30h\n\nWww.FrankaLabas.de\n01798166934\nFrankal@gmx.de\n\nFreue mich auf eure Anmeldungen und euch dieses Wissen weiterzugeben 🤩👼\n\nWenn ihr Fragen habt, meldet euch gerne per PN bei mir 😊",
        "topic_suggestions": {
            "spacy_NER": [
                "Springseminar",
                "Utrecht",
                "Holland",
                "Liebe Homöopathie"
            ],
            "rake_keywords": [
                "selber beim Springseminar",
                "Liebe Homöopathie Interessierte",
                "Homöopathie entwickelt",
                "wertvolles Werkzeug",
                "Periodensystem entdeckt",
                "Utrecht",
                "Elemententheorie",
                "Einführungskurs",
                "Dienstag",
                "30h"
            ],
            "tf_IDF": [
                "Scholten",
                "Jan",
                "Homöopathie",
                "geben"
            ],
            "LDA": [
                "Scholten"
            ],
            "NMF": [
                "Scholten",
                "Homöopathie",
                "Jan"
            ],
            "common_topics": [
                "Scholten",
                "Liebe Homöopathie",
                "Jan",
                "Einführungskurs",
                "30h",
                "Elemententheorie",
                "Periodensystem entdeckt",
                "wertvolles Werkzeug",
                "Homöopathie entwickelt",
                "Utrecht",
                "Dienstag",
                "Springseminar",
                "Holland",
                "geben"
            ],
            "chosen_topics": [
                "Homöopathie",
                "Einführungskurs",
                "Elemententheorie"
            ]
        },
        "timestamps": [
            {
                "date1": "2023-04-25",
                "clock1": "19:30",
                "date2": null,
                "clock2": "19:30"
            }
        ]
    },
    {
        "message": "Wie lange wirst du noch warten, bevor du dich zeigst, mit dem, was du wirklich WILLST? Deine STIMME  erhebst? Dein klares JA und NEIN findest? Bis du für das gehst, was du in deinem LEBEN, deinen BEZIEHUNGEN und für die ERDE kreieren möchtest?\n\nWas hat dich bisher davon abgehalten mit solcher Klarheit aufzutauchen? Hälst du dich zurück weil du gelernt hast, dass Wut kindisch, gefährlich, unprofessionell oder verletzend ist?\n\nRage Club-Wuttraining ist ein Raum, in dem du dich im Team mit deiner Wut als Archetypischer Kraft verbindest und konkret damit experimentierst, wie du sie für dein Leben kraftvoll nutzen kannst.\n\nBefreie die KLARHEIT und ENERGIE, die in deiner bewussten WUT lebt. \n\n\nEinführung: \n26. April \njeweils 17:30-19:30 Uhr\n20-40 €\n\n4-wöchiges Wuttraining\n1./8./15./22. Mai 2023\njeweils 18:00-20:30 Uhr\n100-140 €\n\nAnmeldung bei evadaubert@posteo.de\n\nAuf facebook:\nhttps://fb.me/e/WHznHbVW",
        "topic_suggestions": {
            "spacy_NER": [
                "ERDE",
                "BEZIEHUNGEN"
            ],
            "rake_keywords": [
                "Klarheit aufzutauchen Hälst",
                "ERDE kreieren möchtest",
                "Wut kindisch",
                "STIMME erhebst",
                "Rage Club",
                "klares JA",
                "gelernt hast",
                "zeigst",
                "Wuttraining",
                "warten",
                "verletzend",
                "unprofessionell",
                "Team",
                "Raum",
                "LEBEN",
                "gehst",
                "gefährlich",
                "BEZIEHUNGEN",
                "bevor"
            ],
            "tf_IDF": [
                "gehst,",
                "abgehalten",
                "BEZIEHUNGEN",
                "gefährlich,",
                "Klarheit",
                "Club-Wuttraining"
            ],
            "LDA": [],
            "NMF": [
                "Rage",
                "Team",
                "gefährlich"
            ],
            "common_topics": [
                "gehst,",
                "STIMME erhebst",
                "BEZIEHUNGEN",
                "abgehalten",
                "Klarheit",
                "gefährlich,",
                "Wut kindisch",
                "Club-Wuttraining",
                "Rage Club",
                "unprofessionell",
                "warten",
                "zeigst",
                "klares JA",
                "bevor",
                "verletzend",
                "ERDE",
                "LEBEN",
                "gelernt hast",
                "Raum",
                "Team"
            ],
            "chosen_topics": [
                "Rage Club-Wuttraining",
                "Club-Wuttraining",
                "Wuttraining",
                "Wut"
            ]
        },
        "timestamps": [
            {
                "date1": "2023-04-26",
                "clock1": "17:30",
                "date2": null,
                "clock2": "19:30"
            },
            {
                "date1": "2023-05-15",
                "clock1": "17:30",
                "date2": "2023-05-22",
                "clock2": "19:30"
            }
        ]
    },
    {
        "message": "Hallo ihr Lieben, \nWir treffen uns regelmäßig in der Gruppe zu Ein Kurs in Wundern. \nUm uns auszutauschen und dieses Werk noch besser zu verstehen und zu erfühlen. \nJeden Mittwoch von 16-18 Uhr in Freiburg Haslach in meinem Wohnzimmer. \nDie Gruppe ist offen, du kannst zum Schnuppern dazukommen. Es ist wünschenswert, dass du weißt, worum es geht, weil wir uns in der Tiefe auseinandersetzen. \nBeitrag 15 E\nNächster Termin:\n26.04.23\nMit Anmeldung. \n\nHerzlich, Chris🌺",
        "topic_suggestions": {
            "spacy_NER": [
                "Freiburg",
                "Haslach",
                "Hallo ihr Lieben"
            ],
            "rake_keywords": [
                "Schnuppern dazukommen",
                "Freiburg Haslach",
                "Anmeldung Herzlich",
                "18 Uhr",
                "wünschenswert",
                "Wundern",
                "worum",
                "Wohnzimmer",
                "Werk",
                "weißt",
                "verstehen",
                "treffen",
                "regelmäßig",
                "Mittwoch",
                "Lieben",
                "Kurs",
                "Hallo",
                "Gruppe",
                "erfühlen",
                "Chris",
                "auszutauschen"
            ],
            "tf_IDF": [
                "Gruppe",
                "erfühlen",
                "Termin:",
                "worum",
                "Herzlich,",
                "Wundern",
                "Schnuppern"
            ],
            "LDA": [],
            "NMF": [
                "fühle",
                "auseinandersetzen",
                "Schnuppern"
            ],
            "common_topics": [
                "erfühlen",
                "Schnuppern dazukommen",
                "worum",
                "Freiburg Haslach",
                "auszutauschen",
                "Wohnzimmer",
                "wünschenswert",
                "auseinandersetzen",
                "Termin:",
                "Kurs",
                "Herzlich,",
                "Mittwoch",
                "Gruppe",
                "Wundern",
                "treffen",
                "Lieben",
                "Hallo",
                "regelmäßig",
                "Chris",
                "Werk",
                "verstehen",
                "18 Uhr",
                "Anmeldung Herzlich",
                "weißt"
            ],
            "chosen_topics": [
                "Kurs in Wundern",
                "Ein Kurs in Wundern",
                "Wundern"
            ]
        },
        "timestamps": [
            {
                "date1": "2023-04-26",
                "clock1": "16:00",
                "date2": null,
                "clock2": "18:00"
            }
        ]
    },
    {
        "message": "UPDATE second\nGaga/people class w/ Smadar Goshen ✨\n\nWednesday 26.4.  \n7-8pm (full)\n8:30 - 9:30 pm (free places!)\n\nSingle class 12-16€ as you can\n\nAnd for the crazy ones:\nboth classes 20 - 23€\n\n!Please be on time! \n\n@Südufer (Haslacherstr. 41)\n\nYou registered for the early class and want to swap? let me know!\n\n✨To register send a message to Nadja +4917656700931 ✨",
        "topic_suggestions": {
            "spacy_NER": [
                "Haslacherstr",
                "UPDATE second"
            ],
            "rake_keywords": [
                "people class w",
                "UPDATE second Gaga",
                "both classes 20"
            ],
            "tf_IDF": [
                "class",
                "for",
                "And",
                "you",
                "the",
                "Gaga/people",
                "can",
                "register"
            ],
            "LDA": [],
            "NMF": [
                "class",
                "places",
                "people",
                "early",
                "8pm",
                "free"
            ],
            "common_topics": [
                "class",
                "Gaga/people",
                "UPDATE second",
                "8pm",
                "places",
                "you",
                "free",
                "And",
                "can",
                "register",
                "Haslacherstr",
                "early",
                "for",
                "the"
            ],
            "chosen_topics": [
                "Gaga/people",
                "Gaga/people class"
            ]
        },
        "timestamps": [
            {
                "date1": "2023-04-26",
                "clock1": "08:30",
                "date2": null,
                "clock2": "09:30"
            }
        ]
    },
    {
        "message": "Liebe Freunde und Freundinnen der schamanischen Welt,\n\nwie schön sich gerade Gaia in ihrem Erwachen präsentiert: so viel Licht und Farben, Duft und Gezwitscher, dass ich manchmal ganz berauscht bin. Ich hoffe, ihr könnt die Frühlingszeit auf eure Art genießen.\n\nWir laden euch ein, am Donnerstag 27.4.2023, 18h30 Lise-Meitner Str. 12, im DIVA-Raum 210 (2. OG rechts) das Erwachen auch im Inneren zu feiern und vielleicht einen energetischen „Frühjahrsputz“ zu vollziehen. Was möchte aus eurem Strom des Lebens neu erwachen? Was hält euch noch zurück, an alten Hüllen aus Gedanken oder Mustern…\n\nLasst uns gemeinsam in die Spirit-Welt eintauchen, um die schönste und leuchtendste Blüte unserer Essens ins Leben zu gebären.\n\nWir freuen uns über zahlreiches Kommen. Herzlichst, Bettina &Carmen\n\nAnmeldung an: Bettina 0761/42994945 oder Carmen 0163 7292598",
        "topic_suggestions": {
            "spacy_NER": [
                "Lise-Meitner Str 12",
                "DIVA-Raum 210"
            ],
            "rake_keywords": [
                "Meitner Str 12",
                "manchmal ganz berauscht",
                "Strom d",
                "schamanischen Welt",
                "Liebe Freunde",
                "energetischen Frühjahrsputz",
                "Donnerstag 27",
                "Art genießen",
                "Erwachen präsentiert",
                "Erwachen",
                "vollziehen",
                "schön",
                "Licht",
                "laden",
                "Inneren",
                "hoffe",
                "Gezwitscher",
                "Frühlingszeit",
                "Freundinnen",
                "feiern",
                "Farben",
                "Duft",
                "DIVA"
            ],
            "tf_IDF": [
                "Erwachen",
                "genießen",
                "Frühjahrsputz",
                "12,",
                "vollziehen",
                "Lise-Meitner",
                "Frühlingszeit"
            ],
            "LDA": [],
            "NMF": [
                "Erwachen",
                "präsentiert",
                "eurem",
                "energetisch"
            ],
            "common_topics": [
                "Erwachen präsentiert",
                "Frühlingszeit",
                "schamanischen Welt",
                "Freundinnen",
                "Gezwitscher",
                "Duft",
                "Lise-Meitner",
                "12,",
                "vollziehen",
                "DIVA-Raum 210",
                "energetischen Frühjahrsputz",
                "energetisch",
                "Art genießen",
                "eurem",
                "Liebe Freunde",
                "Donnerstag 27",
                "schön",
                "Licht",
                "Inneren",
                "Strom d",
                "Farben",
                "hoffe",
                "laden",
                "feiern"
            ],
            "chosen_topics": [
                "schamanischen Welt",
                "energetischen Frühjahrsputz",
                "Frühlingszeit"
            ]
        },
        "timestamps": [
            {
                "date1": "2023-04-27",
                "clock1": null,
                "date2": null,
                "clock2": null
            }
        ]
    },
    {
        "message": "Sonne, Meer und Yoga? 🌞🧘🏻‍♀️🌊\n\nDiesen Donnerstag, am 27. April 2023 startet mein Yoga-Retreat in Griechenland. Wir fliegen von Basel und wenn du spontan eine Auszeit brauchst, dann melde dich.\n\n1 Woche Yoga, Stille und Austausch direkt am Meer mit einer wunderschönen Terrasse und einer Yoga-Shala im Olivenhain. Finde zur Quelle deiner inneren Kraft ❣️\n\nWeitere Infos: https://www.yoga-gold.de/retreat/griechenland-retreat-2023/\n\nLiebe Grüße\nKristin",
        "topic_suggestions": {
            "spacy_NER": [
                "Griechenland",
                "Basel",
                "Olivenhain"
            ],
            "rake_keywords": [
                "Liebe Grüße Kristin",
                "1 Woche Yoga",
                "wunderschönen Terrasse",
                "Olivenhain Finde",
                "Auszeit brauchst",
                "Austausch direkt",
                "Yoga",
                "Stille",
                "spontan",
                "Sonne",
                "Shala",
                "Retreat",
                "Quelle",
                "melde",
                "Meer",
                "Griechenland",
                "gold",
                "fliegen",
                "Donnerstag",
                "Basel"
            ],
            "tf_IDF": [
                "Meer",
                "Kristin",
                "Quelle",
                "Yoga-Shala",
                "Yoga-Retreat",
                "Yoga,",
                "fliegen",
                "Finde"
            ],
            "LDA": [],
            "NMF": [
                "Auszeit",
                "Meer",
                "Griechenland"
            ],
            "common_topics": [
                "Griechenland",
                "Meer",
                "Basel",
                "Yoga-Retreat",
                "Auszeit brauchst",
                "Yoga,",
                "fliegen",
                "spontan",
                "Yoga-Shala",
                "Austausch direkt",
                "wunderschönen Terrasse",
                "Sonne",
                "Olivenhain Finde",
                "Donnerstag",
                "Kristin",
                "Stille",
                "Quelle",
                "melde",
                "gold"
            ],
            "chosen_topics": [
                "Yoga-Retreat",
                "Yoga-Shala"
            ]
        },
        "timestamps": [
            {
                "date1": "2023-04-27",
                "clock1": null,
                "date2": null,
                "clock2": null
            }
        ]
    },
    {
        "message": "Freiburg Waldgarten\nAm Feuer oder bei Regen im Dom\n\nDo.  27.4.   \n18.30 - 22 Uhr \n\nHallo Ihr Lieben.\n\nIch lade zu einer freien Medizinarbeit mit Cacao und (wer will) Rapé ein. \n\nIns Herz.\nZentrum meines Universums. \nHerz der Welt .\n\nMithilfe der Kräfte, der Sterne und der Medizin öffnen wir uns für Nacht und für die Magie zwischen uns, um uns, die transformierende Kraft der Lieder, Sharings und Gebete. \n\nTassen und Instrumente mitbringen. Musikbeiträge herzlich willkommen.\n\nStart 18.30 Uhr\nAnkommen 18 Uhr\nTreffpunkt 17.30 Uhr für alle, die den Weg zum Waldgarten nicht kennen, an der Unterführung am Bahnhof St. Georgen.\n\nAnmeldung gerne als PN. Hilft um gut vorbereiten zu können. Spontan kommen geht natürlich auch.  Bitte pünktlich und mit Nachricht an mich.\n\nAusgleich nach vom Herzen bestimmter Höhe.\n\nInfos Hermans Kreise\nhttps://t.me/+69Pi2FzFQuJkYmU6\n\n\nViel Segen und bis bald. Hermann",
        "topic_suggestions": {
            "spacy_NER": [
                "Freiburg",
                "Dom Do"
            ],
            "rake_keywords": [
                "Dom Do 27",
                "22 Uhr Hallo",
                "30 Uhr Ankom",
                "Welt Mithilfe",
                "Universums Herz",
                "transformierende Kraft",
                "Medizin öffnen",
                "Herz Zentrum",
                "Gebete Tassen",
                "freien Medizinarbeit",
                "Freiburg Waldgarten",
                "Sterne",
                "Sharings",
                "Regen",
                "Rap",
                "Nacht",
                "Magie",
                "Lieder",
                "Lieben",
                "lade",
                "Kräfte",
                "Feuer",
                "Cacao"
            ],
            "tf_IDF": [
                "Herz",
                "Musikbeiträge",
                "Mithilfe",
                "Tassen",
                "Lieben"
            ],
            "LDA": [],
            "NMF": [
                "Lieder"
            ],
            "common_topics": [
                "Freiburg Waldgarten",
                "Dom Do",
                "Feuer",
                "Welt Mithilfe",
                "freien Medizinarbeit",
                "Lieder",
                "Universums Herz",
                "Rap",
                "Cacao",
                "Medizin öffnen",
                "Gebete Tassen",
                "Kräfte",
                "Regen",
                "transformierende Kraft",
                "Musikbeiträge",
                "Magie",
                "Sharings",
                "Herz Zentrum",
                "Lieben",
                "lade",
                "Sterne",
                "Nacht"
            ],
            "chosen_topics": [
                "Medizinarbeit mit Cacao",
                "Zentrum meines Universums",
                "Universums Herz",
                "Herz der Welt"
            ]
        },
        "timestamps": [
            {
                "date1": "2023-04-27",
                "clock1": "18:30",
                "date2": null,
                "clock2": "22:00"
            }
        ]
    },
    {
        "message": "OFFENES POSSIBILITY TEAM Freiburg - am Donnerstag 27. April\n18.30-20.30 Uhr\n\nHerzliche Einladung zu Transformation und Heilung in einem offenen Possibility Team - in diesem Team findest du dich mit anderen Menschen wieder, die sich im Kontext radikaler Verantwortung ihrer Entwicklung und dem Zugang zu neuen (inneren & äußeren) Möglichkeiten widmen. Du brauchst dafür keine Vorerfahrung mitzubringen. \nNach einem kurzen Intro aus dem Kontext von Possibility Management forschen wir gemeinsam damit zentriert zu sein, bewusst fühlen zu lernen, Gefühle von Emotionen zu unterscheiden, sowie diese zu navigieren und zu lernen, wie du sie im Alltag bewusst für dich nutzen kannst.\nIn diesem Team geht es darum, die Arbeit von Possibility Management kennenzulernen. Wir bieten dir und uns damit die Möglichkeit, regelmäßig in einer Gruppe mit anderen die eigenen Fähigkeiten zu trainieren, verantwortlich für sich selbst und die eigenen Bedürfnisse im Kontakt mit anderen einzustehen.\n\nOrt: Günterstalstraße 17, 79102 Freiburg, im 5.OG in den Räumen von physiopoint\nZeit: 18.30-20.30 Uhr\nBeitrag: Wir teilen uns die Kosten für die Raummiete (5€ p.P.). Zuzüglich hast du die Möglichkeit eine frei gewählte Wertschätzung als Spende da zu lassen.\nRaumhalter*innen: Wir wechseln uns mit dem Raumhalten ab. Dieses Mal sind es Eva und Markus\nAnmeldung: gerne per Telegram an Markus. Spontanes Hinzukommen ist möglich. \nAnkommen und Pünktlichkeit: Bitte komme pünktlich 10 Minuten vor Beginn. Wir schließen um 18:30 Uhr die Tür.\nMitbringen: Beep! Buch (Notitzbuch), Stift und Wasserflasche.\n\nWeitere Termine für das offene Possibility Team Freiburg finden am selben Ort und an den folgenden Donnerstagen statt:\n    * 25. Mai \n    * 29. Juni\n    * 20. Juli \n\nTelegram Gruppe PM Kollektiv Freiburg:\nhttps://t.me/+_msdof0ftic1NjRi\nWeitere Informationen:\nevadaubert.de | markusbork.org | benno-enderlein.de | oliverarnold.net\n\nHerzlich\nMarkus",
        "topic_suggestions": {
            "spacy_NER": [
                "OFFENES",
                "Possibility Management"
            ],
            "rake_keywords": [
                "Possibility Management forschen",
                "offenen Possibility Team",
                "Kontext radikaler Verantwortung",
                "Team findest",
                "Vorerfahrung mitzubringen",
                "kurzen Intro",
                "brauchst dafür",
                "Kontext",
                "Zugang",
                "Transformation",
                "Menschen",
                "Heilung",
                "gemeinsam",
                "Entwicklung"
            ],
            "tf_IDF": [
                "POSSIBILITY",
                "TEAM",
                "Kontext",
                "Intro",
                "äußeren",
                "forschen",
                "mitzubringen"
            ],
            "LDA": [],
            "NMF": [
                "POSSIBILITY",
                "Kontext"
            ],
            "common_topics": [
                "POSSIBILITY",
                "Kontext",
                "Transformation",
                "Heilung",
                "Vorerfahrung mitzubringen",
                "kurzen Intro",
                "forschen",
                "TEAM",
                "Possibility Management",
                "OFFENES",
                "Zugang",
                "Team findest",
                "Menschen",
                "äußeren",
                "Entwicklung",
                "brauchst dafür",
                "gemeinsam"
            ],
            "chosen_topics": [
                "Possibility Management",
                "POSSIBILITY TEAM",
                "POSSIBILITY",
                "Transformation"
            ]
        },
        "timestamps": [
            {
                "date1": "2023-04-27",
                "clock1": "18:30",
                "date2": null,
                "clock2": "20:30"
            },
            {
                "date1": "2023-05-25",
                "clock1": "18:30",
                "date2": null,
                "clock2": "20:30"
            },
            {
                "date1": "2023-06-29",
                "clock1": "18:30",
                "date2": null,
                "clock2": "20:30"
            }
        ]
    },
    {
        "message": "Einladung zum\nEarth Tribe Frühlings Gathering - Beltane\n\nam 27. April - 01. Mai\n\nWir sind gerade in den letzten Vorbereitung für das kommende Zusammentreffen.\n\nEs gibt noch ca 10 freie Plätze, fix anmelden wenn Ihr noch unschlüssig wart <3\n\nHier ein kleiner Preview des schon vorhandenen Programms\n\nWir suchen noch drei Workshops:\n- Einen Singkreis\n\n- Einen erfahrenen Yogalehrer\n\n- Einen Workshop im Kinderprogramm\n\n(meldet euch gerne an programm@earth-tribe.de)\n\n\n\nNeben viel Wald und Wiesen haben wir ein großes Gebäude mit warmen Holzofen zur Verfügung welchen wir neben Übernachtung in mehreren Räumen zum gemütlichen Ort der Begegnung verwandeln werden.\n\nMit maximal 80 Menschen werden wir drinnen und draußen das Zusammensein genießen.\n\nGemeinsam werden wir den Frühling, das Erwachen der Natur, das Fruchtbarkeitsfest und den Sommerbeginn in vollen Zügen zelebrieren.  \n\n\nHier ist die Einladung mit Anmeldung       Einladung\n\nPackt alle eure liebsten ein und kommt vorbei ❤️\n\n\n🌈 Aheya 🌈",
        "topic_suggestions": {
            "spacy_NER": [
                "Beltane",
                "Earth Tribe"
            ],
            "rake_keywords": [
                "unschlüssig wart 3",
                "programm earth",
                "letzten Vorbereitung",
                "kommende Zusammentreffen",
                "Kinderprogramm meldet",
                "fix anmelden",
                "erfahrenen Yogalehrer",
                "de Neben",
                "27 April",
                "01 Mai",
                "Tribe",
                "Workshop",
                "Wiesen",
                "Wald",
                "suchen",
                "Singkreis",
                "gerne",
                "Einladung",
                "Beltane"
            ],
            "tf_IDF": [
                "suchen",
                "erfahrenen",
                "vorhandenen",
                "letzten",
                "Vorbereitung",
                "Gathering"
            ],
            "LDA": [],
            "NMF": [
                "Beltane",
                "Tribe"
            ],
            "common_topics": [
                "Beltane",
                "Earth Tribe",
                "Gathering",
                "letzten Vorbereitung",
                "Einladung",
                "01 Mai",
                "kommende Zusammentreffen",
                "fix anmelden",
                "27 April",
                "Workshop",
                "erfahrenen Yogalehrer",
                "Kinderprogramm meldet",
                "Singkreis",
                "programm earth",
                "vorhandenen",
                "Wald",
                "Wiesen",
                "de Neben",
                "suchen",
                "gerne"
            ],
            "chosen_topics": [
                "Earth Tribe Frühlings Gathering",
                "Earth Tribe",
                "Beltane",
                "Gathering",
                "Fruchtbarkeitsfest"
            ]
        },
        "timestamps": [
            {
                "date1": "2023-04-27",
                "clock1": null,
                "date2": "2023-05-01",
                "clock2": null
            }
        ]
    },
    {
        "message": "Freiburg Waldgarten\nAm Feuer oder bei Regen im Dom\n\nDo.  27.4.   \n18.30 - 22 Uhr \n\nHallo Ihr Lieben.\n\nIch lade zu einer freien Medizinarbeit mit Cacao und (wer will) Rapé ein. \n\nIns Herz.\nZentrum meines Universums. \nHerz der Welt .\n\nMithilfe der Kräfte, der Sterne und der Medizin öffnen wir uns für Nacht und für die Magie zwischen uns, um uns, die transformierende Kraft der Lieder, Sharings und Gebete. \n\nTassen und Instrumente mitbringen. Musikbeiträge herzlich willkommen.\n\nStart 18.30 Uhr\nAnkommen 18 Uhr\nTreffpunkt 17.30 Uhr für alle, die den Weg zum Waldgarten nicht kennen, an der Unterführung am Bahnhof St. Georgen.\n\nAnmeldung gerne als PN. Hilft um gut vorbereiten zu können. Spontan kommen geht natürlich auch.  Bitte pünktlich und mit Nachricht an mich.\n\nAusgleich nach vom Herzen bestimmter Höhe.\n\nInfos Hermans Kreise\nhttps://t.me/+69Pi2FzFQuJkYmU6\n\n\nViel Segen und bis bald. Hermann",
        "topic_suggestions": {
            "spacy_NER": [
                "Freiburg",
                "Dom Do"
            ],
            "rake_keywords": [
                "Dom Do 27",
                "22 Uhr Hallo",
                "30 Uhr Ankom",
                "Welt Mithilfe",
                "Universums Herz",
                "transformierende Kraft",
                "Medizin öffnen",
                "Herz Zentrum",
                "Gebete Tassen",
                "freien Medizinarbeit",
                "Freiburg Waldgarten",
                "Sterne",
                "Sharings",
                "Regen",
                "Rap",
                "Nacht",
                "Magie",
                "Lieder",
                "Lieben",
                "lade",
                "Kräfte",
                "Feuer",
                "Cacao"
            ],
            "tf_IDF": [
                "Herz",
                "Musikbeiträge",
                "Mithilfe",
                "Tassen",
                "Lieben"
            ],
            "LDA": [],
            "NMF": [],
            "common_topics": [
                "Freiburg Waldgarten",
                "Dom Do",
                "Feuer",
                "Welt Mithilfe",
                "freien Medizinarbeit",
                "Universums Herz",
                "Rap",
                "Cacao",
                "Medizin öffnen",
                "Gebete Tassen",
                "Kräfte",
                "Regen",
                "transformierende Kraft",
                "Musikbeiträge",
                "Magie",
                "Sharings",
                "Herz Zentrum",
                "Lieder",
                "Lieben",
                "lade",
                "Sterne",
                "Nacht"
            ],
            "chosen_topics": [
                "Medizinarbeit mit Cacao",
                "Zentrum meines Universums",
                "Universums Herz",
                "Herz der Welt"
            ]
        },
        "timestamps": [
            {
                "date1": "2023-04-27",
                "clock1": "18:30",
                "date2": null,
                "clock2": "22:00"
            }
        ]
    },
    {
        "message": "Vom 28.04.-01.05. findet das Frühlings Connectival statt. Neben wunderbaren Festivalimpulsen, die in die Verbindung mit anderen führen, geht es diesmal für wilde Waldspiele in die direkt umliegende Natur.\n\nEcstatic Wildness - Waldspiele! Jetzt.\nAm Samstag treffen wir uns um 15.15 Uhr am Waldrand um gemeinsam unseren urwilden Kräften nachzukommen! Die groß angelegten, aus der Wildnispädagogik stammenden, Koop-Waldspiele führen uns in ein  Adrenalin-,Serotonin- und Dopamin-geladenes Reich der Ecstatic Wildness, wo es gilt verborgene Schätze zu erbeuten und immer wieder neu in der Gruppe zu fließen. Wir bemalen uns, schleichen, tarnen, jagen und probieren aus, was es heißt, tief in die animalischen Aspekte unseres Menschseins und die kindlich-verspielte Verbindung mit der Gemeinschaft einzutauchen. Alles mit viel Lachen im Gesicht und wunderschönen Momenten im Schoß der Natur. Sei willkommen, so wie du bist!\n\nFür mehr Infos und Tickets könnt ihr unter connectival.de vorbeischauen 🌲🐚🫶🏽🌳🎉💗",
        "topic_suggestions": {
            "spacy_NER": [
                "Ecstatic Wildness",
                "Dopamin-geladenes Reich der Ecst",
                "Koop-Waldspiele",
                "Adrenalin-,Serotonin-"
            ],
            "rake_keywords": [
                "urwilden Kräften nachzukommen",
                "Wildnispädagogik stammenden",
                "Samstag treffen",
                "geladenes Reich",
                "05 findet",
                "wilde Waldspiele",
                "15 Uhr",
                "Waldspiele führen",
                "Waldspiele",
                "führen",
                "Waldrand",
                "Verbindung",
                "Koop",
                "gemeinsam",
                "Ecst",
                "Dopamin",
                "diesmal"
            ],
            "tf_IDF": [
                "Waldspiele",
                "Dopamin-geladenes",
                "Wildnispädagogik",
                "Kräften",
                "Wildness",
                "Waldrand"
            ],
            "LDA": [],
            "NMF": [
                "Waldspiele",
                "führen",
                "geladenes"
            ],
            "common_topics": [
                "wilde Waldspiele",
                "Waldrand",
                "05 findet",
                "Ecstatic Wildness",
                "Kräften",
                "Wildnispädagogik stammenden",
                "Dopamin-geladenes",
                "Koop-Waldspiele",
                "Waldspiele führen",
                "Adrenalin-,Serotonin-",
                "diesmal",
                "Verbindung",
                "Samstag treffen",
                "15 Uhr",
                "gemeinsam",
                "geladenes Reich"
            ],
            "chosen_topics": [
                "Frühlings Connectival",
                "Connectival",
                "Ecstatic Wildness"
            ]
        },
        "timestamps": [
            {
                "date1": "2023-04-28",
                "clock1": "01:05",
                "date2": "2023-05-01",
                "clock2": "15:15"
            }
        ]
    },
    {
        "message": "Die nächste Gong-Klang-Alchemie 2.0 mit Cacao-Zeremonie findet am 28. April statt und es sind noch wenige Plätze frei. \nMehr Infos im Flyer unten drunter👇\nIch freue mich auf DICH!\n\nMichaela",
        "topic_suggestions": {
            "spacy_NER": [],
            "rake_keywords": [
                "Flyer unten drunter",
                "28 April statt",
                "Zeremonie findet",
                "nächste Gong",
                "Alchemie 2",
                "Michaela",
                "Klang",
                "freue",
                "Cacao"
            ],
            "tf_IDF": [
                "Michaela",
                "Gong-Klang-Alchemie",
                "Cacao-Zeremonie",
                "drunter",
                "unten",
                "Flyer",
                "nächste"
            ],
            "LDA": [],
            "NMF": [
                "unten",
                "Alchemie",
                "Klang",
                "Gong"
            ],
            "common_topics": [
                "Gong-Klang-Alchemie",
                "nächste Gong",
                "Cacao-Zeremonie",
                "Alchemie 2",
                "Zeremonie findet",
                "Michaela",
                "Flyer",
                "drunter",
                "freue",
                "unten"
            ],
            "chosen_topics": [
                "Gong-Klang-Alchemie",
                "Cacao-Zeremonie"
            ]
        },
        "timestamps": [
            {
                "date1": "2023-04-28",
                "clock1": null,
                "date2": null,
                "clock2": null
            }
        ]
    },
    {
        "message": "💃🌷🔥💃Für Frauen💃🔥🌷💃\nShakti Dance & Blissful Embodiment\n\nWild & Verrückt zu Walpurgis, 28.4.\n\nmit Mayonah\n\nIch lade euch zu einem ungewöhnlichen Shakti Dance Abend ein, in der wir Walpurgis' Energie in uns erwecken, uns erlauben, mal \"neben der Spur\" zu sein und verrückten Impulsen Raum zu geben.\nAlles, was du sonst aus Anstand, Höflichkeit und Konditionen zurückhälst, darf sich an diesem Abend lust- und humorvoll Raum nehmen.\n\nIm Shakti Dance & Blissful Embodiment werden wir diesmal mit Witz und Pep unseren Pobacken einen besonderen Fokus schenken und tiefer in einem lustvoll verkörpert Sein in ihnen ankommen.\n\nÜber fließende und dynamische Asanas im Shakti Yoga, Pranaatmung, schütteln, kreativem Tanz und einem unterstützenden Schwesternfeld bringen wir schlafendes Potential ins Fließen, erwecken neues Leben in der Körperin, speziell in den Pobacken, und füllen sie mit vibrierender Shaktienergie.✨🔥✨\n\nKomm und sei dabei, dich mit der Frühlingslust von Walpurga im Kreis der Frauen neu zu beleben!💃🔥🌷💃\n\nBitte kommt in frecher ungewöhnlicher Kleidung und evtl. etwas Bemalung, die es dir leichter macht, mal aus der Rolle zu tanzen. Bitte frühzeitig anmelden!\n\nOrt: Yogazentrum Freiburg, 2.OG Marie-Curie-Str.3, Vauban, Freiburg \nUhrzeit: 19 - 22.00 Uhr (Ankommen 18.45 Uhr)\nAusgleich: 35.-Euro / 30.- ermäßigt\nInfo & Anmeldung: Mayonah Bliss, info@weiblichkeit-erwacht.de, 0177-6488855, www.weiblichkeit-erwacht.de",
        "topic_suggestions": {
            "spacy_NER": [],
            "rake_keywords": [
                "verrückten Impulsen Raum",
                "humorvoll Raum nehmen",
                "Abend lust",
                "mal neben",
                "Konditionen zurückhälst",
                "Walpurgis Energie",
                "Walpurgis",
                "Witz",
                "Spur",
                "Mayonah",
                "lade",
                "Höflichkeit",
                "geben",
                "erwecken",
                "erlauben",
                "diesmal",
                "Anstand"
            ],
            "tf_IDF": [
                "Shakti",
                "Dance",
                "Embodiment",
                "Blissful",
                "Raum",
                "Abend",
                "Wild",
                "humorvoll"
            ],
            "LDA": [],
            "NMF": [
                "Shakti",
                "Blissful",
                "Embodiment",
                "Walpurgis"
            ],
            "common_topics": [
                "Shakti",
                "Blissful",
                "Embodiment",
                "Walpurgis Energie",
                "Dance",
                "Mayonah",
                "Wild",
                "erwecken",
                "Konditionen zurückhälst",
                "humorvoll",
                "Höflichkeit",
                "Anstand",
                "Witz",
                "Abend lust",
                "lade",
                "Raum",
                "mal neben",
                "Spur",
                "erlauben",
                "diesmal",
                "geben"
            ],
            "chosen_topics": [
                "Shakti Dance & Blissful Embodiment",
                "Shakti Dance Blissful Embodiment",
                "Shakti Dance",
                "Walpurgis Energie",
                "Walpurgis",
                "Blissful Embodiment",
                "Shakti",
                "Dance"
            ]
        },
        "timestamps": [
            {
                "date1": "2023-04-28",
                "clock1": "19:00",
                "date2": null,
                "clock2": "22:00"
            }
        ]
    },
    {
        "message": "Frühlingskraft, 29.04., 11-18 Uhr, in Denzlingen, 20 €",
        "topic_suggestions": {
            "spacy_NER": [
                "Denzlingen",
                "Frühlingskraft"
            ],
            "rake_keywords": [
                "18 Uhr",
                "Frühlingskraft",
                "Denzlingen"
            ],
            "tf_IDF": [
                "Frühlingskraft,",
                "Denzlingen,"
            ],
            "LDA": [],
            "NMF": [
                "Denzlingen",
                "Frühlingskraft"
            ],
            "common_topics": [
                "Frühlingskraft,",
                "Denzlingen,",
                "18 Uhr"
            ],
            "chosen_topics": [
                "Frühlingskraft",
                "Frühlingskraft,"
            ]
        },
        "timestamps": [
            {
                "date1": "2023-04-29",
                "clock1": "11:00",
                "date2": null,
                "clock2": "18:00"
            }
        ]
    },
    {
        "message": "Herzliche Einladung zur Walpurgisnacht-Feier!\n\n Am 30.4.2023 um 19:30 Uhr im Achillea Heilpflanzengarten \n\nIn diesem wichtigen Fest geht es um Selbstermächtigung, Fruchtbarkeit und Kreativität. Im keltischen Kulturkreis wurde am 1. Mai Beltane gefeiert. Beltane bedeutet so viel wie „leuchtendes Feuer“. Die Zeit um Walpurgis herum bestärkt uns darin handlungsaktiv zu sein und mit unserem Potential die Welt mitzugestalten. Genauso zelebrieren wir die Lebensfreude und unsere Lust nach außen zu gehen. Unsere individuelle Ausprägung dieser Gestaltungskraft wollen wir zu Walpurgis rituell entfachen, mit ihr in Kontakt gehen und sie bei einem Sprung übers Feuer bekräftigen.\n\nAnmeldung:  bis zum 29.04.23, Weitere Infos:\nhttps://selma-gestrich.de/jahreskreis-rituale\n\nWir freuen uns auf Euch,\nEure Selma und Mechtap",
        "topic_suggestions": {
            "spacy_NER": [
                "Walpurgisnacht-Feier",
                "keltischen"
            ],
            "rake_keywords": [
                "wichtigen Fest geht",
                "Walpurgis herum bestärkt",
                "keltischen Kulturkreis wurde",
                "leuchtendes Feuer",
                "Herzliche Einladung",
                "Achillea Heilpflanzengarten",
                "30 Uhr",
                "Walpurgisnacht",
                "Selbstermächtigung",
                "Potential",
                "Lust",
                "Lebensfreude",
                "Kreativität",
                "gehe",
                "Fruchtbarkeit",
                "Feier",
                "außen"
            ],
            "tf_IDF": [
                "Beltane",
                "handlungsaktiv",
                "gehe",
                "gefeiert",
                "Walpurgisnacht-Feier",
                "Selbstermächtigung,",
                "Fruchtbarkeit",
                "wichtigen",
                "Heilpflanzengarten"
            ],
            "LDA": [
                "zelebrieren"
            ],
            "NMF": [
                "herum",
                "Walpurgisnacht"
            ],
            "common_topics": [
                "Walpurgisnacht-Feier",
                "Fruchtbarkeit",
                "Herzliche Einladung",
                "Achillea Heilpflanzengarten",
                "Selbstermächtigung,",
                "Beltane",
                "keltischen",
                "Kreativität",
                "handlungsaktiv",
                "leuchtendes Feuer",
                "Potential",
                "zelebrieren",
                "Lebensfreude",
                "herum",
                "wichtigen",
                "30 Uhr",
                "gefeiert",
                "Lust",
                "außen",
                "gehe"
            ],
            "chosen_topics": [
                "Walpurgisnacht-Feier",
                "Walpurgisnacht",
                "Beltane"
            ]
        },
        "timestamps": [
            {
                "date1": "2023-04-30",
                "clock1": "19:30",
                "date2": null,
                "clock2": "19:30"
            },
            {
                "date1": "2023-05-01",
                "clock1": "19:30",
                "date2": null,
                "clock2": "19:30"
            },
            {
                "date1": "2023-04-29",
                "clock1": "19:30",
                "date2": null,
                "clock2": "19:30"
            }
        ]
    },
    {
        "message": "Die Natur und den Frühling spüren.\n\nBarfuß-Hike und Sundown-Silentdance in Freiburg.\nGerne möchte ich mit interessierten Menschen eine Barfußwanderung in der Natur um Freiburg machen, und anschließend den Abend bei einem Silentdance auf einer Wiese ausklingen lassen.\n\nWann? Samstag, 29.04.23 18.30 Uhr\nWo? Genaueres erfahrt ihr per PN\n\nWas braucht ihr?\nVerpflegung, Kopfhörer, Smartphone mit euren Lieblingsliedern, Stirnlampe oder Taschenlampe \n\nSchreibt mir gerne :)",
        "topic_suggestions": {
            "spacy_NER": [
                "Sundown-Silentdance",
                "Freiburg",
                "Barfuß-Hike"
            ],
            "rake_keywords": [
                "Frühling spüren Barfuß",
                "Freiburg Gerne möchte",
                "Taschenlampe Schreibt",
                "per PN",
                "interessierten Menschen",
                "Genaueres erfahrt",
                "30 Uhr",
                "Gerne",
                "Freiburg",
                "Verpflegung",
                "Sundown",
                "Stirnlampe",
                "Smartphone",
                "Silentdance",
                "Natur",
                "Lieblingsliedern",
                "Kopfhörer",
                "Hike",
                "braucht",
                "Barfußwanderung",
                "anschließend",
                "Abend"
            ],
            "tf_IDF": [
                "Natur",
                "Gerne",
                "Taschenlampe",
                "Frühling",
                "Schreibt",
                "Wiese",
                "Smartphone"
            ],
            "LDA": [
                "Barfuß-Hike"
            ],
            "NMF": [
                "Silentdance",
                "Genaueres"
            ],
            "common_topics": [
                "Barfuß-Hike",
                "Sundown-Silentdance",
                "Freiburg",
                "Frühling",
                "Smartphone",
                "Barfußwanderung",
                "per PN",
                "Taschenlampe Schreibt",
                "Natur",
                "Verpflegung",
                "Wiese",
                "Kopfhörer",
                "Stirnlampe",
                "Lieblingsliedern",
                "Gerne",
                "Genaueres erfahrt",
                "interessierten Menschen",
                "anschließend",
                "30 Uhr",
                "Abend",
                "braucht"
            ],
            "chosen_topics": [
                "Barfuß-Hike",
                "Sundown-Silentdance",
                "Barfußwanderung",
                "Silentdance"
            ]
        },
        "timestamps": [
            {
                "date1": "2023-04-29",
                "clock1": "18:30",
                "date2": null,
                "clock2": null
            }
        ]
    },
    {
        "message": "Liebe Freiburger,\n\nnächsten Samstag am 29.4 wird von 15:30 bis ca. 19:30 mein astrologischer Salon stattfinden. Ihr seid herzlich eingeladen. Auch biete ich persönliche astrologische Beratungen an. Bei Interesse: Einfach PN an mich. \n\nPreis: 40-50 Euro nach Selbsteinschätzung\n\nIm astrologischen Salon bekommst du anhand von Bilderserien & Körperübungen eine erhellende Einführung in Symbolik und die archetypischen Energien der 12 Tierkreiszeichen. Ein informativer Abend, der sich aber nicht in erster Linie um Informationen, sondern um dich dreht.\n\n„Wie oben, so unten“ – Was hast du als Mensch hier „unten“ mit den Planeten dort „oben“ zu tun?\n\nAls Gastgeber des Abends werde ich euch über eure Sternzeichen miteinander in Kontakt bringen. Du bist eingeladen, dich mit deinem Charakter zu zeigen – deckt er sich mit deinem Tierkreiszeichen? Sicher ist: Du wirst sogar Neues oder Unerwartetes über dich selbst und von anderen Teilnehmern erfahren.",
        "topic_suggestions": {
            "spacy_NER": [
                "ers",
                "Liebe Freiburger",
                "Einfach PN"
            ],
            "rake_keywords": [
                "persönliche astrologische Beratungen",
                "astrologischer Salon stattfinden",
                "astrologischen Salon bekommst",
                "nächsten Samstag",
                "Liebe Freiburger",
                "informativer Abend",
                "erhellende Einführung",
                "Einfach PN",
                "ca 19",
                "Bilderserien Körperübungen",
                "archetypischen Energien",
                "50 Euro",
                "12 Tierkreiszeichen",
                "Symbolik",
                "Selbsteinschätzung",
                "Preis",
                "Interesse",
                "ers",
                "biete",
                "anhand"
            ],
            "tf_IDF": [
                "Salon",
                "erhellende",
                "informativer",
                "astrologischer",
                "astrologischen",
                "astrologische",
                "Beratungen",
                "Körperübungen",
                "biete"
            ],
            "LDA": [],
            "NMF": [
                "Euro",
                "Salon",
                "Energien",
                "astrologischen",
                "astrologische"
            ],
            "common_topics": [
                "Liebe Freiburger",
                "Salon",
                "astrologischen",
                "Einfach PN",
                "astrologischer",
                "erhellende Einführung",
                "Bilderserien Körperübungen",
                "Selbsteinschätzung",
                "informativer Abend",
                "Beratungen",
                "archetypischen Energien",
                "Symbolik",
                "12 Tierkreiszeichen",
                "nächsten Samstag",
                "ca 19",
                "anhand",
                "50 Euro",
                "biete",
                "Interesse",
                "Preis"
            ],
            "chosen_topics": [
                "persönliche astrologische Beratungen",
                "astrologische Beratungen",
                "astrologischer Salon",
                "astrologischer Salon stattfinden",
                "astrologischer"
            ]
        },
        "timestamps": [
            {
                "date1": "2023-04-29",
                "clock1": "15:30",
                "date2": null,
                "clock2": "19:30"
            }
        ]
    },
    {
        "message": "❗️Wir verlosen zwei freie Plätze❗️ \n\nBist du dabei? 😍 \nDann schreibe einfach eine direkte Nachricht an uns!\n\nSonntagabend entscheiden wir ob du gewonnen hast!😍\n\nDas Seminar findet am Samstag, den 29.04.2023 um 10-19:00Uhr & am \nSonntag, den 30.04.2023 um 10-18:00Uhr statt. \nHier im schönen Freiburg. \n\nWir freuen uns rießig deine Bekanntschaft zu machen. \nLiebe Grüße \nMelanie und Jörn",
        "topic_suggestions": {
            "spacy_NER": [
                "Freiburg"
            ],
            "rake_keywords": [
                "Liebe Grüße Melanie",
                "Sonntagabend entscheiden",
                "Seminar findet",
                "schönen Freiburg",
                "schreibe einfach",
                "gewonnen hast",
                "direkte Nachricht",
                "00Uhr statt",
                "00Uhr",
                "Sonntag",
                "Samstag",
                "rießig",
                "Jörn",
                "freuen",
                "Bekanntschaft"
            ],
            "tf_IDF": [
                "direkte",
                "gewonnen",
                "Sonntagabend",
                "Jörn",
                "rießig",
                "verlosen",
                "Melanie"
            ],
            "LDA": [],
            "NMF": [
                "00Uhr"
            ],
            "common_topics": [
                "00Uhr statt",
                "verlosen",
                "Sonntagabend entscheiden",
                "rießig",
                "gewonnen hast",
                "schönen Freiburg",
                "direkte Nachricht",
                "Jörn",
                "Melanie",
                "Seminar findet",
                "Bekanntschaft",
                "schreibe einfach",
                "Samstag",
                "freuen"
            ],
            "chosen_topics": [
                "freie Plätze",
                "zwei freie Plätze",
                "Seminar"
            ]
        },
        "timestamps": [
            {
                "date1": "2023-04-29",
                "clock1": "10:00",
                "date2": null,
                "clock2": "19:00"
            },
            {
                "date1": "2023-04-30",
                "clock1": "10:00",
                "date2": null,
                "clock2": "19:00"
            }
        ]
    },
    {
        "message": "￼\nmove feminin – kennenlernen\nKurse & Feste mit Ludfia\n  Sa | 29. April | 10.30-11.15 in Freiburg-Whiehre\n\n\"Im Kreis der Frauen deinen Körper erkunden, spüren und trainieren,\nBeweglichkeit, Kraft und Selbstbewusstsein entwickeln –\nsanft und dynamisch, freudig und spielerisch.\"\n\nGet Together – kreatives Frauentanzfest\nMotto – Alles neu macht der Mai\nMo | 01. Mai | 18 - 21 Uhr\nKomm mit einer Frisur/Kopfbedeckung, die du so noch nie hattest und lass Dich überraschen.\nOrt: Density, Schwabentorring 7\nAuf Spendenbasis | Anmeldung erforderlich",
        "topic_suggestions": {
            "spacy_NER": [
                "Freiburg-Whiehre",
                "Kreis der Frauen deinen Körper",
                "move feminin",
                "Get Together"
            ],
            "rake_keywords": [
                "Selbstbewusstsein entwickeln sanft",
                "21 Uhr Komm",
                "überraschen Ort",
                "Schwabentorring 7",
                "neu macht",
                "Körper erkunden",
                "Whiehre",
                "trainieren",
                "spüren",
                "spielerisch",
                "lass",
                "Kreis",
                "Kraft",
                "Kopfbedeckung",
                "Frisur",
                "freudig",
                "Freiburg",
                "Frauen",
                "dynamisch",
                "Density",
                "Beweglichkeit"
            ],
            "tf_IDF": [
                "Mai",
                "Frisur/Kopfbedeckung,",
                "Motto",
                "Kreis",
                "hattest",
                "Kurse",
                "Get",
                "Ludfia",
                "freudig"
            ],
            "LDA": [],
            "NMF": [
                "freudig",
                "erkunden"
            ],
            "common_topics": [
                "freudig",
                "Ludfia",
                "move feminin",
                "Freiburg-Whiehre",
                "Körper erkunden",
                "trainieren",
                "Kurse",
                "Get Together",
                "Motto",
                "Beweglichkeit",
                "spielerisch",
                "Frisur/Kopfbedeckung,",
                "dynamisch",
                "Schwabentorring 7",
                "Density",
                "Kreis",
                "spüren",
                "überraschen Ort",
                "Frauen",
                "Kraft",
                "Mai",
                "neu macht",
                "hattest",
                "lass"
            ],
            "chosen_topics": [
                "move feminin",
                "Kreis der Frauen",
                "Kurse & Feste mit Ludfia",
                "Kurse & Feste",
                "Feste mit Ludfia",
                "Kreis der Frauen deinen Körper"
            ]
        },
        "timestamps": [
            {
                "date1": "2023-04-29",
                "clock1": "10:30",
                "date2": null,
                "clock2": "11:15"
            },
            {
                "date1": "2023-05-01",
                "clock1": "10:30",
                "date2": null,
                "clock2": "11:15"
            }
        ]
    },
    {
        "message": "Auszeit für Mamas, 30.04.,10-16 Uhr, in Denzlingen, 15 €",
        "topic_suggestions": {
            "spacy_NER": [
                "Denzlingen",
                "Auszeit für Mamas"
            ],
            "rake_keywords": [
                "16 Uhr",
                "Mamas",
                "Denzlingen",
                "Auszeit"
            ],
            "tf_IDF": [
                "Mamas,",
                "Denzlingen,",
                "Auszeit"
            ],
            "LDA": [],
            "NMF": [
                "Mamas"
            ],
            "common_topics": [
                "Auszeit",
                "Mamas,",
                "Denzlingen,",
                "16 Uhr"
            ],
            "chosen_topics": [
                "Auszeit für Mamas",
                "Auszeit",
                "Mamas"
            ]
        },
        "timestamps": [
            {
                "date1": "2023-04-30",
                "clock1": "10:00",
                "date2": null,
                "clock2": "16:00"
            }
        ]
    },
    {
        "message": "Auszeit für Mamas, 30.04.,10-16 Uhr, in Denzlingen, 15 €",
        "topic_suggestions": {
            "spacy_NER": [
                "Denzlingen",
                "Auszeit für Mamas"
            ],
            "rake_keywords": [
                "16 Uhr",
                "Mamas",
                "Denzlingen",
                "Auszeit"
            ],
            "tf_IDF": [
                "Mamas,",
                "Denzlingen,",
                "Auszeit"
            ],
            "LDA": [],
            "NMF": [],
            "common_topics": [
                "Auszeit",
                "Mamas,",
                "Denzlingen,",
                "16 Uhr"
            ],
            "chosen_topics": [
                "Auszeit für Mamas",
                "Auszeit",
                "Mamas"
            ]
        },
        "timestamps": [
            {
                "date1": "2023-04-30",
                "clock1": "10:00",
                "date2": null,
                "clock2": "16:00"
            }
        ]
    },
    {
        "message": "Gewinnspiel!\n\nGewinne eine Shiatsu-Sitzung für dich und eine Person deines Herzens!\nBald ist der 1. Mai. Ein Feiertag für alle, die arbeiten und vor allem für alle, die unter schlechten Bedingungen arbeiten und für bessere Bedingungen kämpfen. Nicht alle haben wie ich das Glück, sich durch Lohnarbeit selbst zu verwirklichen und ihre Träume zu leben. Ffür viele Menschen ist die Lohnarbeit und der damit einhergehende Alltag mit sehr viel Stress verbunden. Dieser kann auf Dauer zum Burnout führen. Shiatsu kann hier eine sehr effektive und wohltuende Präventionsstrategie sein. Jede Behandlung lindert nicht nur den Stress, sondern bringt dich näher zu dir selbst und hilft dir, den Kopf auszuschalten und deiner Intuition zu folgen.\n\nMöchtest du Shiatsu näher kennen lernen und deinen Arbeitsalltag erleichtern?\n\nIch verlose am 1. Mai 2023 2x2 Shiatsubehandlungen für dich und  eine weitere Person deiner Wahl. \n\nHier gehts zum Gewinnspiel:https://www.instagram.com/p/CrdhQYiOlAQ/",
        "topic_suggestions": {
            "spacy_NER": [],
            "rake_keywords": [
                "bessere Bedingungen kämpfen",
                "schlechten Bedingungen arbeiten",
                "Stress verbunden",
                "Herzens Bald",
                "Gewinnspiel Gewinne",
                "einhergehende Alltag",
                "Burnout führen",
                "1 Mai",
                "arbeiten",
                "verwirklichen",
                "Träume",
                "Sitzung",
                "Shiatsu",
                "Person",
                "Lohnarbeit",
                "Glück",
                "Feiertag",
                "Dauer"
            ],
            "tf_IDF": [
                "Lohnarbeit",
                "arbeiten",
                "Bedingungen",
                "Person",
                "deines",
                "einhergehende"
            ],
            "LDA": [],
            "NMF": [
                "Bedingungen",
                "Lohnarbeit"
            ],
            "common_topics": [
                "Lohnarbeit",
                "Gewinnspiel Gewinne",
                "Shiatsu",
                "Sitzung",
                "Bedingungen",
                "Feiertag",
                "einhergehende Alltag",
                "verwirklichen",
                "Stress verbunden",
                "Burnout führen",
                "deines",
                "Person",
                "Herzens Bald",
                "arbeiten",
                "1 Mai",
                "Träume",
                "Glück",
                "Dauer"
            ],
            "chosen_topics": [
                "Shiatsu-Sitzung",
                "Shiatsu Sitzung",
                "Shiatsu"
            ]
        },
        "timestamps": [
            {
                "date1": "2023-05-01",
                "clock1": null,
                "date2": null,
                "clock2": null
            }
        ]
    },
    {
        "message": "Liebe Frauen,\nkommenden Mittwoch halten Sophia und ich noch einmal Raum für einen Einführungsabend zum Rage Club, der am 01. Mai startet. \n\nFühle Dich herzlich willkommen, im Team mit anderen Frauen, die Kraft Deiner bewussten Wut zu entdecken.\n\nLove&Rage,\nEva",
        "topic_suggestions": {
            "spacy_NER": [
                "Rage Club",
                "Fühle Dich herzlich willkommen",
                "Love Rage",
                "Eva"
            ],
            "rake_keywords": [
                "entdecken Love Rage",
                "Rage Club",
                "herzlich willkommen",
                "bewussten Wut",
                "Liebe Frauen",
                "Frauen",
                "Team",
                "Raum",
                "Kraft",
                "Eva",
                "Einführungsabend"
            ],
            "tf_IDF": [
                "Frauen,",
                "Love",
                "Rage,",
                "Einführungsabend",
                "bewussten",
                "Fühle",
                "Eva",
                "Club,",
                "Sophia"
            ],
            "LDA": [],
            "NMF": [
                "Love",
                "Sophia"
            ],
            "common_topics": [
                "Sophia",
                "Einführungsabend",
                "Rage Club",
                "Frauen,",
                "Club,",
                "Love Rage",
                "Eva",
                "Rage,",
                "bewussten Wut",
                "Liebe Frauen",
                "herzlich willkommen",
                "Raum",
                "Fühle",
                "Team",
                "Kraft"
            ],
            "chosen_topics": [
                "Einführungsabend zum Rage Club",
                "Rage Club",
                "Einführungsabend",
                "Love Rage"
            ]
        },
        "timestamps": [
            {
                "date1": "2023-05-01",
                "clock1": null,
                "date2": null,
                "clock2": null
            }
        ]
    },
    {
        "message": "Liebe Community, \n\nihr seid herzlich eingeladen zu meinen online Worktalks im Mai!\n\n3. Mai: Wo ist dein Zentrum? \nVon Anpassung zu Authentizität und eigener Autorität.\nWeitere Infos hier.\n\n11. Mai: Gefühle und Emotionen \nWie du Verantwortung für deine Trigger übernimmst und Drama vermeidest.\nWeitere Infos hier.\n\n15. Mai: die Box erweitern.\nWie du scheinbar Unmögliches möglich machst.\nWeitere Infos hier.\n\nJeweils 18:30 bis 20 Uhr, Beitrag 10-20€, Anmeldung an oliverarnold@posteo.de\n\nDu findest du Veranstaltungen auch auf meiner Webseite.",
        "topic_suggestions": {
            "spacy_NER": [
                "Liebe Community"
            ],
            "rake_keywords": [
                "Mai 3 Mai",
                "15 Mai",
                "11 Mai",
                "Trigger übernimmst",
                "online Worktalks",
                "oliverarnold posteo",
                "Liebe Community",
                "Jeweils 18",
                "Box erweitern",
                "Beitrag 10",
                "20 Uhr",
                "Zentrum",
                "Verantwortung",
                "Gefühle",
                "findest",
                "Emotionen",
                "Authentizität",
                "Anpassung",
                "Anmeldung"
            ],
            "tf_IDF": [
                "Mai:",
                "Infos",
                "Community,",
                "vermeidest"
            ],
            "LDA": [
                "Mai:"
            ],
            "NMF": [],
            "common_topics": [
                "Liebe Community",
                "Mai:",
                "Community,",
                "online Worktalks",
                "Anpassung",
                "Authentizität",
                "Trigger übernimmst",
                "Emotionen",
                "Box erweitern",
                "Zentrum",
                "vermeidest",
                "oliverarnold posteo",
                "Verantwortung",
                "Infos",
                "11 Mai",
                "Gefühle",
                "15 Mai",
                "Anmeldung",
                "Jeweils 18",
                "20 Uhr",
                "Beitrag 10",
                "findest"
            ],
            "chosen_topics": [
                "online Worktalks"
            ]
        },
        "timestamps": [
            {
                "date1": "2023-05-03",
                "clock1": "18:30",
                "date2": null,
                "clock2": "20:00"
            },
            {
                "date1": "2023-05-11",
                "clock1": "18:30",
                "date2": null,
                "clock2": "20:00"
            },
            {
                "date1": "2023-05-15",
                "clock1": "18:30",
                "date2": null,
                "clock2": "20:00"
            }
        ]
    },
    {
        "message": "Habt ihr Lust auf 🙏Indien an einem Tag 🙏 ? Vom 15.-19.Juni wird in Mitten Deutschlands einer der größten hinduistischen Tempel auf dem europäischen Festland eingeweiht . Energetisch ist das ein Knaller und da dabei zu sein echt was ganz besonderes . Deshalb organisieren wir von Freiburg aus einen Reisebus. Für all die, die reinschnuppern wollen , das Übernachten zu viel oder fahrbarer Untersatz nicht vorhanden . Melde dich für Info und Anmeldung ( muss bis zum 4.Mai den Bus verbindlich buchen ) gerne bei mir .  Om Namo Narayanaya und namaste 🙏🙏🙏",
        "topic_suggestions": {
            "spacy_NER": [
                "Indien",
                "Deutschlands",
                "Freiburg",
                "Melde",
                "europäischen"
            ],
            "rake_keywords": [
                "größten hinduistischen Tempel",
                "Bus verbindlich buchen",
                "vorhanden Melde",
                "Mitten Deutschlands",
                "fahrbarer Untersatz",
                "Übernachten",
                "Reisebus",
                "reinschnuppern",
                "Mai",
                "Lust",
                "Knaller",
                "Juni",
                "Info",
                "Indien",
                "Freiburg",
                "echt",
                "Anmeldung",
                "all"
            ],
            "tf_IDF": [
                "buchen",
                "Reisebus",
                "größten",
                "bus",
                "organisieren",
                "4.Mai",
                "Energetisch",
                "Indien"
            ],
            "LDA": [],
            "NMF": [
                "Indien",
                "Mitten",
                "Deutschlands"
            ],
            "common_topics": [
                "Indien",
                "Reisebus",
                "Freiburg",
                "Energetisch",
                "Knaller",
                "Lust",
                "reinschnuppern",
                "Übernachten",
                "fahrbarer Untersatz",
                "4.Mai",
                "organisieren",
                "Mitten Deutschlands",
                "größten",
                "Mitten",
                "Juni",
                "europäischen",
                "Anmeldung",
                "echt",
                "vorhanden Melde",
                "buchen",
                "Info"
            ],
            "chosen_topics": [
                "Indien an einem Tag",
                "größten hinduistischen Tempel",
                "Indien"
            ]
        },
        "timestamps": [
            {
                "date1": "2023-06-15",
                "clock1": null,
                "date2": "2023-06-19",
                "clock2": null
            },
            {
                "date1": "2023-05-04",
                "clock1": null,
                "date2": null,
                "clock2": null
            }
        ]
    },
    {
        "message": "Die holistische Coaching Ausbildung \n🌈🌱SEEDS of PARADISE 🌱🦋\n\nstartet am 5. Mai live in Freiburg\n\nWie wäre es wenn Du \n🌱 deine Lebenserfahrung,\n🌱 deine Liebe zur Schöpfung\n🌱 deine tiefe Ahnung über eine transpersonale Dimension\n\nunter der Anleitung erfahrener Lehrer,\nin einer Gemeinschaft Gleichgesinnter\nin echten \"live\" Modulen\nzusammenträgst,\nkonzentrierst, klärst und destillierst\n\nund während Du dich selbst begreifst, weiterentwickelst und heilst\nerlangst die Kompetenz einer neuen,\ntop aktuellen Profession!\n\nIn der beginnenden Gruppe sind noch 2 Plätze frei.\nKlicke bitte auf diesen Link um die Details zu erfahren und melde Dich gern für ein freies Kennelerngespräch.\nhttps://www.alhiama.de/coaching-ausbildung-1/\n\nDIE ZEIT IST JETZT.\n\n❤️Alhiama",
        "topic_suggestions": {
            "spacy_NER": [
                "Freiburg",
                "SEEDS of PARADISE"
            ],
            "rake_keywords": [
                "5 Mai live",
                "Anleitung erfahrener Lehrer",
                "transpersonale Dimension",
                "top aktuell",
                "tiefe Ahnung",
                "heilst erlangst",
                "Gemeinschaft Gleichgesinnter",
                "weiterentwickelst",
                "Schöpfung",
                "Liebe",
                "Lebenserfahrung",
                "konzentrierst",
                "Kompetenz",
                "klärst",
                "Freiburg",
                "destillierst",
                "begreifst"
            ],
            "tf_IDF": [
                "live",
                "holistische",
                "zusammenträgst,",
                "klärst",
                "begreifst,",
                "Anleitung"
            ],
            "LDA": [],
            "NMF": [
                "Coaching",
                "heilst",
                "weiterentwickelst"
            ],
            "common_topics": [
                "Freiburg",
                "holistische",
                "Coaching",
                "Lebenserfahrung",
                "Anleitung",
                "Schöpfung",
                "transpersonale Dimension",
                "weiterentwickelst",
                "live",
                "zusammenträgst,",
                "Gemeinschaft Gleichgesinnter",
                "begreifst,",
                "heilst erlangst",
                "tiefe Ahnung",
                "destillierst",
                "Kompetenz",
                "konzentrierst",
                "Liebe",
                "top aktuell",
                "klärst"
            ],
            "chosen_topics": [
                "holistische Coaching Ausbildung",
                "Coaching Ausbildung",
                "holistische",
                "Coaching",
                "Ausbildung"
            ]
        },
        "timestamps": [
            {
                "date1": "2023-05-05",
                "clock1": null,
                "date2": null,
                "clock2": null
            }
        ]
    },
    {
        "message": "mit \nDr.Johannes Latzel\nKlaus Mori\nAlhiama Éber\n\n9 Monate, 7 Module, 7 Tage Retreat\n\no Bewusstseinsentwicklung\no Erwachen\no professionelle Coaching Fähigkeiten\n\nStart: 5 Mai live in Freiburg\n\nDon´t go back to sleep 🌞\n\nhttps://www.alhiama.de/coaching-ausbildung-1/",
        "topic_suggestions": {
            "spacy_NER": [
                "Freiburg"
            ],
            "rake_keywords": [
                "7 Module",
                "5 Mai live",
                "Coaching",
                "Alhiama",
                "ausbildung"
            ],
            "tf_IDF": [
                "Latzel",
                "Fähigkeiten",
                "ber",
                "sleep",
                "Alhiama",
                "Bewusstseinsentwicklung",
                "Mori"
            ],
            "LDA": [],
            "NMF": [
                "Alhiama",
                "Latzel"
            ],
            "common_topics": [
                "Alhiama",
                "Latzel",
                "ber",
                "Mori",
                "7 Module",
                "Bewusstseinsentwicklung",
                "Fähigkeiten",
                "Coaching",
                "sleep",
                "Freiburg",
                "ausbildung"
            ],
            "chosen_topics": [
                "7 Tage Retreat",
                "Coaching Ausbildung",
                "Retreat",
                "Erwachen"
            ]
        },
        "timestamps": [
            {
                "date1": "2023-05-05",
                "clock1": null,
                "date2": null,
                "clock2": null
            }
        ]
    },
    {
        "message": "Der Mai-Vollmond am 5.5. trägt auch den poetischen Namen „Blumenmond.“ Und er ist nicht nur ein Vollmond, sondern gleichzeitig auch eine Halbschatten-Mondfinsternis.\n\nIn den Vollmond-Astrologie-Kreisen heißt es, dass der Mai-Mond etwas intensives und mysteriöses mitbringt und eine Gelegenheit bietet, sich von alten Lasten zu befreien um Raum für Neues zu kreieren. \n\nPassend dazu, wird es genau zu diesem Vollmond eine Kakao-Zeremonie geben, bei der du nicht nur die Möglichkeit hast, den Vollmond zu zelebrieren, sondern auch unterschiedliche Kakao-Sorten zu probieren.\n\nWenn du dabei sein magst, dann melde dich gerne frühzeitig an damit wir wissen, mit wie vielen Menschen wir rechnen können.\n\n5.5. | 20:00 - 23:00\nKakaozeremonie mit Daniel von Mangroovia Foods & Luisa aus Mexico\n\nOrt: Studio Yolaya Freiburg\nAnmeldung: www.yolaya.de\nPreis: 55€",
        "topic_suggestions": {
            "spacy_NER": [
                "Mai-Vollmond",
                "Vollmond-Astrologie-Kreisen",
                "Blumenmond",
                "Mai-Mond"
            ],
            "rake_keywords": [
                "poetischen Namen Blumenmond",
                "Zeremonie geben",
                "Möglichkeit hast",
                "mysteriöses mitbringt",
                "Kreisen heißt",
                "kreieren Passend",
                "Gelegenheit bietet",
                "alten Lasten",
                "5 trägt",
                "Vollmond",
                "Raum",
                "Neues",
                "Mondfinsternis",
                "mond",
                "Mai",
                "Kakao",
                "intensives",
                "Halbschatten",
                "gleichzeitig",
                "genau",
                "befreien",
                "Astrologie"
            ],
            "tf_IDF": [
                "Vollmond",
                "Vollmond-Astrologie-Kreisen",
                "Halbschatten-Mondfinsternis"
            ],
            "LDA": [],
            "NMF": [
                "Kakao"
            ],
            "common_topics": [
                "Vollmond-Astrologie-Kreisen",
                "Mai-Vollmond",
                "Halbschatten-Mondfinsternis",
                "Blumenmond",
                "Mai-Mond",
                "mysteriöses mitbringt",
                "Kakao",
                "Gelegenheit bietet",
                "alten Lasten",
                "kreieren Passend",
                "Zeremonie geben",
                "befreien",
                "Möglichkeit hast",
                "5 trägt",
                "intensives",
                "Kreisen heißt",
                "gleichzeitig",
                "Raum",
                "Neues",
                "genau"
            ],
            "chosen_topics": [
                "Halbschatten-Mondfinsternis",
                "Mai-Vollmond",
                "Vollmond-Astrologie-Kreisen",
                "Blumenmond"
            ]
        },
        "timestamps": [
            {
                "date1": "2023-05-05",
                "clock1": "20:00",
                "date2": null,
                "clock2": "23:00"
            }
        ]
    },
    {
        "message": "NEUES – STILLES - FAMILIENSTELLEN WORKSHOP\nSamstag, 06.05.2023, von 14:00 Uhr bis ca.19:00 Uhr\n\nWas?  \nFamilienaufstellung bringt Ordnung und Verbindung ins Familiensystem, im Neuen Stillen Familienstellen ganz von allein, ohne Intervention und ohne Absicht. Immer wieder magisch, berührend und heilbringend.  Von selbst ergibt sich die Lösung aus dem Feld, ohne, dass jemand etwas tut. Jedes Mal ein kleines Wunder.\nWo? \nYoga- & Seminarraum Freiburg, Rathausgasse 46, 79098 Freiburg\nFür wen? \nEgal, ob Du Familienstellen schon kennst, stilles Familienstellen ist NEU und anders. ALLE sind herzlich willkommen, die interessiert sind an persönlicher Entwicklung und an Erkenntnissen über ihre Verbindung zu Vater und Mutter, etwas, was uns alle betrifft. \nMehr Information und Anmeldung: \nhttps://familienaufstellung-waldkirch.de/aufstellungsseminar-neues-familienstellen/\nTel: 07681/4769931",
        "topic_suggestions": {
            "spacy_NER": [
                "Rathausgasse",
                "Freiburg",
                "NEUES STILLES",
                "FAMILIENSTELLEN",
                "WORKSHOP Samstag"
            ],
            "rake_keywords": [
                "FAMILIENSTELLEN WORKSHOP Samstag",
                "Familienaufstellung bringt Ordnung",
                "Seminarraum Freiburg",
                "Rathausgasse 46",
                "NEUES STILLES",
                "Absicht Immer",
                "00 Uhr",
                "Yoga",
                "Verbindung",
                "tut",
                "Mal",
                "magisch",
                "Lösung",
                "Intervention",
                "heilbringend",
                "Feld",
                "Familiensystem",
                "ergibt",
                "berührend"
            ],
            "tf_IDF": [
                "FAMILIENSTELLEN",
                "Familienaufstellung",
                "Rathausgasse",
                "Yoga-",
                "magisch,",
                "Seminarraum",
                "Wunder"
            ],
            "LDA": [],
            "NMF": [
                "FAMILIENSTELLEN"
            ],
            "common_topics": [
                "FAMILIENSTELLEN",
                "NEUES STILLES",
                "Familienaufstellung",
                "WORKSHOP Samstag",
                "00 Uhr",
                "magisch,",
                "Rathausgasse 46",
                "Familiensystem",
                "Absicht Immer",
                "Intervention",
                "Yoga-",
                "heilbringend",
                "Seminarraum Freiburg",
                "berührend",
                "ergibt",
                "Verbindung",
                "Feld",
                "Wunder",
                "Lösung",
                "tut",
                "Mal"
            ],
            "chosen_topics": [
                "FAMILIENSTELLEN WORKSHOP Samstag",
                "FAMILIENSTELLEN WORKSHOP",
                "Familienaufstellung",
                "FAMILIENSTELLEN"
            ]
        },
        "timestamps": [
            {
                "date1": "2023-05-06",
                "clock1": "14:00",
                "date2": null,
                "clock2": "19:00"
            }
        ]
    },
    {
        "message": "🤰🏽🎶Der erste Gruppenkurs für pälränatalen Gesangs wird auf den 06.05.23 von 10 bis 12 Uhr verschoben!🎶👶🏼\n\nwww.thebodymelody.com \n\nMöchtest du... \n🎈Ein tieferes Verständnis der Verbindung zwischen Atem, Stimme und Körper durch Selbsterfahrung erlangen?\n\n🎈Stimm- und Atemtechniken kennenlernen, die  Dir helfen zu entspannen und Dich mit Dir und Deinem Kind zu verbinden?\n\n🎈Lieder der Welt, Wiegenlieder, Lieder über die Schwangerschaft und das Elternwerden, für Dich und Dein Baby singen? \n\n🎈Unterstützende Tools für die Zeit vor, während und nach der Geburt an die Hand bekommen?\n\n🎈Teil eines wohlwollenden Kreis werdender Mütter werden?\n\nDann melde dich jetzt an! \n\n💫Der Kurs ist auf Spendenasis und findet im Hamsastudio in der Freiburger Innenstadt statt.📍\nMehr Infos in den Vorheringen Posts, auf der Webseite (Bio) oder per Nachricht 📲\n\nFragen / Anmeldung: \nSchreibe mir oder rufe mich an!\n☎️ 0172 7355876 \n\nIch freue mich auf dich! 😊",
        "topic_suggestions": {
            "spacy_NER": [
                "Möchtest du.."
            ],
            "rake_keywords": [
                "Selbsterfahrung erlangen Stimm",
                "Baby singen Unterstüt",
                "tieferes Verständnis",
                "pälränatalen Gesangs",
                "com Möchtest",
                "Atemtechniken kennenlernen",
                "verbinden Lieder",
                "Lieder",
                "Wiegenlieder",
                "Welt",
                "Verbindung",
                "thebodymelody",
                "Stimme",
                "Schwangerschaft",
                "Körper",
                "Kind",
                "helfen",
                "entspannen",
                "Elternwerden",
                "Atem"
            ],
            "tf_IDF": [
                "Lieder",
                "Atem,",
                "verschoben",
                "Baby",
                "kennenlernen,",
                "Kind",
                "pälränatalen",
                "Selbsterfahrung"
            ],
            "LDA": [],
            "NMF": [
                "Gesangs",
                "Baby"
            ],
            "common_topics": [
                "pälränatalen Gesangs",
                "verschoben",
                "verbinden Lieder",
                "Atem,",
                "Möchtest du..",
                "com Möchtest",
                "tieferes Verständnis",
                "thebodymelody",
                "Selbsterfahrung",
                "kennenlernen,",
                "Baby",
                "Atemtechniken kennenlernen",
                "entspannen",
                "Wiegenlieder",
                "Schwangerschaft",
                "Elternwerden",
                "Verbindung",
                "Stimme",
                "Körper",
                "helfen",
                "Welt",
                "Kind"
            ],
            "chosen_topics": [
                "Gruppenkurs für pälränatalen Gesangs",
                "pälränatalen Gesangs",
                "Wiegenlieder"
            ]
        },
        "timestamps": [
            {
                "date1": "2023-05-06",
                "clock1": "10:00",
                "date2": null,
                "clock2": "12:00"
            }
        ]
    },
    {
        "message": "Angeleitete Übungen und klare Regeln werden dir helfen mit dir und der Gruppe gut anzukommen um anschließend aus deinem sicheren Hafen Ausflüge des Entdeckens zu wagen. In einem Feld von Konsens und Wertschätzung. \n\nIm Free-Flow Teil gibt es zwei Floors in denen du verschiedene Inseln findest. Je nachdem, was gerade dein Bedürfnis oder deine Freude ist. Grundsätzlich darf beim Free-Flow alles passieren, was im Konsens geschieht. Die verschiedenen Inseln bieten nochmals extra Orientierung und einen klaren Rahmen...\n\n\n*Tielnahmevoraussetzung\nDu hast bereits an einem Starter Workshop teilgenommen (der nächste ist am 6.5.) oder bringst ausreichend Vorerfahrung mit. In letzterem Fall wende dich bitte an Jan Thiemo um ein Vorgespräch zu führen.\n\nKosten nach Selbsteinschätzung\n45-50 Euro regulär\n35-40  Euro ermäßigt\n55-60 Euro Support\nSollte dir auch der ermäßigte Betrag momentan nicht möglich sein, traue dich mich zu kontaktieren und wir versuchen eine stimmige Lösung zu finden.\n\nDatum\nSa. 20.5.23\nAnkommen 18:00 - 18:15 | Start 18.30 (Türe Schließt) Ende ca. 23:00 Uhr\n\nAnmeldung und weitere Infos: raumfuer.com",
        "topic_suggestions": {
            "spacy_NER": [
                "Free-Flow Teil"
            ],
            "rake_keywords": [
                "sicheren Hafen Ausflüge",
                "Gruppe gut anzukommen",
                "Flow Teil gibt",
                "klare Regeln",
                "Angeleitete Übungen",
                "Konsens geschieht",
                "Free",
                "Flow",
                "Konsens",
                "Wertschätzung",
                "wagen",
                "passieren",
                "helfen",
                "Freude",
                "Feld",
                "Entdeckens",
                "Bedürfnis",
                "anschließend"
            ],
            "tf_IDF": [
                "Konsens",
                "Free-Flow",
                "Inseln",
                "wagen",
                "nochmals",
                "Regeln",
                "extra",
                "geschieht"
            ],
            "LDA": [],
            "NMF": [
                "Konsens",
                "Inseln"
            ],
            "common_topics": [
                "Konsens geschieht",
                "Angeleitete Übungen",
                "Free-Flow Teil",
                "Wertschätzung",
                "Inseln",
                "geschieht",
                "Bedürfnis",
                "klare Regeln",
                "Feld",
                "helfen",
                "Freude",
                "extra",
                "anschließend",
                "wagen",
                "Entdeckens",
                "nochmals",
                "passieren"
            ],
            "chosen_topics": []
        },
        "timestamps": [
            {
                "date1": "2023-05-06",
                "clock1": "18:00",
                "date2": null,
                "clock2": "23:00"
            },
            {
                "date1": "2023-05-20",
                "clock1": "18:00",
                "date2": null,
                "clock2": "23:00"
            }
        ]
    },
    {
        "message": "Sag JA zu Dir, 5. und 6. Mai in Freiamt (Nähe Freiburg), 45 €",
        "topic_suggestions": {
            "spacy_NER": [
                "Freiamt",
                "Freiburg",
                "Sag JA zu Dir"
            ],
            "rake_keywords": [
                "Freiamt Nähe Freiburg",
                "Sag JA",
                "6 Mai"
            ],
            "tf_IDF": [
                "Nähe",
                "Freiamt",
                "Sag",
                "Mai"
            ],
            "LDA": [],
            "NMF": [
                "Freiamt",
                "Nähe"
            ],
            "common_topics": [
                "Freiamt",
                "Freiburg",
                "Sag JA",
                "6 Mai",
                "Nähe"
            ],
            "chosen_topics": [
                "Sag JA zu Dir",
                "JA zu Dir"
            ]
        },
        "timestamps": [
            {
                "date1": "2023-05-06",
                "clock1": null,
                "date2": null,
                "clock2": null
            }
        ]
    },
    {
        "message": "Seid herzlich eingeladen zur MeteoritenGongNacht in Freiburg am 6.5. Eine kosmische Nacht. \nEine Reise in die Essenz. \nAheya.\nhttps://de.paulinefabry.de/upcoming",
        "topic_suggestions": {
            "spacy_NER": [
                "Freiburg",
                "MeteoritenGongNacht"
            ],
            "rake_keywords": [
                "kosmische Nacht",
                "upcoming",
                "Reise",
                "paulinefabry",
                "MeteoritenGongNacht",
                "Freiburg"
            ],
            "tf_IDF": [
                "Essenz",
                "Aheya",
                "MeteoritenGongNacht",
                "kosmische",
                "Reise",
                "eingeladen",
                "Nacht"
            ],
            "LDA": [],
            "NMF": [
                "Aheya",
                "kosmische",
                "MeteoritenGongNacht",
                "Essenz",
                "paulinefabry"
            ],
            "common_topics": [
                "MeteoritenGongNacht",
                "Freiburg",
                "kosmische Nacht",
                "Essenz",
                "eingeladen",
                "Aheya",
                "paulinefabry",
                "upcoming",
                "Reise"
            ],
            "chosen_topics": [
                "MeteoritenGongNacht",
                "kosmische Nacht"
            ]
        },
        "timestamps": [
            {
                "date1": "2023-05-06",
                "clock1": null,
                "date2": null,
                "clock2": null
            }
        ]
    },
    {
        "message": "Atme dich frei – Einladung zum Atemtag\n \nDer Atem ist ein Schlüssel, der uns jederzeit zur Verfügung steht, immer und überall! Er ist weit mehr als nur die Versorgung mit Sauerstoff – er ist unsere Verbindung zu unserer Lebendigkeit. Atem ist Lebensenergie, je intensiver wir atmen, umso mehr Energie steht uns zur Verfügung.\nÜber den Atem bekommen wir Zugang zu unseren Gefühlen und können uns so auf einer tieferen Ebene wahrnehmen, erforschen und akzeptieren. Der Atem unterstützt uns dabei, Zugang zu unserem Inneren zu bekommen.\n\nIm geschützten Rahmen einer kleinen Gruppe kannst du\n> ganz bei dir ankommen\n> Stress abbauen\n> anstehende Themen klären\n> einen tieferen Zugang zu dir bekommen\n> deine Selbstheilungskräfte aktivieren\n> dich feiern und genießen\nHast du Lust, dich verbunden und frei zu fühlen?\nIch freue mich auf dich!\nOrt: 79114 Freiburg-Weingarten\nKosten: 70 €\nTermin und Zeiten: 6. Mai, 10:00 bis 17:00 Uhr\n \nWeitere Infos und Anmeldung:\nhttps://www.tipping-methode.de/termine/?id=5432\noder telefonisch 0761 477 41920\n\nHerzliche Grüße\nHina \n \n \nHina Fruh\nHeilpraktikerin für Psychotherapie\nGilgenmatten 4b, 79114 Freiburg\nTel:  0761 . 477 419 20 | +49 761 477 419 20\neMail: info@hinafruh.de\n \nBesuche  meine Website:\nwww.hinafruh.de\n \n ",
        "topic_suggestions": {
            "spacy_NER": [
                "Zugan",
                "Atemtag"
            ],
            "rake_keywords": [
                "tieferen Ebene wahrnehmen",
                "Verfügung steht",
                "frei Einladung",
                "Atem unterstützt",
                "Atem bekommen",
                "Atem",
                "Verfügung",
                "überall",
                "Zugang",
                "Zugan",
                "Versorgung",
                "Verbindung",
                "Schlüssel",
                "Sauerstoff",
                "Lebensenergie",
                "jederzeit",
                "Gefühlen",
                "erforschen",
                "atmen",
                "Atme",
                "Atemtag",
                "akzeptieren"
            ],
            "tf_IDF": [
                "Atem",
                "Verfügung",
                "Atemtag",
                "Lebendigkeit"
            ],
            "LDA": [],
            "NMF": [
                "Verfügung"
            ],
            "common_topics": [
                "Atemtag",
                "frei Einladung",
                "Atme",
                "Schlüssel",
                "Zugang",
                "Lebendigkeit",
                "Versorgung",
                "Sauerstoff",
                "Lebensenergie",
                "Atem bekommen",
                "atmen",
                "überall",
                "jederzeit",
                "Verfügung steht",
                "Atem unterstützt",
                "erforschen",
                "akzeptieren",
                "Verbindung",
                "Gefühlen"
            ],
            "chosen_topics": [
                "Einladung zum Atemtag",
                "Atemtag",
                "Atem"
            ]
        },
        "timestamps": [
            {
                "date1": "2023-05-06",
                "clock1": "10:00",
                "date2": null,
                "clock2": "17:00"
            }
        ]
    },
    {
        "message": "🌸 Yoga Intensiv Workshop mit Pınar am 7.5.23 🌸\n\nOrt: Kailash Haus\nUhrzeit: 9-12 Uhr\nKosten: 40,- Euro, für Kursteilnehmer 35,- Euro\n\nIntensives Üben von Pranayama, Asana und Kontemplation. Im Vergleich zum 90-minütigen Kurs mehr Zeit für z.B. geführte Meditation, ausgiebiges Yoga Nidra (dynamischer Schlaf), Neurogenes Zittern, Chakrameditation, Ehrliches Mitteilen.\n\nIdeal geeignet für Menschen mit wenig Zeit unter der Woche und zum generellen Einstieg in die Yoga Praxis. \n\nNeue wöchentliche Kurse Dienstag/ Donnerstag 19.30-21Uhr in der Grünwälderstr 17. Hatha Yoga für Alle. Jederzeit Schnuppern möglich 🌸\n\nTraditioneller Hatha Yoga, 15 Jahre Unterrichtserfahrung, 6-jährige Ausbildung mit stetiger Fortbildung und eigener Praxis.\n\nAnmeldung: @Seestern23/\npinar@yoga-und-entfaltung.de, 0151-70587878\n\nwww.yoga-und-entfaltung.de",
        "topic_suggestions": {
            "spacy_NER": [
                "Kailash Haus",
                "Chakrameditation",
                "Ehrliches Mitteilen"
            ],
            "rake_keywords": [
                "Yoga Intensiv Workshop",
                "Kailash Haus Uhrzeit",
                "B geführte Meditation",
                "12 Uhr Kosten",
                "P nar",
                "Neurogenes Zittern",
                "generellen Einstieg",
                "23 Ort",
                "Woche",
                "Vergleich",
                "Pranayama",
                "Menschen",
                "Kontemplation",
                "Chakrameditation",
                "Asana"
            ],
            "tf_IDF": [
                "Yoga",
                "Kurs",
                "wöchentliche",
                "Chakrameditation,",
                "40,-"
            ],
            "LDA": [],
            "NMF": [],
            "common_topics": [
                "Yoga",
                "40,-",
                "P nar",
                "Kailash Haus",
                "Chakrameditation,",
                "Pranayama",
                "Kontemplation",
                "Asana",
                "Kurs",
                "23 Ort",
                "Neurogenes Zittern",
                "Ehrliches Mitteilen",
                "wöchentliche",
                "generellen Einstieg",
                "Vergleich",
                "Menschen",
                "Woche"
            ],
            "chosen_topics": [
                "Yoga Intensiv Workshop",
                "Chakrameditation,",
                "Pranayama",
                "Kontemplation",
                "Yoga"
            ]
        },
        "timestamps": [
            {
                "date1": "2023-05-07",
                "clock1": "09:00",
                "date2": null,
                "clock2": "12:00"
            }
        ]
    },
    {
        "message": "Liebe Frau! 🌹\n\n🌹Du wünschst dir einen innigen, liebevollen Kontakt zu deinem Körper? \n🌹 Du bist neugierig darauf zu erfahren, was dadurch alles für dich möglich werden kann? \n\nWir laden dich herzlich ein, ab Di, 9. Mai in unseren KörperRaum zu kommen!\n\n🌹 An sechs Abenden kannst du im geschützten Rahmen nur unter Frauen deine Beziehung zu deinem Körper neu entdecken, vertiefen und intensivieren. 🌹\n\nWeitere Infos findest du im Flyer. \n\nWir freuen uns auf dich! 🌹\nHerzlichst, Deborah und Nicola",
        "topic_suggestions": {
            "spacy_NER": [
                "Liebe Frau"
            ],
            "rake_keywords": [
                "Körper neu entdecken",
                "neugierig darauf",
                "liebevollen Kontakt",
                "Liebe Frau",
                "geschützten Rahmen",
                "9 Mai",
                "Körper",
                "wünschst",
                "vertiefen",
                "Nicola",
                "laden",
                "KörperRaum",
                "innigen",
                "Herzlichst",
                "herzlich",
                "freuen",
                "Frauen",
                "Flyer",
                "erfahren",
                "Deborah",
                "Beziehung"
            ],
            "tf_IDF": [
                "Körper",
                "Nicola",
                "neugierig",
                "Abenden",
                "KörperRaum",
                "entdecken,"
            ],
            "LDA": [],
            "NMF": [],
            "common_topics": [
                "KörperRaum",
                "neugierig darauf",
                "liebevollen Kontakt",
                "innigen",
                "entdecken,",
                "Nicola",
                "Liebe Frau",
                "vertiefen",
                "Flyer",
                "wünschst",
                "Deborah",
                "Beziehung",
                "Abenden",
                "erfahren",
                "laden",
                "9 Mai",
                "herzlich",
                "geschützten Rahmen",
                "Frauen",
                "freuen",
                "Herzlichst"
            ],
            "chosen_topics": [
                "KörperRaum",
                "innigen, liebevollen Kontakt",
                "liebevollen Kontakt"
            ]
        },
        "timestamps": [
            {
                "date1": "2023-05-09",
                "clock1": null,
                "date2": null,
                "clock2": null
            }
        ]
    },
    {
        "message": "Workshop: „ Wirbelsäule in Symmetrie: befree - befreie dich von Schmerzen“ in Freiburg i.Br.\n\n\nDie Wirbelsäule ist unser Rückgrat im Leben. Oft jedoch geht die natürliche Aufrichtung im Alltag verloren und Schiefstellungen und Blockaden in der Wirbelsäule entstehen.\n\nHierdurch können Nervenbahnen gequetscht werden, was die Beweglichkeit beeinträchtigt und gesundheitliche Auswirkungen haben kann. Schmerzen, Taubheitsgefühle und sogar organische Erkrankungen können die Folge sein.\n\nIn diesem Workshop lernst du die korrekte Ausführung der 11 befree-Schwingungen kennen. Danach bist du in der Lage deine Wirbelsäule selbständig in die natürliche Symmetrie zu bringen und dadurch Blockaden und Schmerzen zu lösen.\n\nDatum: Samstag, 13. Mai 2023\nUhrzeit: 13:30-16:30Uhr\nOrt: Freiburg, (wird bei Anmeldung bekannt gegeben)\n\nKursgebühr: 60€-85€ je nach Selbsteinschätzung\n\nRückfragen/ Anmeldung: \nStephanie\nYoga-und befree-Trainerin\nMobil: 0176-84 66 5209 \nE-Mail: befree-freiburg@gmx.de\nwww.yogahaus-freiburg.de",
        "topic_suggestions": {
            "spacy_NER": [
                "Freiburg i."
            ],
            "rake_keywords": [
                "sogar organische Erkrankungen",
                "Wirbelsäule entstehen Hierdurch",
                "Nervenbahnen gequetscht",
                "natürliche Aufrichtung",
                "gesundheitliche Auswirkungen",
                "Freiburg i",
                "Beweglichkeit beeinträchtigt",
                "Alltag verloren",
                "Wirbelsäule",
                "Workshop",
                "Works",
                "Taubheitsgefühle",
                "Symmetrie",
                "Schmerzen",
                "Schiefstellungen",
                "Rückgrat",
                "Folge",
                "Blockaden",
                "befreie",
                "befree"
            ],
            "tf_IDF": [
                "Wirbelsäule",
                "Schmerzen,",
                "Taubheitsgefühle",
                "Workshop:",
                "Schmerzen",
                "Blockaden",
                "Beweglichkeit"
            ],
            "LDA": [],
            "NMF": [
                "Wirbelsäule",
                "Rückgrat"
            ],
            "common_topics": [
                "Wirbelsäule",
                "Rückgrat",
                "Blockaden",
                "Workshop:",
                "Schmerzen,",
                "Freiburg i.",
                "Symmetrie",
                "befree",
                "befreie",
                "natürliche Aufrichtung",
                "Taubheitsgefühle",
                "Nervenbahnen gequetscht",
                "Beweglichkeit beeinträchtigt",
                "Schiefstellungen",
                "gesundheitliche Auswirkungen",
                "Alltag verloren",
                "Folge"
            ],
            "chosen_topics": [
                "Wirbelsäule in Symmetrie",
                "Wirbelsäule",
                "natürliche Symmetrie",
                "Workshop"
            ]
        },
        "timestamps": [
            {
                "date1": "2023-05-13",
                "clock1": "13:30",
                "date2": null,
                "clock2": "16:30"
            }
        ]
    },
    {
        "message": "Kakao- Verkostung und Trancereise\n\nAm 14.5.2023 um 18 Uhr\n\nLerne deine eigenen Facetten und Tiefen mit der Kraft des Kakaos und einer geführten Trancereise kennen.\n\nAn diesem Abend möchten wir euch verschiedene Kakaosorten aus Mexiko vorstellen, die Daniel von Mangroovia Foods für uns mitgebracht hat. Dabei dürfen wir riechen, schmecken, und fühlen wie der Kakao in uns aufgeht. Mit einer ganz individuellen Tasse Kakao, die du dir selbst aus den mitgebrachten Sorten frei gestalten darfst, gehen wir dann mit Swetlana in die angeleitete Körperreise und kommen mit uns selbst in tiefen Kontakt. Mit dem Kakao und der Trancereise können wir  ganz neue Pforten der Wahrnehmung in uns öffnen. Lass uns gemeinsam in die Tiefen unseres Selbst eintauchen.\n\nWenn du kommen möchtest, melde dich bitte per Mail unter folgende Adresse:\n\ndaniel@mangroovia.com\n\nWir freuen uns auf euch!\n\nLiebe Grüße,\n\nSwetlana & Daniel\n\nWo? Seminarraum Loretto, \n\nBaslerstr. 42\n\n79100 Freiburg\n\nWie viel: 25 €\n\nEarly Bird (Anmeldung bis 1.5.): 20€",
        "topic_suggestions": {
            "spacy_NER": [
                "Mexiko",
                "Mangroovia Foods",
                "Trancereise"
            ],
            "rake_keywords": [
                "18 Uhr Lerne",
                "geführten Trancereise kennen",
                "verschiedene Kakaosorten",
                "Mexiko vorstellen",
                "Mangroovia Foods",
                "Abend möchten",
                "Trancereise",
                "Kakao",
                "Verkostung",
                "Tiefen",
                "schmecken",
                "riechen",
                "mitgebracht",
                "Kraft",
                "Kakaos",
                "fühlen",
                "Daniel",
                "aufgeht"
            ],
            "tf_IDF": [
                "Trancereise",
                "Daniel",
                "riechen,",
                "geführten",
                "fühlen",
                "individuellen",
                "Verkostung"
            ],
            "LDA": [],
            "NMF": [
                "Trancereise"
            ],
            "common_topics": [
                "Trancereise",
                "Verkostung",
                "Daniel",
                "Mangroovia Foods",
                "verschiedene Kakaosorten",
                "Mexiko vorstellen",
                "riechen,",
                "mitgebracht",
                "schmecken",
                "aufgeht",
                "geführten",
                "Tiefen",
                "Kraft",
                "Abend möchten",
                "individuellen",
                "fühlen"
            ],
            "chosen_topics": [
                "Kakao- Verkostung und Trancereise",
                "Kakao- Verkostung",
                "Trancereise"
            ]
        },
        "timestamps": [
            {
                "date1": "2023-05-14",
                "clock1": "18:00",
                "date2": null,
                "clock2": "18:00"
            }
        ]
    },
    {
        "message": "Ecstatic Dance Tanzretreat 18.-21. Mai\n\nDas nächste Ecstatic Dance Wochenende nimmt gerade schon Gestalt an.\n\nEs wird eher ein Tanzretreat. Bestimmte Strukturen vom Festival bleiben.\n\nMorgens wird es Yoga und Singkreise geben. Vormittags ist das Angebot an die gesamte Gruppe, tief in den Tanz einzutauchen, mit Impulsen und der Einladung, Tanz als transformative heilsame Kraft zu nutzen.\n\nTagsüber gibt es Workshops zu verschiedenen Formen von Ausdrucks- und Improvisationstanz, sowie Bodywork.\n\nJeden Abend wird es natürlich eine ausgedehnte Ecstatic Dance Session von verschiedenen Dj*anes geben. \n\nDj Tato Eos (Berlin)\nDjane Aniketa\nDj Sub-Till \nYoga mit Timo Kassel\nTanzkörperreise mit Katharina Taig \nNaturtanz und Erforschen von Butoh mit Miriam Seifert und Miriam Schmitt \nMeditation mit Moritz Kling\nuvm... \n\nVon Donnerstag 18. bis Sonntag 21. Mai (Himmelfahrtwochenende)\n\nDadurch, dass wir 4 Tage haben, wird es auch eine Auszeit vom Alltag. Viel Zeit zum einfachen Sein in Gemeinschaft und einfach Ruhe und Natur.\n\nUnseren Körper feiern und ihm was Gutes tun, steht im Mittelpunkt.\n\nWenn das Frühlingswetter es zulässt, werden wir auch mal draußen tanzen. An einem Nachmittag wollen wir uns tanzend mit der Natur/ dem Wald verbinden und dabei Elemente von Butoh erforschen. Begleitet mit Livemusik von Miriam.\n\nPreis für das Festival 180 Euro\n\nEssen Vollverpflegung für alle Tage 80 Euro (etwas mehr weil der Einkaufspreis von der Gemeinschaft höher ist)\n\nÜbernachtung 12-13 Zelt/ Bus/Matratzenlager 15 pro Nacht.\n\nKleinere Zimmer kosten natürlich etwas mehr.\n\nEinzelzimmer: 40\nDoppelzimmer 30\nMehrbettzimmer 22\n\nOrt:\nGemeinschaft Sonnenwald & Akademie für angewandtes gutes Leben\nBuchenweg 10\n72297 Seewald\n\nWir haben eine große schöne Halle mit hohen Decken und vielen Fenstern zum Tanzen. \nFotos davon kann auch auf der Website sehen: \nEcstaticdancefreiburg.de\n\nVersorgt werden wir wieder mit bestem liebevoll zubereitetem Bioessen, teilweise aus dem eigenen Anbau der Lebensgemeinschaft Sonnenwald in Schernbach.\n\nTeilnehmerzahl max. 80 Personen.\nAnders als beim Festival wird die Gruppe etwas kleiner und familiärer bleiben.\n\nDeshalb wartet nicht zu lange, wenn ihr dabei sein wollt.\n\nSo weit mal unsere Überlegungen zu dem Retreat.\nDetails folgen...\n\nWenn es dich anspricht, kannst du dich gerne schon dafür anmelden.\n\nEcstaticdancefreiburg@posteo.de\n\nAlles Liebe\n\nTill & Miriam & das Ecstatic Dance Team",
        "topic_suggestions": {
            "spacy_NER": [],
            "rake_keywords": [
                "Tanzretreat Bestimmte Strukturen",
                "transformative heilsame Kraft",
                "Singkreise geben Vormittags",
                "nutzen Tagsüber gibt",
                "Festival bleiben Morgens",
                "verschiedenen Formen",
                "gesamte Gruppe",
                "Tanz einzutauchen",
                "Tanz",
                "Yoga",
                "Workshops",
                "tief",
                "Impulsen",
                "Improvisationstanz",
                "Einladung",
                "eher",
                "Ausdrucks",
                "Angebot"
            ],
            "tf_IDF": [
                "Tanzretreat",
                "Ecstatic",
                "Dance",
                "Tanz",
                "bleiben",
                "Bestimmte",
                "Improvisationstanz,",
                "eher"
            ],
            "LDA": [],
            "NMF": [
                "Tanzretreat"
            ],
            "common_topics": [
                "Tanzretreat",
                "Ecstatic",
                "Dance",
                "Yoga",
                "Tanz einzutauchen",
                "Impulsen",
                "Einladung",
                "Improvisationstanz,",
                "Workshops",
                "Bestimmte",
                "Angebot",
                "bleiben",
                "eher",
                "gesamte Gruppe",
                "Ausdrucks",
                "tief",
                "verschiedenen Formen"
            ],
            "chosen_topics": [
                "Ecstatic Dance Tanzretreat",
                "Ecstatic Dance Wochenende",
                "Tanzretreat",
                "Improvisationstanz",
                "Ecstatic",
                "Dance",
                "Improvisationstanz,"
            ]
        },
        "timestamps": [
            {
                "date1": "2023-05-18",
                "clock1": null,
                "date2": "2023-05-21",
                "clock2": null
            }
        ]
    },
    {
        "message": "Hallo zusammen,\nam Resilienz-Workshop für sozial-ökologisch aktive Menschen vom 18.-21. Mai mit mir sind noch Plätze frei. Der Workshop findet zwar nicht in Freiburg, sondern bei Kassel in der Gemeinschaft mit Seminarhaus Lebensbogen statt, aber mit einer Freiburger Kursleiterin zur weiteren Vernetzung :-)\nFolgende Leitfragen dienen uns im Workshop als Orientierung:\n\nWie kann es gelingen, sich selbst und andere in regeneratives Engagement zu begleiten, anstatt langsam auszubrennen?\n\nWas kann dauerhaft Kraft spenden und was blockiert Engagement?\n\nWie können wir unser inneres Gleichgewicht für sinnvolles Engagement kultivieren und unsere Resilienz stärken?\n\nWas ist unsere individuelle Möglichkeit, unser Potenzial für die Gemeinschaft?\n\nAn welchen Stellen ist es sinnvoll, aktiv zu werden und wann auch gerade nicht? Aus welcher Motivation heraus handeln Menschen dabei? Sind wir dabei verbunden mit unserem ganzen Sein?\n\nWie können wir sichere Räume gestalten, in denen Menschen ihre Gefühle im Angesicht der Klimakrise und dem Zustand unserer Welt wahrnehmen und ausdrücken können?\n\nWeitere Infos hier:\nhttps://www.permakultur.de/veranstaltung/resilienz-workshop-fuer-permakultur-aktivistinnen-und-sozial-oekologisch-engagierte-menschen\nViele Grüße\nSarah",
        "topic_suggestions": {
            "spacy_NER": [
                "Freiburg",
                "Kassel",
                "Resilienz-Workshop",
                "Freiburger"
            ],
            "rake_keywords": [
                "ökologisch aktive Menschen",
                "Seminarhaus Lebensbogen statt",
                "anstatt langsam auszubrennen",
                "regeneratives Engagement",
                "Plätze frei",
                "Hallo zusammen",
                "Freiburger Kursleiterin",
                "Workshop findet",
                "Workshop",
                "sozial",
                "Resilienz",
                "Orientierung",
                "Kassel",
                "Gemeinschaft",
                "gelingen",
                "Freiburg",
                "dau",
                "begleiten"
            ],
            "tf_IDF": [
                "Workshop",
                "Kassel",
                "Resilienz-Workshop",
                "dienen",
                "regeneratives",
                "Leitfragen",
                "sozial-ökologisch",
                "Kursleiterin"
            ],
            "LDA": [],
            "NMF": [
                "Vernetzung",
                "gelingen",
                "Resilienz"
            ],
            "common_topics": [
                "Kassel",
                "Resilienz-Workshop",
                "Freiburger Kursleiterin",
                "sozial-ökologisch",
                "Workshop findet",
                "Kursleiterin",
                "Vernetzung",
                "Gemeinschaft",
                "Leitfragen",
                "regeneratives Engagement",
                "Orientierung",
                "Hallo zusammen",
                "dau",
                "Plätze frei",
                "gelingen",
                "dienen",
                "begleiten"
            ],
            "chosen_topics": [
                "Resilienz-Workshop",
                "regeneratives Engagement",
                "Resilienz",
                "Workshop"
            ]
        },
        "timestamps": [
            {
                "date1": "2023-05-18",
                "clock1": null,
                "date2": "2023-05-21",
                "clock2": null
            }
        ]
    },
    {
        "message": "... aus der 360° LERNEN BEGLEITER - Fortbildung 2023\n\n⚪️ Gruppen Anleiten Lernen\n\n🟡 Sa/So 20./21. Mai 2023\n🟡 10 Uhr - 18 Uhr\n🟡 … mit Pinar u Alina\n\nWer eine Gruppe von Menschen (an-)leitet, übernimmt eine wichtige, sogar essenzielle Aufgabe. \nMenschen verhalten sich in einem natürlichen Umfeld in Gruppen nach einem ganz bestimmten Ablauf. Wenn du diesen Ablauf kennst, weißt du jederzeit, wo die Gruppe steht und wie du sie zum Ziel bringst. \n\nIn diesem Seminar werden deine natürlich angelegten Führungs-Qualitäten herausgearbeitet und dann für dich bewusst. Du lernst das natürliche Anleiten von Gruppen - mit den notwendigen Haltungen, den Handlungen und den Abfolgen.\n\n🟡 2. WE (von 15 WE) der Fortbildung zum 360° LERNEN Begleiter\n\n⚪️ Gesundheitszentrum in 79215 Elzach\n⚪️ Kosten 250 €\n⚪️ Anmeldung: @mit_Herz_und_Verstand\n\n🔝… Übersicht aller 360° LERNEN Begleiter - Fortbildungs-WE\n\n⚪️ 360° LERNEN                      \n⚪️ www.360°-Lernen.com",
        "topic_suggestions": {
            "spacy_NER": [
                "Pinar u Alina",
                "BEGLEITER"
            ],
            "rake_keywords": [
                "360 LERNEN BEGLEITER",
                "18 Uhr",
                "Ablauf kennst",
                "Ziel bringst",
                "natürlichen Umfeld",
                "Gruppen",
                "Gruppe steht",
                "Menschen",
                "Gruppe",
                "übernimmt",
                "wichtige",
                "weißt",
                "Seminar",
                "leitet",
                "jederzeit"
            ],
            "tf_IDF": [
                "Ablauf",
                "Gruppen",
                "Gruppe",
                "LERNEN",
                "Menschen"
            ],
            "LDA": [],
            "NMF": [
                "Ablauf"
            ],
            "common_topics": [
                "übernimmt",
                "BEGLEITER",
                "natürlichen Umfeld",
                "Ablauf kennst",
                "Gruppen",
                "LERNEN",
                "leitet",
                "18 Uhr",
                "Menschen",
                "jederzeit",
                "wichtige",
                "Seminar",
                "Gruppe steht",
                "weißt",
                "Ziel bringst"
            ],
            "chosen_topics": [
                "360° LERNEN BEGLEITER - Fortbildung",
                "360 LERNEN BEGLEITER",
                "Fortbildung"
            ]
        },
        "timestamps": [
            {
                "date1": "2023-05-20",
                "clock1": "20:23",
                "date2": "2023-05-21",
                "clock2": "10:00"
            },
            {
                "date1": "2023-05-21",
                "clock1": "10:00",
                "date2": null,
                "clock2": null
            }
        ]
    },
    {
        "message": "✨OSTEOTHAI & THAI-YOGA MASSAGE TREATMENTS\n\n✨OSTEOPATHIE ÜBUNGSBEHANDLUNGEN\n\n„Die Behandlung selbst heilt nicht, sie unterbricht die Reizung und erlaubt es dem Körper, sich letztendlich selbst zu heilen. Unterbleibt die Reizung weiter, so gibt dies dem Körper die Möglichkeit, seine Selbstheilungskräfte zu entfalten.“\nLawrence H. Jones\n\nEine Behandlung kann eine Auszeit sein, in der die eigene Körperwahrnehmung gefördert wird:\n\n🌱das Nervensystem hat die Möglichkeit einen Ausgleich zu erleben\n🌱der Atem wird tiefer \n🌱der Körper bekommt in seiner Komplexität Impulse, die ihn auf dem Weg zur Gesundheit unterstützen können\n🌱 Mobilität wird verbessert\n🌱 Spannungen können abgebaut werden\n\n୭̥ Osteothai / Thai-Yoga Massage Treatments  - neue Termine ୭̥\n\n-> 25. Mai und 22. Juni: 09:00 | 10:30 | 12:00\n\n୭̥ Osteopathie Übungsbehandlung im Rahmen meiner Ausbildung ୭̥\n-> Immer Montags 16:15 und 17:30\n\nBuchung: www.yolaya.de/treatments\n\n☽ ☼ ☽ Deine Julia ☽ ☼ ☽",
        "topic_suggestions": {
            "spacy_NER": [
                "OSTEOTHAI",
                "TREATMENTS",
                "ÜBUNGSBEHANDLUNGEN",
                "MASSAGE"
            ],
            "rake_keywords": [
                "Lawrence H Jones",
                "OSTEOTHAI THAI",
                "heilen Unterbleibt",
                "unterbricht",
                "Selbstheilungskräfte",
                "Reizung",
                "Nervensystem",
                "Möglichkeit",
                "letztendlich",
                "Körper",
                "heilt",
                "erleben",
                "erlaubt",
                "entfalten",
                "BEHANDLUNG",
                "Auszeit",
                "Ausgleich"
            ],
            "tf_IDF": [
                "Reizung",
                "BEHANDLUNG",
                "ÜBUNGSBEHANDLUNGEN",
                "TREATMENTS",
                "Selbstheilungskräfte"
            ],
            "LDA": [],
            "NMF": [
                "Reizung"
            ],
            "common_topics": [
                "Reizung",
                "TREATMENTS",
                "ÜBUNGSBEHANDLUNGEN",
                "Selbstheilungskräfte",
                "OSTEOTHAI THAI",
                "MASSAGE",
                "unterbricht",
                "heilt",
                "heilen Unterbleibt",
                "letztendlich",
                "Möglichkeit",
                "entfalten",
                "Auszeit",
                "Nervensystem",
                "Ausgleich",
                "Körper",
                "erlaubt",
                "erleben"
            ],
            "chosen_topics": [
                "OSTEOTHAI & THAI-YOGA MASSAGE TREATMENTS",
                "OSTEOTHAI THAI-YOGA MASSAGE TREATMENTS",
                "THAI-YOGA MASSAGE TREATMENTS",
                "MASSAGE TREATMENTS",
                "OSTEOTHAI",
                "THAI-YOGA",
                "MASSAGE"
            ]
        },
        "timestamps": [
            {
                "date1": "2023-05-25",
                "clock1": "09:00",
                "date2": null,
                "clock2": "10:30"
            },
            {
                "date1": "2023-06-22",
                "clock1": "09:00",
                "date2": null,
                "clock2": "10:30"
            }
        ]
    },
    {
        "message": "Pferde Kinder Pfingstcamp vom 29.5 3.6 2023🐴\n\nGemeinsam erleben wir auf Sonjas schönen Hof bei Elzach 1 Woche in der Natur. \n✨versorgen die Pferde \n✨Unternehmen mit den Pferden Ausflüge in den Wald \n✨erfreuen uns an der Reiter Rallye\n✨üben uns im Bogen schiessen \n✨Spiel und Spass im Wald \n✨abends hören wir gemütlich am Feuer im Tipi Geschichten \n✨wenn es heiss ist .baden im Pool\nUnd all das mehr. Was aus unseren gemeinsamen Ideen entstehen mag \n\nWillkommen sind alle Kinder ab 9 Jahren.\n\nMehr Infos könnt ihr gern von mir bekommen\nAlles Liebe von \nSylvia \n\nwww.wildnisschule-wolfspfade.de",
        "topic_suggestions": {
            "spacy_NER": [
                "Sonjas",
                "Elzach",
                "Pferde Kinder",
                ".baden"
            ],
            "rake_keywords": [
                "Pferde Kinder Pfingstcamp",
                "Sonjas schönen Hof",
                "Reiter Rallye üben",
                "Elzach 1 Woche",
                "Bogen schiessen Spiel",
                "Wald abends hören",
                "Wald erfreuen",
                "Pferde Unternehmen",
                "Tipi Geschichten",
                "Pferden Ausflüge",
                "Natur versorgen",
                "Spass",
                "Pool",
                "heiss",
                "gemütlich",
                "Feuer",
                "baden",
                "all"
            ],
            "tf_IDF": [
                "Pferde",
                "Wald",
                "Kinder",
                "Pfingstcamp",
                "heiss",
                "versorgen",
                "Elzach"
            ],
            "LDA": [],
            "NMF": [
                "Pferde"
            ],
            "common_topics": [
                "Elzach",
                "Pferden Ausflüge",
                "Pfingstcamp",
                "Sonjas",
                "Natur versorgen",
                "Wald erfreuen",
                "Pferde Kinder",
                "Tipi Geschichten",
                ".baden",
                "gemütlich",
                "Feuer",
                "Pferde Unternehmen",
                "Pool",
                "all",
                "Spass",
                "heiss"
            ],
            "chosen_topics": [
                "Pferde Kinder Pfingstcamp",
                "Pfingstcamp",
                "Pferde Kinder"
            ]
        },
        "timestamps": [
            {
                "date1": "2023-05-29",
                "clock1": null,
                "date2": null,
                "clock2": null
            },
            {
                "date1": "2023-06-03",
                "clock1": null,
                "date2": null,
                "clock2": null
            }
        ]
    },
    {
        "message": "Es gibt noch ein paar letzte Plätze für junge Menschen zwischen 12-18 Jahre in unserem  Wildniscamp über Pfingsten 🏔🌸🐿️🧘🏽‍♀️🙏🏽🐚🌲🌲🌿\nWir treffen uns wie die alten Waldkulturen um das Feuer, Bushcraften, Schnitzen, Schießen Bogen, Kochen um den Feuertopf, Tanzen, Musizieren und vor allem spielen wir richtig coole Koop-Waldspiele! Am Ende der Woche gibt es noch die Chance für eine Visionsnacht alleine im Wald 🦉.\n\nAuch cool, wir werden für dieses wildnispädagogische Abenteuer von den Baden-Württemberg Stiftung gefördert! Seid herzlich willkommen zusammen dem Wald zu lauschen und neue Freunde zu treffen!\n29.05.-05.06. / nahe St. Peter, Südlicher Schwarzwald / alle weiteren Infos zum Konzept, Team, Teilnahme etc. unter Erdbewegung.org\nLiebe Grüße,\nLaureen, Mona, Julian und Rubén",
        "topic_suggestions": {
            "spacy_NER": [
                "Baden-Württember",
                "Pfingsten",
                "Koop-Waldspiele"
            ],
            "rake_keywords": [
                "paar letzte Plätze",
                "wildnispädagogische Abenteuer",
                "Visionsnacht alleine",
                "Schießen Bogen",
                "junge Menschen",
                "alten Waldkulturen",
                "18 Jahre",
                "Woche gibt",
                "Württember",
                "Wildniscamp",
                "Waldspiele",
                "Wald",
                "treffen",
                "Tanzen",
                "spielen",
                "Schnitzen",
                "Pfingsten",
                "Musizieren",
                "Kochen",
                "Feuertopf",
                "Feuer",
                "cool",
                "Chance",
                "Bushcraften",
                "Baden"
            ],
            "tf_IDF": [
                "Wildniscamp",
                "Waldkulturen",
                "junge",
                "Bushcraften,",
                "Baden-Württember"
            ],
            "LDA": [],
            "NMF": [
                "Bushcraften"
            ],
            "common_topics": [
                "Wildniscamp",
                "Pfingsten",
                "Bushcraften,",
                "alten Waldkulturen",
                "Schießen Bogen",
                "Schnitzen",
                "Feuertopf",
                "Baden-Württember",
                "Koop-Waldspiele",
                "Musizieren",
                "Visionsnacht alleine",
                "wildnispädagogische Abenteuer",
                "junge Menschen",
                "Tanzen",
                "Kochen",
                "18 Jahre",
                "cool",
                "treffen",
                "spielen",
                "Woche gibt",
                "Chance"
            ],
            "chosen_topics": [
                "Wildniscamp über Pfingsten",
                "Wildniscamp",
                "wildnispädagogische Abenteuer",
                "Bushcraften",
                "Bushcraften,"
            ]
        },
        "timestamps": [
            {
                "date1": "2023-05-29",
                "clock1": "05:06",
                "date2": "2023-06-05",
                "clock2": "05:06"
            }
        ]
    },
    {
        "message": "❌Nach der Elternzeit wieder zurück in deinen alten Job? -Niemals!\n\n💫Hey, ich bin Mareen, Mama von 2 Jungs und selbstständig mit Energiearbeit und Online-Coaching für Mütter. \n\n🚀Derzeit führe ich Interviews, um eine tiefgründige 1:1 Begleitung zu erstellen, die Mütter dabei unterstützt ihre beruflichen Ziele zu verfolgen.\n\n🫶Als Dankeschön vergebe ich insgesamt 10 kostenlose Coaching-Sessions, in denen wir deine Situation ganzheitlich ergründen und deine nächsten Schritte planen.\n\nWeitere Infos findest du auch hier:\nhttps://www.instagram.com/p/Cp7eXCjtgHO/?utm_source=ig_web_copy_link\n\n👋Melde dich gern, wenn du dich hier wiederfindest oder leite es an eine andere Mama weiter.\n\n🤍Ich freue mich von dir zu hören!",
        "topic_suggestions": {
            "spacy_NER": [],
            "rake_keywords": [
                "Situation ganzheitlich ergründen",
                "Mütter Derzeit führe",
                "Mütter dabei unterstützt",
                "tiefgründige 1",
                "Niemals Hey",
                "Dankeschön vergebe",
                "beruflichen Ziele",
                "alten Job",
                "2 Jungs",
                "1 Begleitung",
                "Coaching",
                "verfolgen",
                "Sessions",
                "selbstständig",
                "Online",
                "Mareen",
                "Mama",
                "Interviews",
                "erstellen",
                "Energiearbeit",
                "Elternzeit"
            ],
            "tf_IDF": [
                "Mütter",
                "Interviews,",
                "Job",
                "ergründen",
                "Online-Coaching",
                "Mama",
                "vergebe"
            ],
            "LDA": [],
            "NMF": [
                "Mütter",
                "Niemals"
            ],
            "common_topics": [
                "Mama",
                "Niemals Hey",
                "Online-Coaching",
                "Interviews,",
                "Elternzeit",
                "Mareen",
                "selbstständig",
                "tiefgründige 1",
                "alten Job",
                "Energiearbeit",
                "1 Begleitung",
                "Dankeschön vergebe",
                "ergründen",
                "Sessions",
                "beruflichen Ziele",
                "Mütter",
                "verfolgen",
                "2 Jungs",
                "erstellen"
            ],
            "chosen_topics": [
                "Online-Coaching",
                "Coaching-Sessions",
                "Energiearbeit",
                "Elternzeit"
            ]
        },
        "timestamps": [
            {
                "date1": "2023-06-02",
                "clock1": null,
                "date2": null,
                "clock2": null
            }
        ]
    },
    {
        "message": "Stell dir vor, wir verbringen zusammen eine Woche auf einem Boot und im türkis-blauen Wasser.\n \nKommen immer wieder gemeinsam neu im JETZT an und in der Verbindung mit uns selbst. Sind miteinander verbunden und gleichzeitig frei.\n \nStell dir vor, wir floaten und schnorcheln im warmen, kristallklaren Wasser und irgendwann kommt der Moment und sie sind da. DIE DELFINE.\n \nDein Atem stockt kurz und dein Herz ebenfalls. Es ist so weit und du begegnest jetzt echten, freien Delfinen. Wirst mit ihnen in ihren ultrahohen Frequenzen SEIN.\n \nAhnst du, wie es sich anfühlt, wenn dir ein Delfin mitten ins Herz sieht? Wenn sein Sonar-Sound dich berührt? Wenn du mit ihm bist ... mit all dem was JETZT ist. Und wie du spürst, wie etwas in dir überfließt vor Liebe und Glück?\n\nMöchtest du diesen Traum erleben?\n\n💗 am 18.Juni gehen wir an Bord 💗\n\n#Delfinretreat in Ägypten\n#Lichtarbeit auf dem Meer\n#Akasha\n#Liebe\n#SEIN \n\n💗",
        "topic_suggestions": {
            "spacy_NER": [
                "Stell dir"
            ],
            "rake_keywords": [
                "Atem stockt kurz",
                "gleichzeitig frei Stell",
                "kristallklaren Wasser",
                "verbringen zusammen",
                "miteinander verbunden",
                "irgendwann kommt",
                "Herz ebenfalls",
                "gemeinsam neu",
                "freien Delfinen",
                "Stell",
                "Woche",
                "warmen",
                "Verbindung",
                "türkis",
                "schnorcheln",
                "Moment",
                "floaten",
                "echten",
                "DELFINE",
                "Boot",
                "begegnest"
            ],
            "tf_IDF": [
                "Wasser",
                "Stell",
                "stockt"
            ],
            "LDA": [],
            "NMF": [
                "Wasser"
            ],
            "common_topics": [
                "verbringen zusammen",
                "türkis",
                "Boot",
                "kristallklaren Wasser",
                "stockt",
                "schnorcheln",
                "floaten",
                "Stell dir",
                "miteinander verbunden",
                "DELFINE",
                "freien Delfinen",
                "begegnest",
                "irgendwann kommt",
                "Woche",
                "gemeinsam neu",
                "Verbindung",
                "warmen",
                "Moment",
                "Herz ebenfalls",
                "echten"
            ],
            "chosen_topics": [
                "Delfinretreat in Ägypten",
                "Lichtarbeit auf dem Meer",
                "Delfinretreat",
                "Lichtarbeit"
            ]
        },
        "timestamps": [
            {
                "date1": "2023-06-18",
                "clock1": null,
                "date2": null,
                "clock2": null
            }
        ]
    },
    {
        "message": "Heilwochenende in den Vogesen\n\nAn diesem Wochenende verbinde ich meine drei Schwerpunkte Vergebung, Verbundenes Atmen und das Schwitzhüttenritual zu einem kraftvollen, transformierenden Ganzen. Von Donnerstag bis Sonntag kannst du eintauchen in das, was dich bewegt und wobei du dir Unterstützung wünschst. Sei es von mir, der Gruppe, deinem höheren Selbst oder dem Göttlichen.\nIm geschützten Rahmen kannst du\n> ganz bei dir ankommen\n> Stress abbauen\n> anstehende Themen klären\n> einen tieferen Zugang zu dir bekommen\n> deine Selbstheilungskräfte aktivieren\n> Eintauchen in die Verbindung mit der Natur und dem Göttlichen\n> dich feiern und genießen\n \nDatum: Do, 22. bis So, 25. Juni (Sommersonnenwende)\nLeitung: Hina Fruh\nKosten: Seminarbeitrag 280 €\nplus 280 € für Unterkunft, Essen, Holz und Nebenkosten\n(Ermäßigung auf Anfrage)\n\nOrt: Maison de la Lune in Ban-Sur-Meurthe-Clefcy\n(40 km hinter Colmar, 100 km von Freiburg)\n \nWeitere Informationen und Anmeldung hier:\nhttps://www.tipping-methode.de/termine/?id=5439\n \nOder telefonisch: 0761 477 41920 und per E-Mail: info@hinafruh.de\n \nIch freue mich auf dich!\n \nHerzliche Grüße\nHina\n ",
        "topic_suggestions": {
            "spacy_NER": [
                "Vogesen"
            ],
            "rake_keywords": [
                "Unterstützung wünschst Sei",
                "geschützten Rahmen kannst",
                "Sonntag kannst",
                "Wochenende verbinde",
                "Verbundenes Atmen",
                "transformierenden Ganzen",
                "tieferen Zugan",
                "wobei",
                "Vogesen",
                "Schwitzhüttenritual",
                "kraftvollen",
                "höheren",
                "Heilwochenende",
                "Göttlichen",
                "Gruppe",
                "eintauchen",
                "Donnerstag",
                "bewegt"
            ],
            "tf_IDF": [
                "Themen",
                "anstehende",
                "Verbundenes",
                "klären",
                "Atmen",
                "ankommen",
                "abbauen"
            ],
            "LDA": [],
            "NMF": [
                "klären",
                "Themen",
                "Schwerpunkte",
                "wobei",
                "Vergebung"
            ],
            "common_topics": [
                "Vogesen",
                "Schwerpunkte",
                "Verbundenes Atmen",
                "Heilwochenende",
                "Vergebung",
                "Schwitzhüttenritual",
                "transformierenden Ganzen",
                "kraftvollen",
                "Wochenende verbinde",
                "eintauchen",
                "anstehende",
                "ankommen",
                "abbauen",
                "Göttlichen",
                "tieferen Zugan",
                "Donnerstag",
                "Sonntag kannst",
                "bewegt",
                "höheren",
                "Gruppe",
                "wobei",
                "Themen",
                "klären"
            ],
            "chosen_topics": [
                "Heilwochenende in den Vogesen",
                "Heilwochenende",
                "Schwitzhüttenritual",
                "Vergebung",
                "Verbundenes Atmen"
            ]
        },
        "timestamps": [
            {
                "date1": "2023-06-25",
                "clock1": null,
                "date2": null,
                "clock2": null
            }
        ]
    },
    {
        "message": "Heilwochenende in den Vogesen\n￼\nAn diesem Wochenende verbinde ich meine drei Schwerpunkte Vergebung, Atem und das Schwitzhüttenritual zu einem kraftvollen, transformierenden Ganzen verbinden. Von Donnerstag bis Sonntag kannst du eintauchen in das, was dich bewegt und wobei du dir Unterstützung wünschst. Sei es von mir, der Natur, deinem höheren Selbst oder dem Göttlichen.\n \nDatum: Do, 22. bis So, 25. Juni (Sommersonnenwende)\nLeitung: Hina Fruh\nKosten: Seminarbeitrag 280 € plus 280 € für Unterkunft, Essen, Holz und Nebenkosten\nOrt: Maison de la Lune in Ban-Sur-Meurthe-Clefcy\n(40 km hinter Colmar, 100 km von Freiburg)\n \nWeitere Informationen und Anmeldung hier:\nhttps://www.tipping-methode.de/termine/?id=5439\n \nOder telefonisch: 0761 477 41920\n \nIch freue mich auf dich!\n \nHerzliche Grüße\n\nHina\n ",
        "topic_suggestions": {
            "spacy_NER": [
                "Vogesen",
                "Unterkun"
            ],
            "rake_keywords": [
                "Unterstützung wünschst Sei",
                "transformierenden Ganzen verbinden",
                "Hina Fruh Kosten",
                "Wochenende verbinde",
                "Sonntag kannst",
                "Göttlichen Datum",
                "wobei",
                "Vogesen",
                "Unterkun",
                "Schwitzhüttenritual",
                "Natur",
                "kraftvollen",
                "höheren",
                "Heilwochenende",
                "eintauchen",
                "Donnerstag",
                "bewegt",
                "Atem"
            ],
            "tf_IDF": [
                "280",
                "Datum:",
                "Leitung:",
                "Natur,",
                "Seminarbeitrag",
                "Sommersonnenwende",
                "Hina",
                "Fruh"
            ],
            "LDA": [],
            "NMF": [
                "280",
                "Sommersonnenwende",
                "Hina",
                "Unterkun"
            ],
            "common_topics": [
                "Vogesen",
                "Heilwochenende",
                "Sommersonnenwende",
                "Schwitzhüttenritual",
                "Atem",
                "Hina",
                "kraftvollen",
                "280",
                "Natur,",
                "Unterkun",
                "Wochenende verbinde",
                "Datum:",
                "eintauchen",
                "Leitung:",
                "Göttlichen Datum",
                "Seminarbeitrag",
                "Donnerstag",
                "Sonntag kannst",
                "wobei",
                "bewegt",
                "Fruh",
                "höheren"
            ],
            "chosen_topics": [
                "Heilwochenende",
                "Sommersonnenwende",
                "Schwitzhüttenritual",
                "Vergebung",
                "Atem"
            ]
        },
        "timestamps": [
            {
                "date1": "2023-06-25",
                "clock1": null,
                "date2": null,
                "clock2": null
            }
        ]
    }
]